,Unnamed: 0,Time,Text,Sentiment
1049,1049,2019-01-21 23:58:55+00:00,"officalappl nalu tech you t represent apple, ios t accept cydia","[50.53247563576566, 19.323003266978567, -9.781945279762013]"
1050,1050,2019-01-21 23:58:48+00:00,"sometimes, i learn things make say “why didn’t anyone tell me?” that thing today the fact black gryphn the actress plays apple bloom made michael jackson cover album","[26.09011359155527, 38.53453846758815, 2.130477474281278]"
1051,1051,2019-01-21 23:58:48+00:00,madhtr i clearly remember first rpg it the bard tale our apple iigs. before i primarily adventure game girl.,"[40.170497102535, 29.840844049330187, -9.35229521352555]"
1052,1052,2019-01-21 23:58:47+00:00,new year gift giveaway win apple ipad,"[10.964652547916632, 15.51903832605872, -10.816207236924853]"
1053,1053,2019-01-21 23:58:46+00:00,i mainly listen home my iphone apple podcasts,"[8.768501846384336, 8.69293365670515, -10.485145101051089]"
1054,1054,2019-01-21 23:58:45+00:00,do u change name your apple watch?? asking for...me,"[-1.9905269506417895, -7.221817257838147, -10.677627761077218]"
1055,1055,2019-01-21 23:58:44+00:00,what your favorite apple iphone ? apple iphone plus gb factory unlocked g lte ios wifi smartphone | ebay,"[21.075318084961655, 18.48573424765094, -12.126939504007055]"
1056,1056,2019-01-21 23:58:42+00:00,sr “you know apple id”? no...,"[20.930614022705868, 10.476865669872176, -11.511895385817148]"
1057,1057,2019-01-21 23:58:40+00:00,usb charger cord ft lightning cable apple iphone plus s price . iphone apple device music ios ad entrepreneur sponsored charger iphonecharger samsung samsungcharger,"[62.53541092811097, 48.67506818688962, 2.354169178916905]"
1058,1058,2019-01-21 23:58:35+00:00,"jeremyburge i’ve long felt way, appreciating night sight wanting better low light apple. your tweet really clicked me.","[39.603358834955834, 29.121346948812104, 0.9789105442933561]"
1059,1059,2019-01-21 23:58:31+00:00,"kirstyleanneuk i usually tea chamomile good sleep apple cider, lemon juice, honey, herbs. and maybe shot whiskey i feeling especially yucky . the best part that makes feel better you sick, working daycare i sick a lot","[14.389418157744576, 20.46742391022012, -18.331578491015833]"
1060,1060,2019-01-21 23:58:30+00:00,nevvveeeerrrr apple crumble i don’t want,"[-1.7527920532951058, -2.4329500718627526, -11.239402400288874]"
1061,1061,2019-01-21 23:58:28+00:00,goodnotesapp every time i try download goodnotes starts download then says “unable download app”? i already goodnotes i updated as instructed the apple store,"[49.28542575121883, 38.57657580662344, -7.7268030309354145]"
1062,1062,2019-01-21 23:58:26+00:00,apple didnt help another day without cellular phone,"[-4.604547335277448, -2.6126498372304927, -11.514937252722142]"
1063,1063,2019-01-21 23:58:24+00:00,naruto dragon ball cases apple iphone,"[20.031800652467947, 18.887838052885243, -10.638284793006186]"
1064,1064,2019-01-21 23:58:22+00:00,biasedfalafel cheddar cheese apples,"[21.02180844977041, 10.478195498350441, 0.9286652466554095]"
1065,1065,2019-01-21 23:58:22+00:00,"griffindavidso moulik nanda gnr griveous tailosivetech no, misunderstand. i t want ios run android, vice versa, i want apple step its drm like airplay. that a great first step airdrop needs be unlocked work all android windows devices since all support wifidirect. thats i want","[34.16136769521335, 30.37125960659354, -9.508896505998095]"
1066,1066,2019-01-21 23:58:21+00:00,jdiaz linimentcake tbq cmon jorge...apples oranges. can’t believe tried equate two...sad,"[-2.5915447026222465, -0.5687668591130159, -11.507885162005262]"
1067,1067,2019-01-21 23:58:17+00:00,remember back ‘ janeanegarofalo made fun fiona apple having eating disorder selling patriarchy? i sure do. so i sure fuck don’t need scolding mean louisck. i’d also like for him to be left alone.,"[35.670867506957926, 7.755263874098077, 0.7021780488628764]"
1068,1068,2019-01-21 23:58:15+00:00,the . inch gb apple ipad pro back to black friday pricing imore,"[28.851444055425194, 18.15052435440792, -9.843180310018937]"
1069,1069,2019-01-21 23:58:14+00:00,"finding tablet pen months it lost, week buying apple pencil","[31.912746381560094, 51.06126739733245, -9.276326121854794]"
1070,1070,2019-01-21 23:58:13+00:00,"wolf lexcosta henmazzig person a apples = oranges person b your similarities don’t make sense seem far fetched person a you can’t say person b yes, i can. here’s [explains why] person a you can’t say [writes a fake pointless discussion] person b [dumbfounded]","[40.77219206198367, 37.575210864088305, 2.6748325624987643]"
1071,1071,2019-01-22 23:59:58+00:00,stevex drbarnard lol feedback channels apple,"[22.0263405315762, 19.20766467973156, -10.418942803829538]"
1072,1072,2020-10-15 14:23:37+00:00,"sick slow charging? switch anker nano get mind blowing charging speeds. anker nano w output fast charge new iphone, ipad, apple watch and airpods still small enough fit your pocket.","[79.3746888472631, 79.2116720411734, -10.450064778330002]"
1073,1073,2019-01-22 23:59:52+00:00,davemark why cars like porsche get expensive every generation? a simpler argument why i believe random guy instead warren buffett? berkshire hathaway largest single position in apple. what investment thesis he that better buffett s?,"[59.06319394458051, 93.75917480030812, -10.551346780620932]"
1074,1074,2019-01-22 23:59:51+00:00,"if someone wants buy a candy apple fender jaguar a matching headstock, indentured servitude excess two years not off table.","[-6.099749739028833, 3.2823532429599847, -9.986236728290123]"
1075,1075,2019-01-22 23:59:45+00:00,"appleinsider tim cook davos tim cook too tidy up... he needs focus. he t need davos. he needs people. if was people less with davos, would realize phones nonsense the market size apple wants. he be dreaming the next big thing...","[105.19478505190291, 46.53342587435931, -7.291457908285722]"
1076,1076,2019-01-22 23:59:40+00:00,"apple pay coming more us retailers the coming weeks months, apple announced today target, taco bell, other stores soon support digital payment service....","[69.18165930344412, 48.63028614903331, -7.951186219573245]"
1077,1077,2019-01-22 23:59:39+00:00,told addyson need eat vegetables besides corn she said “ i like apples “ ‍️,"[38.23677857396326, 30.39609982293674, -9.284324648363778]"
1078,1078,2019-01-22 23:59:36+00:00,apple pay on sale now cute pet bracelet life home girl kittycat house,"[27.686031058393286, 6.808754203062364, -11.949821533953767]"
1079,1079,2019-01-22 23:59:35+00:00,"jackmurphyrgr look his dad, apple doesn’t fall far that rotten tree ...","[29.076576978661702, 11.721338750798367, 0.24000414904080003]"
1080,1080,2019-01-22 23:59:32+00:00,apple t alone data confirms smartphone sector slow,"[18.18078924523542, 10.728621063199178, -11.42577523138187]"
1081,1081,2019-01-22 23:59:27+00:00,apple releases multiple cybersecurity updates,"[9.23768304495756, 7.095347255356483, -11.116434508226387]"
1082,1082,2019-01-22 23:59:19+00:00,"you know they say…an apple day ‍️ one thing can always find our house apples — i basically eat one every day thanks sharing yummy apples me, fellow apple lovers, on the...","[25.607597879296566, 38.91286138602054, -11.85390105533618]"
1083,1083,2019-01-22 23:59:16+00:00,"dynamocooligan mixxedzone scoutripley still working apple, daily, get issue resolved their end. hoping s resolved the next days.","[4.725234199366146, 15.328260717961243, -11.02147085967647]"
1084,1084,2019-01-22 23:59:14+00:00,paulbrislen bexgraham sarahhbickerton annagconnell stocard app super handy. that apple pay certainly useful me.,"[7.320650944217403, 18.697862843428695, -11.58764885107739]"
1085,1085,2019-01-22 23:59:07+00:00,"apple ceo tim cook davos world economic forum, does education related interview","[30.31549165978794, 29.261901199208033, -10.90189895698704]"
1086,1086,2019-01-22 23:59:07+00:00,the secret history apple’s first iphone,"[-2.4277621071617785, -3.7161053205427312, -11.012275988175205]"
1087,1087,2019-01-22 23:59:07+00:00,andraydomise that apple t fall far the tree.,"[6.418231625024771, -3.011764060834459, -10.789618581720532]"
1088,1088,2019-01-22 23:59:06+00:00,"apple news apple ceo tim cook davos world economic forum, does education related interview via macrumours","[38.925243105742034, 27.443565752683355, -10.46459837960829]"
1089,1089,2019-01-22 23:59:06+00:00,the secret history apple’s first iphone,"[-2.4277621071617785, -3.7161053205427312, -11.012275988175205]"
1090,1090,2019-01-22 23:59:04+00:00,"apple ceo tim cook davos world economic forum, does education related interview","[30.31549165978794, 29.261901199208033, -10.90189895698704]"
1091,1091,2019-01-22 23:59:01+00:00,one time i took walk nice neighborhood checked apple watch i don’t have fit when a neighbor outside,"[3.149582463901827, 6.1049771506800425, -11.682298338238951]"
1092,1092,2019-01-22 23:58:53+00:00,"bad apples. use your illusion i, guns n roses. . . . . . sour flandersredale duchessedebourgogne cerveja cervejaartesanal beer bier birra cerveza instabeer craftbeer…","[31.719386404044247, 23.29985175081542, -12.299565382297658]"
1093,1093,2019-01-22 23:58:50+00:00,jimcramer apple still innovates. just as visible human eye. a lot going behind the scenes.,"[29.995208253648062, 20.337396871010313, -10.659559645308292]"
1094,1094,2019-01-22 23:58:50+00:00,my high ass concluded blueface reminds of cinnamon guy form apple jacks commercial,"[8.936170576362503, 20.55774287312655, -10.956086698476838]"
1095,1095,2019-01-22 23:58:50+00:00,"chrisxwagner re still bigger uk acts disturbed imagine dragons bigger us acts. not exactly apples apples, brother much love hh","[26.820492034144255, 17.216133136675595, -11.242572664362953]"
1096,1096,2019-01-22 23:58:50+00:00,knowledgevendor christopherneth karolcummins crippledjerk kattykissem justwhatnowwhy republicanfraud misterbumface peterdaou sbhm g apple cider all floating pulp it a cusp froth.,"[23.247518952964786, 10.241314605755669, 0.49716841500096365]"
1097,1097,2019-01-22 23:58:49+00:00,intelligent jewelry go wrist free applewatch necklace apple jewelry tech womensjewelry mensjewelry fashionista fashion fashionable bling love gold rosegold beauty…,"[68.0350548129962, 53.041458141538044, 23.964545379118306]"
1098,1098,2019-01-22 23:58:43+00:00,marcuschown everyone saying won’t buy another only ‘they’re very good anyway’. if was apple we’d keep buying iphones ‍️,"[6.012412944298423, 2.8494137868848237, -11.503114954279411]"
1099,1099,2019-01-22 23:58:41+00:00,"apple product rumors, iphone front camera rating, apple shortcuts, ios .. macworld podcast – macworld","[-1.2934354227281901, 18.576671195706517, -11.313113048125516]"
1100,1100,2019-01-22 23:58:40+00:00,"apple product rumors, iphone front camera rating, apple shortcuts, ios .. macworld podcast – macworld","[-1.2934354227281901, 18.576671195706517, -11.313113048125516]"
1101,1101,2019-01-22 23:58:40+00:00,"apple product rumors, iphone front camera rating, apple shortcuts, ios .. macworld podcast – macworld","[-1.2934354227281901, 18.576671195706517, -11.313113048125516]"
1102,1102,2019-01-22 23:58:39+00:00,new giveaway jewishladyblog enter win . gift card apple,"[20.187505835631665, 26.3548627261449, -10.57831358511666]"
1103,1103,2019-01-22 23:58:39+00:00,davemark i bet real money apple be around longer this guy job a forbes contributor.,"[-4.551704878040705, -2.7826306535325647, -10.8905364327115]"
1104,1104,2019-01-22 23:58:38+00:00,apple ÷ carmel dip chips n salsa = happy skinny fat kid,"[30.65018214936983, 8.123811824996729, -12.760396428100464]"
1105,1105,2019-01-22 23:58:35+00:00,yuukibozu i bought model right brand new one yeah it’s pretty nifty. it works me cause i tons apple products it may be the right fit you. do research another good recommendation a surface pro tablet computer.,"[47.62524218350958, 44.002749154095326, -9.867929184290105]"
1106,1106,2019-01-22 23:58:25+00:00,i fucking hate smell cinnamon apple.. that’s exactly wtf room smells like. cinnamon apple smells like spicy armpits me.,"[6.006374268918042, 32.97679378173686, -15.68720551943774]"
1107,1107,2019-01-22 23:58:24+00:00,"my apple watch told to stand up, i laid down. then congratulated for standing winning","[31.67464537892217, 5.876147948900396, -9.888306569552554]"
1108,1108,2019-01-22 23:58:23+00:00,new sealed apple watch series gps white sport band mm silver,"[38.15674159568989, 37.23018842691444, -9.035137021874675]"
1109,1109,2019-01-22 23:58:21+00:00,"it might show survey somewhere, things like don’t seem hit home apple otherwise would’ve made changes years ago . apple goes on about “customer sat”, there seems be giant holes what and how measure.","[52.477957169331226, 13.229819448967717, 2.74146202812328]"
1110,1110,2019-01-22 23:58:18+00:00,my uncle got of jail years called to tell about he saw nigga talking his apple watch how was wildest shit he ever seen his life,"[-4.617684036071618, 10.98900210803366, -7.9948323335486435]"
1111,1111,2019-01-22 23:58:10+00:00,apple you mean tell i purchased new . inch apple ipad pro the pencil the keyboard doesn’t illuminated lights? sis gotta better. i spent . we need guys be slightly innovative...like . just saying. ️fr fr,"[41.16061390764528, 48.83867299468854, 1.2023435965858056]"
1112,1112,2019-01-22 23:57:59+00:00,"marty lederman charlie savage steve vladeck apples oranges. the argument mjs statutory protections structural bias/influence irrelevant appearance personal bias, is issue here. that said, marty lederman suggestion sure is what the govt seemed be saying court.","[97.14671453976418, 120.83006528559469, -9.274641564393406]"
1113,1113,2019-01-22 23:57:58+00:00,geldmannathan they resemble flash drive can charged a usb port. “they look like apple product.”,"[27.825122798562543, -4.063274708810724, -10.450304601271327]"
1114,1114,2019-01-22 23:57:50+00:00,i typed dani n bitch danitza name came ....apple wtf r u champ ‍️,"[9.052349572923656, -0.6498379655763462, -0.8142000681097841]"
1115,1115,2019-01-22 23:57:41+00:00,ellewilson acdavis tomwatson dailykos road apples.,"[8.076986280558696, -2.0787054997597587, -11.162326598341856]"
1116,1116,2019-01-22 23:57:32+00:00,"apple pay coming all us target locations, taco bell restaurants beating target ""wallet"" pretty big apple. kbrs","[63.4456229948189, 40.20239209779926, -9.732990603316566]"
1117,1117,2019-01-22 23:57:29+00:00,golden apple christie palladino csra,"[0.025039771140957567, 7.940413639923795, -11.529625148641667]"
1118,1118,2019-01-22 23:57:26+00:00,"itz me xander me dey talk dem say enor bi commmin apple , dey apple insde cii. dem dey lie gve we","[62.10999556409265, 51.07537858147879, -9.349331900273214]"
1119,1119,2019-01-22 23:57:19+00:00,just added baked apple pie knockin noggin cidery &amp; winery our menu,"[40.72113382474574, 39.81158910047031, -9.487003977186774]"
1120,1120,2019-01-22 23:57:15+00:00,thats my fucking baby my cinammon apple,"[-1.1060515111474303, -2.6833685357484645, -11.35255710672444]"
1121,1121,2019-01-22 23:57:14+00:00,"macrumors beautiful xr right there. i the black. surprised people not know this, start watching more videos like zollo everything apple pro","[16.539738813359225, 2.238399669707206, -11.16974513656423]"
1122,1122,2019-01-23 23:59:57+00:00,she taken phone twice keeps slapping apple watch,"[12.482645336953322, 4.99934442160982, -10.002933378862387]"
1123,1123,2020-10-15 14:23:37+00:00,"sick slow charging? switch anker nano get mind blowing charging speeds. anker nano w output fast charge new iphone, ipad, apple watch and airpods still small enough fit your pocket.","[79.3746888472631, 79.2116720411734, -10.450064778330002]"
1124,1124,2019-01-23 23:59:55+00:00,"ladyheatherlee honestly i’m jazzed apple, it’s basic bitch pies","[34.20096291429923, 3.5419306461114313, 10.986924294676232]"
1125,1125,2019-01-23 23:59:54+00:00,apple watch series mm a rose gold aluminum gps wi fi vg,"[61.49867690376939, 41.247774541217964, -10.785640717048295]"
1126,1126,2019-01-23 23:59:53+00:00,dark burner green apple star aroma,"[7.985160028282917, 13.055876953142938, -10.897931601281925]"
1127,1127,2019-01-23 23:59:51+00:00,"nationalpieday fun the gumby group, apple pie this waltwines pinot noir the famed clos pepe vineyard santa barbara county. this s huge pinot notes black raspberry, black tea, clove blackberry. get pie magee sidehustlewino rr pirate","[99.44759233442342, 116.48348924174392, 4.08442491599466]"
1128,1128,2019-01-23 23:59:51+00:00,libcle mcdonaldsuk omg and tweeted as reply apple pies i’m still over damn janet,"[18.44087108582521, 9.959957032221354, 1.1455699332200666]"
1129,1129,2019-01-23 23:59:50+00:00,dark burner apple pie aroma,"[-1.2794033027120435, 7.3466616836373895, -11.065790775407631]"
1130,1130,2019-01-23 23:59:49+00:00,bad apple is...,"[-0.8139008063471025, 10.210059452800706, -12.46480710255317]"
1131,1131,2019-01-23 23:59:48+00:00,"felipeonodera those some freaky fiends, i hope apple face the gang handle creepy crooks","[29.815125804076825, -3.114778172986633, -0.30912768521321254]"
1132,1132,2019-01-23 23:59:42+00:00,designationsix apple s?,"[0.2481833224551664, 8.856704371797951, -11.711946705435622]"
1133,1133,2019-01-23 23:59:41+00:00,dark burner red apple star aroma ml smart reinigungstuch,"[0.43398880677765983, 13.36391104252781, -11.972766069593781]"
1134,1134,2019-01-23 23:59:40+00:00,"spotify, apple music &amp; youtube, stop streaming and selling r. kelly s music sign petition via change","[50.51967260293153, 38.146234515741966, 2.4172154862627906]"
1135,1135,2019-01-23 23:59:31+00:00,ate of apple is longer tooting maybe..... healthie?,"[-3.918141324962053, -1.872678746800823, -11.072208933123932]"
1136,1136,2019-01-23 23:59:30+00:00,new gold sprint gb apple iphone plus smart cell phone dh b,"[41.724404195117664, 59.17187253636741, -9.76225348164023]"
1137,1137,2019-01-23 23:59:29+00:00,"apple watch series mm a gray aluminum cellular, gps, wi fi vg","[40.04151903596632, 29.848326331798802, -11.352180169228248]"
1138,1138,2019-01-23 23:59:24+00:00,"j.j. abrams disney, universal, apple, netflix bidding him quartz","[21.958185940211308, 22.570894935843363, -10.600816494566892]"
1139,1139,2019-01-23 23:59:21+00:00,apple music always stealing money you’re your brokest point,"[10.636879370141425, 8.599159818547243, -10.918716325043746]"
1140,1140,2019-01-23 23:59:18+00:00,basil apple cinnamon smoothie recipe ritualandroutine,"[23.615319590924056, 42.29909423565741, -10.645205235850753]"
1141,1141,2019-01-23 23:59:15+00:00,apple set release three new phones,"[6.627220073684438, 14.254299166516638, -10.15066865562899]"
1142,1142,2019-01-23 23:59:08+00:00,lorenpratt omg i thought i the one lol they say i’m crazy i’m like well sometimes apple that spotify don’t vice versa,"[8.745182589379286, 20.294348823124253, 1.0258213944480161]"
1143,1143,2019-01-23 23:59:04+00:00,ain’t ready give apple another every month icloud. mane. im tired that notification saying it’s backed up...,"[24.7042964897084, 17.884073087960402, -10.476339171449581]"
1144,1144,2019-01-23 23:59:03+00:00,apple selling iphone se for cnet,"[9.69103884211992, -2.039633185208118, -12.090374069577706]"
1145,1145,2019-01-23 23:59:00+00:00,"totoys last call leather apple watch band , kindle voyage ,","[15.960688591770623, 28.183031819539615, -9.697118591623124]"
1146,1146,2019-01-23 23:59:00+00:00,"totoys last call leather apple watch band , kindle voyage ,","[15.960688591770623, 28.183031819539615, -9.697118591623124]"
1147,1147,2019-01-23 23:58:55+00:00,"apple lot magic keyboards mouse, trackpads and more mw","[9.415541442174554, -2.1140403514569717, -11.373280749581276]"
1148,1148,2019-01-23 23:58:54+00:00,iphone se again available from apple clearance site – mac rumors,"[4.7366508464163575, 4.866836799186217, -10.993953316797032]"
1149,1149,2019-01-23 23:58:53+00:00,iphone se again available from apple clearance site – mac rumors,"[4.7366508464163575, 4.866836799186217, -10.993953316797032]"
1150,1150,2019-01-23 23:58:52+00:00,iphone se again available from apple clearance site – mac rumors,"[4.7366508464163575, 4.866836799186217, -10.993953316797032]"
1151,1151,2019-01-23 23:58:48+00:00,tadsebastian did know can make payments the wallet actions? i this split bills my girlfriend venmo it could used apple pay,"[13.584764256548898, 6.194110535617753, -10.101815340172337]"
1152,1152,2019-01-23 23:58:43+00:00,"really like bake pies, started the webcomic check please almost worked a bakery because i brought apple hand pies my interview the pay low / i like cooking too but........ im tired","[40.79583692530729, 28.632493637763545, 1.2011182046022242]"
1153,1153,2019-01-23 23:58:41+00:00,apple struggling but the come was real,"[8.555747780985168, -2.547383632392695, -0.045154698949197325]"
1154,1154,2019-01-23 23:58:37+00:00,"iam erica i in same boat. got turned onto apple ecosystem summer was hooked right away. iphone, ipad, macbook watch. just bought galaxy note go along em","[58.7669972489192, 51.55470947561729, -7.749425881691636]"
1155,1155,2019-01-23 23:58:36+00:00,did know cut cords old apple headphones make your own airpods. then pretend hear anyone drive like threat to others life ez clout.,"[34.46959020948572, 35.68635825646541, -8.43755264796043]"
1156,1156,2019-01-23 23:58:35+00:00,justinryoung in hell i buy album without subbing apple music? seriously make stupidly difficult. or else i get it?,"[24.638755463596357, 12.278164090436775, 12.546638719991321]"
1157,1157,2019-01-23 23:58:29+00:00,"henrikfisker fiskerinc same .. working automotive designs apple imac great see i finished for yyctransport &amp; cityofcalgary calgarypolice &amp; rcmpalberta cc jtreliving policing support automotive legislation design ""license plate box design"" = visibility= design image","[62.727179154365906, 47.99541846730048, -10.131974285629]"
1158,1158,2019-01-23 23:58:28+00:00,papipeyote apple lol,"[-1.0402552486609686, -3.858931100505608, -11.2086258073237]"
1159,1159,2019-01-23 23:58:28+00:00,snooksosa the apple watch honestly best present i ever received. i can’t survive without,"[-0.7889045926848965, -3.430874252564934, -14.457036394067714]"
1160,1160,2019-01-23 23:58:25+00:00,"chrislhayes no profitable model digital anything... intel, microsoft, apple &amp; google already told everyone internet free..","[29.372135341597403, 30.99722902218143, -10.767023227994812]"
1161,1161,2019-01-23 23:58:23+00:00,gothdogs literally wanted price apples apply oranges was mad they t it lol,"[27.56320917474272, 20.035001841223917, -10.976285980832714]"
1162,1162,2019-01-23 23:58:21+00:00,"macrumors rsgnl there some people really like smell screen, i hope apple realize soon as possible i don’t know i’m going do whenever iphone die","[4.892153748201356, -5.197941045461064, -12.453728460117546]"
1163,1163,2019-01-23 23:58:17+00:00,anyone has apple ear pods,"[5.891903693494133, 7.08129784557223, -10.553703150768747]"
1164,1164,2019-01-23 23:58:17+00:00,apple watch series mm a space gray aluminum gps fr,"[39.612544699467215, 28.492434323465503, -10.26419148692122]"
1165,1165,2019-01-23 23:58:10+00:00,how you like apples? lmao,"[-1.707335332292007, -3.0557870518982395, -11.216189809951526]"
1166,1166,2019-01-23 23:58:09+00:00,iam erica the awful windows millinium it me. i became machead my first ipod...and then...well know rest. rocking my latest device....apple watch series .,"[36.56368536253232, 51.15758620188865, -11.30245023716786]"
1167,1167,2019-01-23 23:58:07+00:00,see would start working but don’t an apple watch annoy everyone my post workout stats honesty what’s point,"[15.785897791801592, 24.046824047512644, -9.997035434706078]"
1168,1168,2019-01-23 23:58:07+00:00,come find google play apple podcasts,"[-3.533850790271198, -4.843054389388634, -10.717431812049682]"
1169,1169,2019-01-23 23:58:04+00:00,kaileytaylo my favorites angry orchards dark blue apple cider then reds blueberry ale,"[52.87467132111779, 44.77937241217556, 11.820340465980351]"
1170,1170,2019-01-23 23:58:04+00:00,"jonatanbarron applesupport not apple, that’s epic games","[-1.3837106323852162, -0.6518306455293161, -12.202149627230568]"
1171,1171,2019-01-23 23:58:03+00:00,creagendow burgerking would like apple pie that also florida represent,"[21.14364766033702, 19.034446347082202, -10.768396963492052]"
1172,1172,2019-01-23 23:58:01+00:00,calling of apple iphone se lovers there ...,"[17.86253565601181, -1.4041694197158567, -11.94091876638791]"
1173,1173,2019-01-24 23:59:57+00:00,it’s weird going new country one haven’t lived in a while adapting prices. i legitimately no idea much apple costs only the avg price a kebab honestly i’m afraid find now.,"[23.270205103109976, 21.142753856084497, -2.0204139482760723]"
1174,1174,2020-10-14 13:52:48+00:00,"sick slow charging? switch anker nano get mind blowing charging speeds. anker nano w output fast charge new iphone, ipad, apple watch and airpods still small enough fit your pocket.","[79.3746888472631, 79.2116720411734, -10.450064778330002]"
1175,1175,2019-01-24 23:59:55+00:00,i voted teamapplemusic thetylt—i stream music apple music,"[10.948190221669446, 18.01742264798471, -10.834824348839277]"
1176,1176,2019-01-24 23:59:54+00:00,apple and sony already this ad years ago.,"[9.020697326440175, 16.89709975060157, 0.7363422332612259]"
1177,1177,2019-01-24 23:59:48+00:00,jon clabo fried apple pie a must matter full are.,"[20.93200929297583, 26.484247684956983, -10.667619622636352]"
1178,1178,2019-01-24 23:59:47+00:00,do apple music users always come spotify users necks ??? pay same price u goose,"[53.67758672602961, 52.18373346151698, 2.8682432852505997]"
1179,1179,2019-01-24 23:59:46+00:00,lost apple pen,"[8.236234504743095, 10.847488906248383, -11.545363855669521]"
