,Unnamed: 0,Time,Text,Sentiment
0,0,2019-01-01 23:59:56+00:00,plsgib apple juice,"[-0.15728178565300088, 7.758092083129837, -11.424264632983846]"
1,1,2020-10-15 14:23:37+00:00,"sick slow charging? switch anker nano get mind blowing charging speeds. anker nano w output fast charge new iphone, ipad, apple watch and airpods still small enough fit your pocket.","[79.3746888472631, 79.2116720411734, -10.450064778330002]"
2,2,2019-01-01 23:59:52+00:00,apple patents depict three new products that could transform tech brand,"[18.306660810441567, 17.991952924596085, -10.004809727566936]"
3,3,2019-01-01 23:59:49+00:00,armorsuit apple watch screen protector review series via youtube,"[14.20795257921488, 4.663228627694224, -9.946872010944816]"
4,4,2019-01-01 23:59:44+00:00,"a reasonably priced monitor photography editing bigger issue holding from building photography editing rig windows . i’m really love macos, really don’t see a system i’m happy in apple’s current lineup.","[97.38704647360552, 52.153411463496596, -1.7174378509468369]"
5,5,2019-01-01 23:59:43+00:00,the first abomination panerabread taking away apple cinnamon muffins,"[7.687776735616954, 18.47953980231533, -10.57810774011481]"
6,6,2019-01-01 23:59:43+00:00,"from hush hush apple meeting mysterious executive departures, the important tech stories business insider reported","[27.799371529758798, 5.2987922909804155, -10.786344841277526]"
7,7,2019-01-01 23:59:43+00:00,"erin bartram americanatheist apples oranges, give what you a real question be asked, it a fact poor people have less resources create opportunity.","[43.34889113948187, 28.985097872511716, -9.705336479193619]"
8,8,2019-01-01 23:59:41+00:00,i spent minutes working with apple health. loseit,"[-5.760099925582639, -3.993103544810602, -10.669944902086392]"
9,9,2019-01-01 23:59:41+00:00,i spent minutes working with apple health. loseit,"[-5.760099925582639, -3.993103544810602, -10.669944902086392]"
10,10,2019-01-01 23:59:40+00:00,saying here first. apple juice underrated,"[7.6459692993392965, 17.963554656267057, -10.886812751776297]"
11,11,2019-01-01 23:59:35+00:00,"cosmicfunkonaut pat rt dosnostalgic so, this game, reason remember differently would that apples either color monochrome. the monochrome tends be green, hence the memory.","[68.73451073272251, 73.00307968198983, -7.767854810578243]"
12,12,2019-01-01 23:59:25+00:00,did apple retail prices get high ? consumers say yes. applenews technologynews technology technews millennials tuesdaythoughts technologies newyearsresolution happynewyear mondaymotivaton ipadpro ipadpro iphone iphonexs,"[40.43885413777444, 31.008222064559902, 2.402319726629713]"
13,13,2019-01-01 23:59:25+00:00,"mylesgorham i t see type help often you make out sound. to say remmers help laughable. in fact compton the lesser the evils season imo. apples oranges i guess. as i said, let re visit in july. you see a competition that lt spot.","[31.69864560791196, 31.937732160719108, 3.7397217127854248]"
14,14,2019-01-01 23:59:24+00:00,ronlinkins johansanchez pragmtcsanction churchofsatan rustyfable ooraidersoo bryanjfischer someone needs do research.....who first person the call evil bible commit sin lie fake god the so called apple with adam eve lol,"[22.47261908693041, 11.97267383668084, -10.461083740151722]"
15,15,2019-01-01 23:59:20+00:00,"burnerwill giantinsider raiders buccaneers jaguars you a point, eli apple comes mind...","[20.93158592848258, 8.415017361651948, -10.971586599934682]"
16,16,2019-01-01 23:59:19+00:00,apple juice orange juice?,"[10.336295333625667, 18.251669202408507, -11.029423131236761]"
17,17,2019-01-01 23:59:09+00:00,kenjeong el tigre chino dishing some knowledge west side there an emoji i’d use but it’s clearly awesome that apple forgot add xd,"[27.562828465507256, 13.48323032171713, -12.528738809797929]"
18,18,2019-01-01 23:59:03+00:00,netflix kills app subscriptions apple hardware,"[31.63930252160149, 30.19011391256036, -10.131526543102346]"
19,19,2019-01-01 23:59:01+00:00,especially baudelaires get apples offer to the islanders ishmael prevents when he’s immune no one else,"[14.621824260572598, 29.841382386376246, -9.712958265450908]"
20,20,2019-01-01 23:58:58+00:00,literally love new walkie talkie app the apple watch. i annoy robinsonashton / now.,"[7.672921782000732, 14.184454166135893, -11.987636065280071]"
21,21,2019-01-01 23:58:51+00:00,"applesupport since release ios , apple keyboard doesn’t work my . ipad pro. it appears be known issue. is anything done? i went the apple store. they willing give a new keyboard except they longer carry them?","[76.13785717619031, 91.3436823681506, -6.434357731199768]"
22,22,2019-01-01 23:58:41+00:00,"the love of my life, my sunshine, the apple of my eye,","[17.889231947181212, 6.653684177560642, -11.542074570166761]"
23,23,2019-01-01 23:58:37+00:00,"to apple my eye, may birthday filled lots indulging goodies year. daughter, remind of birthday cake; are full of…","[20.320413801921806, 13.676072564838051, -10.858508926908527]"
24,24,2019-01-01 23:58:36+00:00,random dumber generator what happened to apple in ?,"[4.337475215778359, 6.783509538125813, -10.433169450836168]"
25,25,2019-01-01 23:58:33+00:00,"reedsscott birdz stone notre dame gets preferential treatment getting their p games home home guarantee games home. also, g schools can’t schedule than p games, nd schedule . apples oranges.","[80.25700653103375, 47.993786446851075, 3.3507514166077073]"
26,26,2019-01-01 23:58:31+00:00,tellmytales soy apple.,"[9.617431321505844, 9.519449199571305, -11.088218626188134]"
27,27,2019-01-01 23:58:31+00:00,iamdrkk baderxeea mkbhd so? it shows you use apple music an android.,"[9.673988253119315, 5.799101735253991, -10.5702860412269]"
28,28,2019-01-01 23:58:30+00:00,nick boyd power move changing to apple butter,"[26.56643242344857, 17.259895007566442, -10.12369735770804]"
29,29,2019-01-01 23:58:27+00:00,"notre dame gets preferential treatment getting their p games home home guarantee games home. also, g schools can’t schedule than p games, nd schedule . apples oranges.","[68.37713505063515, 46.171624624836355, -8.529120063790899]"
30,30,2019-01-01 23:58:25+00:00,stabbed face the stick my candy apple pierced when i want in for bite,"[5.927215151886775, 19.107350063876694, -10.997077998369278]"
31,31,2019-01-01 23:58:14+00:00,guys i think i flexed hard apple airpods my year old co workers have too,"[6.504609267816865, 10.357429058962012, -11.542543068808328]"
32,32,2019-01-01 23:58:11+00:00,"carlruiz pie wins it versatile. chicken pot pie, shepard pie, apple pie, pecan pie.....","[44.0076010854489, 62.345347525097665, -9.989039836458389]"
33,33,2019-01-01 23:58:05+00:00,apple watch? ️ trumpet? ️ puppster,"[-0.8632873819928844, -2.3300199280406653, -11.413641026622763]"
34,34,2019-01-01 23:58:01+00:00,happy new year celebrating making first tsvetaeva apple pie scratch. tsvetaevaapplepie homemade scratchbaking applepie tsvetaeva,"[12.85858196750856, 26.43172536677929, -13.163914091392513]"
35,35,2019-01-01 23:58:00+00:00,vegan high protein apple pie smoothie pie,"[23.39109467801502, 52.57313196325374, -10.798611157385452]"
36,36,2019-01-01 23:58:00+00:00,owlpharaohx apple pie,"[-0.4449638581047808, 8.163557191238004, -11.306481597327458]"
37,37,2019-01-01 23:57:57+00:00,bigsparklybows sounds like apple needs mind fucking business,"[-2.743316119198961, 2.8302864713564584, -11.614105505889533]"
38,38,2019-01-01 23:57:50+00:00,also here’s reminder giveaway any information need it be this tweet on the discord server stream streamer giveaway twitch twitchtv apple itunes itunescard,"[60.345740461614106, 50.888480503605734, -8.396827895941911]"
39,39,2019-01-01 23:57:49+00:00,"“for intents purposes, we’re years year process moving analog digital,” said tim bajarin, a longtime tech consultant companies including apple, ibm microsoft. digitaldisruption futureofwork","[61.36807217094755, 51.7853314856969, -8.595601047737944]"
40,40,2019-01-01 23:57:48+00:00,always remember tuck apple mac before going sleep,"[-5.667423727849804, 5.309562555912315, -10.336946950787016]"
41,41,2019-01-01 23:57:47+00:00,summarized one bar. this apple ready drop? spx es stocks,"[-1.4926260125085122, -2.470981322045269, -11.783711448432356]"
42,42,2019-01-01 23:57:42+00:00,"petermarteka contents molten lava, artificial cherry apple flavoring, extremely artificial food coloring, incredibly artificial ingredients preserve, color, flavor, texture, vitamin c. imlovinit","[37.50841194923665, 45.099123397897976, -12.501830483854263]"
43,43,2019-01-01 23:57:39+00:00,on sale iphone xs max screen protector tempered glass [edge edge protection] apple iphone xs max,"[43.35743258839734, 52.991421890975325, -11.619481044080516]"
44,44,2019-01-01 23:57:39+00:00,haven’t heard apple alarm sound weeks.. tomorrow morning looking painful.,"[20.872490985738413, -3.144509027715117, 0.3376852705883451]"
45,45,2019-01-01 23:57:33+00:00,johnnyzcash lol apple juice apple pie apple sauce. all apple everything,"[13.500334403876185, 24.976641182739627, -10.640351014871541]"
46,46,2019-01-01 23:57:32+00:00,callherlisa omg other person made caramel/chocolate apple rolled a cheeto crumble. i’m literally shook,"[20.954186334597072, 10.586027539785917, 0.759030971544874]"
47,47,2019-01-01 23:57:23+00:00,idleconxn enjoyrntomorrow apple cant keep damn charge,"[9.266466611287253, -0.9631560813196747, -11.877117468549926]"
48,48,2019-01-01 23:57:23+00:00,"eloyg loganwimberly warcookman dannykanell against team playing recievers db... all those teams mention played better teams lsu, their full, very close full, rosters. apples orangea","[47.52850104954371, 24.939974839050635, -9.54524588664863]"
49,49,2019-01-01 23:57:22+00:00,having apple watch makes feel like secret agent,"[-3.8629754479798804, -1.1551471809929343, -12.073455287291374]"
50,50,2019-01-01 23:57:20+00:00,everyone talking his apple belt why his head small,"[5.720825829402448, -1.5526109285564336, 0.879913164015349]"
51,51,2019-01-02 23:59:59+00:00,he’d prescribe apples i dont keep away,"[6.970348583286904, 9.6681098888678, -10.906559934507435]"
52,52,2020-10-14 13:52:31+00:00,"sick slow charging? switch anker nano get mind blowing charging speeds. anker nano w output fast charge new iphone, ipad, apple watch and airpods still small enough fit your pocket.","[79.3746888472631, 79.2116720411734, -10.450064778330002]"
53,53,2019-01-02 23:59:58+00:00,anshelsag apple that plus also a saturated market less discernible reason the average user upgrade,"[38.45416307085462, 20.744468898000093, -10.782667125374857]"
54,54,2019-01-02 23:59:57+00:00,"so much genius investing.. apple drop costs warren buffett . billion, adding struggles berkshire portfolio","[53.982275372215646, 62.80723225152214, -10.645418171588489]"
55,55,2019-01-02 23:59:57+00:00,"dear apple i told rising iphone prices not solution, try innovate affordable prices record sales return tim cook cue pschiller usd an iphone europe? are serious? that’s everyone changing. wake up","[60.88947038385671, 49.90123015967352, 15.215475660041434]"
56,56,2019-01-02 23:59:56+00:00,drudge report anyone thought apple would the inexplicable panache china it enjoyed past tense hasn been paying attention.,"[15.88234391502441, 15.063438303435845, -11.111848644516996]"
57,57,2019-01-02 23:59:55+00:00,tomwarren agreed. apple also too many products within category odd pricing. the macbook pro escape about same price the new air. too many iphone models odd names... etc.,"[90.2458423005286, 43.95308667256704, -9.526246405208028]"
58,58,2019-01-02 23:59:52+00:00,amonickk swaveyvicc that’s the reason stay w apple music go,"[-2.945018626133769, -4.087448410412534, -11.355009543840069]"
59,59,2019-01-02 23:59:52+00:00,apple cider~,"[-0.8632873819928844, -2.3300199280406653, -11.413641026622763]"
60,60,2019-01-02 23:59:50+00:00,the iphone always going plateau eventually. what’s next? and apple the one deliver it?,"[17.32927894911882, 18.20258333582953, -10.220822517352033]"
61,61,2019-01-02 23:59:49+00:00,"on ""trends you"" right now, ""apple"" followed ""curb your enthusiasm."" indeed.","[-2.258302383545664, 16.69853584787085, 0.19864969078896166]"
62,62,2019-01-02 23:59:49+00:00,"apple cuts holiday sales forecast iphone china weakness, stock falls wallstreet apple sales forecast iphone china usa","[66.42910464397238, 102.91319409886303, -8.228158849590685]"
63,63,2019-01-02 23:59:45+00:00,apple says cheap battery replacements hurt iphone sales via verge,"[17.2439272545241, 19.5488649287781, -11.83167460659537]"
64,64,2019-01-02 23:59:42+00:00,"when tech innovators lose entrepreneurial edge, decline sets in. in apple case i think ll slow decline, s a great company the ballsy &amp; seemingly irrational it nothing the sort bets jobs t you get the corporate manager class.","[86.0920390826313, 80.04588384214021, -8.136730919628988]"
65,65,2019-01-02 23:59:41+00:00,"apple cuts forecast, citing weak china sales amid trade tensions","[32.96946242701436, 43.20496532579789, -0.19245011109234156]"
66,66,2019-01-02 23:59:40+00:00,"shameermulji ""apple asked wechat other chinese social apps disable tip functions"" turns out, apple missing forest trees the whole time.","[52.034381500743585, 47.83616064590595, -10.492434527593943]"
67,67,2019-01-02 23:59:40+00:00,"""apple says cheap battery replacements hurt iphone sales"" apple yep, cure de jeneusse","[18.06771588652035, 29.34929486749681, -11.561996247802313]"
68,68,2019-01-02 23:59:40+00:00,summerxx i bet knockoffs last long as the real apples,"[6.472021086751501, 7.235260662937421, -10.303286658509492]"
69,69,2019-01-02 23:59:37+00:00,"apple cuts forecast, citing weak china sales amid trade tensions by reuters","[32.66386711167576, 42.91691394746594, -0.07524034594354134]"
70,70,2019-01-02 23:59:36+00:00,guyadami hey guy all talk on apple doesn’t anyone point mr. cook said apple projecting record earnings per share? isn’t that important anymore?,"[15.634190605992348, 11.02026224622982, -9.652023582072545]"
71,71,2019-01-02 23:59:35+00:00,amonickk what aesthetic? apple music the worst user interface any app i’ve ever used,"[25.797202403408395, 28.764709898227117, -11.895051198586799]"
72,72,2019-01-02 23:59:33+00:00,[sad] expect apple give military wives free iphone shitamericanssay,"[10.189467357634125, 7.892368184706932, -11.361944364780989]"
73,73,2019-01-02 23:59:31+00:00,"siri dying. long live susan bennett ""an interview the woman gave apple voice, a preview what to come."" via typeform blog","[51.38427116126089, 39.82242954778229, 2.1432446655363435]"
74,74,2019-01-02 23:59:29+00:00,apple ciroc apple juice a deadly mix,"[12.303347542544433, 18.81374983352255, -11.131140995722625]"
75,75,2019-01-02 23:59:29+00:00,"if powerline’s iconic i i apple music, can’t equally iconic supernova girl protozoa be on too?","[-1.2871102706526714, 16.525855990348646, 0.22412684552737971]"
76,76,2019-01-02 23:59:29+00:00,a tried tested yummy mid week family meal sticky maple pork loin apples familyrecipe porkrecipe mealplanning,"[42.28419582295787, 49.28951974064108, -11.530239345917892]"
77,77,2019-01-02 23:59:27+00:00,"apple plunges guidance iphone sales disappoint via yahoofinance “while anticipated challenges key emerging markets, did foresee magnitude the economic deceleration, particularly greater china,” cook said a statement.","[19.295673509770555, 39.27286043316731, 12.125035643358856]"
78,78,2019-01-02 23:59:27+00:00,"ashleyrcarman that last bit “same ios everyone else” part that, i think, hurting apple. by more consumer friendly prolonging the life upgradability old phones, they’re killing the sales their more expensive devices.","[42.56875251671379, 33.343357349569956, -1.9233878031040916]"
79,79,2019-01-02 23:59:26+00:00,"that what happens you t innovate over charge. apple blames emerging markets cause former problems t exist, the slowdown would been less of an issue at all.","[50.94676123946025, 7.953231121773527, 1.5971601498077206]"
80,80,2019-01-02 23:59:25+00:00,"installed unit base grown m they b cash the balance sheet. they could sacrificed margins &amp; ramped discounting, maintained discipline instead. aapl aapl apple stockmarket","[60.43757785054627, 52.50120633997368, -9.933276095828504]"
81,81,2019-01-02 23:59:25+00:00,"for of who a multi year time horizon, consider investing money apple stock. the company announced iphone sales decelerated than anticipated greater china &amp; trade tensions haven’t helped. yet...","[51.179767808531544, 71.24839932872644, 15.468243633207592]"
82,82,2019-01-02 23:59:24+00:00,taylor swift’s silence apple’s guidance cut deafening,"[10.77566199340951, 10.132949250235331, -12.624377577852275]"
83,83,2019-01-02 23:59:22+00:00,"breathtaking, blindsiding, whiplashing quickly trillion dollar cap euphoria apple dissolved this apple finished panic this hours plunge, stock down three months. read shiraovide this aapl iphone china timcook","[44.562139745062915, 48.933402975414154, -9.620875000106096]"
84,84,2019-01-02 23:59:21+00:00,apple a terrible company i could never justify spending a thousand a phone,"[27.52894783975633, 20.897583550412563, -12.266450648223028]"
85,85,2019-01-02 23:59:21+00:00,hey. apple think perhaps latest iphone hit ceiling how much consumers willing pay,"[26.524424057796185, 39.613939857845565, -10.144715037058361]"
86,86,2019-01-02 23:59:20+00:00,"the vvmobile news sorry i took long upgrade, apple","[-7.2096322882665715, -0.9734639271646306, -11.768398760121464]"
87,87,2019-01-02 23:59:19+00:00,"terrine de canard fruits automnes homemade duck terrine pistachios port wine, accompanied celery ragu, garnished pumpkin apple chutney. the perfect autumn appetizer. try autumn foodie","[53.87862229004758, 99.0222322545501, 37.24777037005563]"
88,88,2019-01-02 23:59:19+00:00,"therecgoes in general, i lot more things the android. apple simple easy use t do a lot personalization. they had pros &amp; cons, i not stupid say something status. if something what you need use.","[8.497401356877038, -7.116105543100176, -11.406495315319304]"
89,89,2019-01-02 23:59:19+00:00,apple fy first quarter results conference call,"[10.566761588775588, 30.00694216504888, -10.550624588762311]"
90,90,2019-01-02 23:59:19+00:00,apple fy first quarter results conference call intheloop,"[10.566761588775588, 30.00694216504888, -10.550624588762311]"
91,91,2019-01-02 23:59:17+00:00,"""apple cuts revenue forecast because slow sales china"" jack nicas via nyt","[29.501443961274152, 32.612076940880854, -11.299857680195018]"
92,92,2019-01-02 23:59:15+00:00,apple aapl lowers q guidance street insider via street insider,"[17.429110967023565, 26.055175953373, -10.126999504787143]"
93,93,2019-01-02 23:59:15+00:00,"one more time its still christmas in my house bokjoona are like. apple eye....so pretty funny....an angel.....talking always makes feel soft happy, thank so much being my friend im grateful, thank you for lovely","[12.999865766681484, 38.23308223714396, -16.826354887122207]"
94,94,2019-01-02 23:59:15+00:00,"hello? yeah, i m on the train... c lettersdesk greatbritain apple","[8.177845646666515, 8.523962883504467, -10.656510420258996]"
95,95,2019-01-02 23:59:15+00:00,"apple warns profound ""economic deceleration"" china","[-0.15728178565300088, 8.451239263689784, -11.424264632983842]"
96,96,2019-01-02 23:59:15+00:00,"pastor cj throwing down. steamed broccoli, potatoes &amp; onions, fried apples baked barbecue pork chops.","[99.03447197730502, 59.639485890715626, 1.822153162337841]"
97,97,2019-01-02 23:59:11+00:00,"arunjaitley arunji, i beg differ. only fools compare apple oranges.","[20.76223154574431, 20.041251532656403, -10.334195074632461]"
98,98,2019-01-02 23:59:11+00:00,"lakecitynelly cbsnews seems like didn read article, the problem that aren buying new devices. apple make ios awesome only put on x newer phones.","[-6.8736763322718515, -0.3850770907455545, -11.62144547349304]"
99,99,2019-01-02 23:59:10+00:00,the apple watch series one really a later model the ipod nano a strap tbh,"[40.13726623816735, 39.28655416981714, -9.759420284222486]"
100,100,2019-01-02 23:59:09+00:00,xtragiveaways fast iphone xs giveaway to enter . retweet . follow us . turn notifications winner hour good luck giveaway apple iphone,"[73.0961555241031, 72.7738572261317, -10.442043220553145]"
101,101,2019-01-02 23:59:08+00:00,scottwapnercnbc this apple specific issue. nobody i know buying new phones. zero innovation resulting zero reason buy new devices. broader market selloff initially recover. this my cents this subject.,"[49.81289611153793, 62.128620372874664, -9.05064463991944]"
102,102,2019-01-03 23:59:55+00:00,apple music trial ends tomorrow um we,"[20.821907319876903, 8.526773893414898, -10.764710661648664]"
103,103,2020-10-14 13:52:48+00:00,"sick slow charging? switch anker nano get mind blowing charging speeds. anker nano w output fast charge new iphone, ipad, apple watch and airpods still small enough fit your pocket.","[79.3746888472631, 79.2116720411734, -10.450064778330002]"
104,104,2019-01-03 23:59:53+00:00,trueu sofiahbell i t anything apple. never have. goes back the rothchilds.,"[14.991124519637946, -2.4020155688854037, -10.518921135276265]"
105,105,2019-01-03 23:59:53+00:00,kinda wanna buy apple music because watch the throne on and on spotify,"[-7.0349110852948185, 5.344229709658961, 1.9512822014145144]"
106,106,2019-01-03 23:59:52+00:00,"specialreport it comes apple losing billion, did expect? china t need technology much anymore. they it now. hopefully prices start drop.","[73.47474240156217, 42.83493601450576, 0.6644052455132936]"
107,107,2019-01-03 23:59:48+00:00,"apple is just the start trump econ advisor warns pain coming for ""heck of a lot"" us companies","[4.784082589984384, 6.576964606887685, -10.703536713906189]"
108,108,2019-01-03 23:59:47+00:00,nikerunning coach marathon available apple watch?,"[19.220434540470233, 18.464393111989047, -10.505748757646714]"
109,109,2019-01-03 23:59:46+00:00,so i drop podcast apple spotify people hitting up telling that volume low apple i suggest louder volume ya listen it spotify idk that happening tbh ya,"[51.7955599614122, 53.65300184514028, 12.410317903213311]"
110,110,2019-01-03 23:59:45+00:00,cnnbusiness cnnbrk apple taken advantage us. i don’t feel sorry them.,"[5.637585458735775, 10.021569162694995, -12.711473728753184]"
111,111,2019-01-03 23:59:42+00:00,valentinblary fcairpods harry potter et les ruptures de stocks d’apple,"[43.372784193595585, 52.2514433783835, -9.731996170514002]"
112,112,2019-01-03 23:59:42+00:00,"nbcnews stop blaming apple the realdonaldtrump shituation are in. this all the tariffs winning supposed be overwhelmed by.. s much gop winning, shouldn have endure anymore. trump created blame him.","[71.62964789751047, 35.58328295630689, -0.5087043639400264]"
113,113,2019-01-03 23:59:41+00:00,till day i’m still sick took the popcaan version controlla apple music.,"[-8.57197857742501, 7.642006456116391, -12.219657157747164]"
114,114,2019-01-03 23:59:41+00:00,is much apple be with imessage smh... simple little features could probably develop within day could drastically improve communication the whole society.,"[31.134535423551046, 27.963526443911405, 0.13445230540452258]"
115,115,2019-01-03 23:59:40+00:00,seaveydaniel did get apple juice?,"[-2.7992290564564604, -3.8096602634146355, -10.956012947123355]"
116,116,2019-01-03 23:59:38+00:00,dow jones drops points apple forecast adjustment u.s. stocks plummeted… news,"[44.44832314965414, 43.99750773063138, -10.25653299011536]"
117,117,2019-01-03 23:59:38+00:00,apple shares close nearly lower sales warning,"[38.87807206762247, 30.972236675660177, -11.708722983307638]"
118,118,2019-01-03 23:59:37+00:00,apple woes show us china taking hits trade war — that could push to make deal,"[29.834727067850654, 29.989139740173144, 1.3272354767802454]"
119,119,2019-01-03 23:59:37+00:00,can anyone rolandsmartin lazlothebuzz slimfast explain me apple iphone x type the word boy on predictive text this the emoji pops “ “ epicfail,"[43.38012539418104, 34.40954011196989, 3.9626462037280845]"
120,120,2019-01-03 23:59:34+00:00,"so far i figured use instagram stories, use iphone x, use new iwatch, i set apple pay. i’m learning how to use technology my generation slowly surely.","[46.28913655955909, 53.21325499661059, -7.11233566026938]"
121,121,2019-01-03 23:59:33+00:00,apple to pull some iphones from german stores after qualcomm enforces ban,"[16.32098281782834, 25.37319312349929, -9.300543428982678]"
122,122,2019-01-03 23:59:31+00:00,"is apple finally starting see people finally getting tired , every year two?","[-5.78657163206105, -6.648886424732908, -11.31831831730139]"
123,123,2019-01-03 23:59:30+00:00,"pink genuine leather thin apple watch strap mm, mm, mm, mm apple watch band series women apple watch band accessories watch girls leather band valentinesday yes pink anniversary applewatch","[54.338957309139396, 85.64431117600476, -6.781402030404635]"
124,124,2019-01-03 23:59:29+00:00,roxenini wait. i don’t use apple music i use tidal. i don’t see option ughhh,"[19.058924654890514, 15.84655995145323, 0.9548681182358223]"
125,125,2019-01-03 23:59:27+00:00,alliee apples hahahaha know you right wake up it’s,"[7.590421079102929, 16.254507965878318, -10.606887316462114]"
126,126,2019-01-03 23:59:23+00:00,apple escapes class action over security flaw fixes,"[16.733224058722488, -0.6241851880533962, -11.136640725849766]"
127,127,2019-01-03 23:59:23+00:00,an ex apple engineer created brilliant new iphone software would make apple jealous — take look,"[31.84016730820979, 28.75331218752956, 9.753503772385528]"
128,128,2019-01-03 23:59:22+00:00,invest apple it’s wayyyy down. it’ll go back by time drop other bullshit.,"[4.900380094110443, 7.057713793838978, -10.688367986164813]"
