,Unnamed: 0,Time,Text,Sentiment
235,235,2019-01-14 00:30:08+00:00,"oil industry company, royal dutch shell, completed sale its shares shell entities new zealand austrian company, omv, . million.","[59.012952389397775, 88.997223068954, 13.381534855186288]"
236,236,2019-01-15 21:19:05+00:00,"customer operations specialist german – umzug nach krakau, polen company description royal dutch shell a global group energy petrochemicals companies, operating over countries territories employing than… neuvoo bremerhaven","[80.24030916450114, 119.64450564989447, 3.549378295007884]"
237,237,2020-09-28 15:04:50+00:00,"our next rnabenchbedside speaker hardly needs introduction. don miss hearing n lorem founder ceo ionis founder executive chairman the board, drstanleycrooke. register attend natureconf today","[47.89572620600869, 21.31396692234739, -11.81298254471514]"
238,238,2019-01-15 20:47:12+00:00,. eps expected royal dutch shell plc rds.a,"[22.87141602874114, 42.56283118393688, -11.078285197020186]"
239,239,2019-01-15 20:46:59+00:00,analysts see . eps royal dutch shell plc rds.a,"[22.248672488771167, 31.864678408483584, -11.013746675882622]"
240,240,2019-01-15 20:13:56+00:00,"british dutch oil gas company royal dutch shell dutch pension fund manager pggm considering joint bid dutch producer supplier natural gas eneco, is heavily invested sustainable energy projects.","[79.48436342496804, 119.03317802489964, -10.080805265523068]"
241,241,2019-01-15 19:46:08+00:00,"customer operations specialist german – umzug nach krakau, polen company description royal dutch shell a global group energy petrochemicals companies, operating over countries territories employing than… neuvoo bremerhaven","[80.24030916450114, 119.64450564989447, 3.549378295007884]"
242,242,2019-01-15 19:45:25+00:00,"paulkrugman no, i said about time yesterday. not enough followers pay attention. while are it ""shell oil company the us based wholly owned subsidiary royal dutch shell, transnational corporation ""oil major"" anglo dutch origins""","[10.651371655510292, 26.72164617113431, -9.471181202582457]"
243,243,2019-01-15 19:22:05+00:00,"customer operations specialist german – umzug nach krakau, polen company description royal dutch shell a global group energy petrochemicals companies, operating over countries territories employing than… job erlangen neu","[80.57858998071572, 119.4895047793497, 3.483404593563634]"
244,244,2019-01-15 19:18:24+00:00,climate protectors amsterdam earthstrike protest demanding decrown royal dutch shell . ontkroonshell,"[11.26636820501442, 21.575676945379534, -11.580286128062586]"
245,245,2019-01-15 19:08:32+00:00,royal dutch shell plc transaction own shares,"[31.716056264511234, 32.328765260143285, -10.683852678496457]"
246,246,2019-01-15 17:43:04+00:00,"customer operations specialist german – umzug nach krakau, polen company description royal dutch shell a global group energy petrochemicals companies, operating over countries territories employing than… job erlangen neu","[80.57858998071572, 119.4895047793497, 3.483404593563634]"
247,247,2019-01-15 15:43:42+00:00,"royal dutch shell plc rdsa.l, ,.p, outperform, tp ,.p sysco corporation syy, us ., outperform, tp us targa resources corp trgp, us ., outperform, tp us the hershey company hsy, us ., neutral, tp us .","[56.98060519756343, 67.04119989509887, -9.233304255282107]"
248,248,2019-01-15 15:25:33+00:00,"customer operations specialist german – umzug nach krakau, polen company description royal dutch shell a global group energy petrochemicals companies, operating over countries territories employing than… neuvoo bochum","[80.24030916450114, 119.64450564989447, 3.549378295007884]"
249,249,2019-01-15 11:07:08+00:00,"customer operations specialist german – umzug nach krakau, polen company description royal dutch shell a global group energy petrochemicals companies, operating over countries territories employing than… neuvoo bremerhaven","[80.24030916450114, 119.64450564989447, 3.549378295007884]"
250,250,2019-01-15 11:01:07+00:00,"customer operations specialist german – umzug nach krakau, polen company description royal dutch shell a global group energy petrochemicals companies, operating over countries territories employing than… neuvoo bottrop","[80.24030916450114, 119.64450564989447, 3.549378295007884]"
251,251,2019-01-15 11:00:01+00:00,"""if is ever need a global player energy, should shell."" ben van beurden, ceo royal dutch shell.","[32.17907971656731, 52.33502681973199, -10.1644244717464]"
252,252,2019-01-15 10:09:05+00:00,"customer operations specialist german – umzug nach krakau, polen company description royal dutch shell a global group energy petrochemicals companies, operating over countries territories employing than… neuvoo chemnitz","[80.24030916450114, 119.64450564989447, 3.549378295007884]"
253,253,2019-01-15 08:57:05+00:00,amg amg advanced metallurgical group n.v. ... benelux morning notes amg highlights frankfurt roadshow. royal dutch shell playing dutch card tendering eneco. staffing sector hays q/ update; trend remained solid. wereldhave ceo…,"[36.047944153351445, 83.62104310727382, 1.3762325012838943]"
254,254,2019-01-15 08:23:02+00:00,"customer operations specialist german – umzug nach krakau, polen company description royal dutch shell a global group energy petrochemicals companies, operating over countries territories employing than… neuvoo bottrop","[80.24030916450114, 119.64450564989447, 3.549378295007884]"
255,255,2019-01-15 06:36:34+00:00,critical review sandridge energy sd versus royal dutch shell rds.a,"[35.32529203452723, 54.29674875171236, 1.2078680513930848]"
256,256,2019-01-15 06:30:17+00:00,"ersakthivel itisprashanth which exactly happened the dmk years. ford, hyundai, renault, nissan, daimler, royal enfield, bmw, motorola, nokia, sansung, foxconn, dell, royal dutch shell. the list keeps growing. tamil nadu t sit top coal like karnataka.","[32.27118900119371, 45.68212975739865, -9.574074368672427]"
257,257,2019-01-15 06:00:13+00:00,"funder and i sure mcdonald’s loved free publicity in europe’s monarchies, companies get royal seal like royal dutch shell . now mcd received presidential seal “mcdonald’s. official supplier the white house”. nice one, donnie boy. free cheese burgers ya","[66.20017643789136, 67.5611679530911, -12.218383592954282]"
258,258,2019-01-15 05:31:02+00:00,barclays reduced royal dutch shell rdsa target price gbx – bharatapress – barclays bank,"[22.475062600984227, 30.983344551677277, -11.054574717247782]"
259,259,2019-01-15 05:28:50+00:00,royal dutch shell plc voting rights capital,"[22.62163192213239, 41.57554470231087, -11.002306409614995]"
260,260,2019-01-15 05:19:31+00:00,royal dutch shell plc transaction own shares,"[31.716056264511234, 32.328765260143285, -10.683852678496457]"
261,261,2019-01-15 00:10:25+00:00,pension fund service provider pggm gas giant royal dutch shell plc formed dutch consortium explore opportunity buy local utility eneco,"[44.35955897461736, 46.31275062377803, 0.14575834790187514]"
262,262,2019-01-16 21:16:53+00:00,can royal dutch shell cash flows remain consistent?,"[20.746984793098566, 21.531388405564527, -11.490659177528926]"
263,263,2020-10-28 21:54:28+00:00,we need help what carbon fiber project we next? maybe workshop countertop? or it a custom computer desk? we’ll show for free to make own using stone coat epoxy stonecoatcountertops epoxy diy carbonfiber,"[61.07332697262111, 71.4773952578365, 2.832428183824547]"
264,264,2019-01-16 21:15:07+00:00,can royal dutch shell cash flows remain consistent?,"[20.746984793098566, 21.531388405564527, -11.490659177528926]"
265,265,2019-01-16 21:06:06+00:00,can royal dutch shell’s cash flows remain consistent?,"[9.560260493259957, 10.344664105725919, -11.885500679276007]"
266,266,2019-01-16 21:01:08+00:00,can royal dutch shell cash flows remain consistent?,"[20.746984793098566, 21.531388405564527, -11.490659177528926]"
267,267,2019-01-16 20:59:06+00:00,can royal dutch shell cash flows remain consistent?,"[20.746984793098566, 21.531388405564527, -11.490659177528926]"
268,268,2019-01-16 18:34:14+00:00,royal dutch shell plc transaction own shares,"[31.716056264511234, 32.328765260143285, -10.683852678496457]"
269,269,2019-01-16 18:06:49+00:00,"poll answer drumroll … there actually listings the ftse the index consists companies, there listings, royaldutchshell both a b class shares listed. wednesdaywisdom","[29.195321724179625, 22.32676070971776, 1.2873236903045466]"
270,270,2019-01-16 15:25:42+00:00,"chris saltmarsh sheffielduni ...royal dutch shell total sa totalling £.m within £.m endowment funds derive . . their turnover respectively the extraction oil sands, significantly the threshold. please send us dm you would like further details. /","[68.44595075973542, 79.59482146187959, -8.247310563582985]"
271,271,2019-01-16 12:15:47+00:00,"market fallers bunzl plc, associated british foods plc, hargreaves lansdown plc, royal dutch shell plc &amp; unilever plc abf bnzl hl rdsa ulvr","[35.79529566377296, 65.92307432801012, -10.435766957435021]"
272,272,2019-01-16 11:22:58+00:00,how analysts feel about royal dutch shell plc rdsb?,"[8.188227365689979, 21.17246205798237, -11.52262505737177]"
273,273,2019-01-16 11:22:41+00:00,are analysts bearish royal dutch shell plc rdsb after last week?,"[19.801967485004003, 29.721797872249567, -10.440210938931322]"
274,274,2019-01-16 11:22:04+00:00,can analysts adopt bullish outlook royal dutch shell plc rdsb?,"[23.65021496677468, 43.46896954434701, 1.0823594834295847]"
275,275,2019-01-16 09:00:27+00:00,"chevron, total reliance industries backing digital platform crude oil trading based blockchain, joining consortium investors includes bp, royal dutch shell equinor well traders gunvor, mercuria koch supply &amp; trading.","[86.85702940056034, 86.27054811638443, -9.285156355346672]"
276,276,2019-01-16 08:48:10+00:00,"""the important thing innovation to leaders allow mistakes"" gerard penning, senior executive royal dutch shell meritsummit hr conference hrsummit networking development connect","[81.42706645040967, 111.0977478256368, -9.624141471465734]"
277,277,2019-01-16 08:47:26+00:00,"""the underlying set beliefs great leadership starts respect people"" gerard penning, senior executive royal dutch shell meritsummit hr conference hrsummit networking development connect","[57.98901025998569, 73.62641962261871, -12.717260484816705]"
278,278,2019-01-16 08:43:07+00:00,"great leaders discipline around sleep well gerard penning, senior executive royal dutch shell meritsummit hr conference hrsummit networking development connect","[59.43397257291681, 86.29190351124932, -11.283631197801583]"
279,279,2019-01-16 08:42:19+00:00,"""great leaders understand our weaknesses are"" gerard penning, senior executive royal dutch shell meritsummit hr conference hrsummit networking development connect","[57.77505620952713, 88.3609317928924, -10.097795554288439]"
280,280,2019-01-16 08:41:10+00:00,"“great teams great people collaborate respect other’s skills” gerard penning, senior executive royal dutch shell meritsummit hr conference hrsummit networking development connect","[59.93937475939039, 87.02078814152723, -12.746635093496593]"
281,281,2019-01-16 08:39:58+00:00,"“great leaders build bridges people different they are. they know they are not perfect anything."" gerard penning, senior executive royal dutch shell meritsummit hr conference hrsummit networking development connect","[83.642724348974, 86.36976898786088, -9.891340329157956]"
282,282,2019-01-16 08:39:24+00:00,"butane market projected be around usd . billion ; china petroleum chemical corporation sinopec , royal dutch shell plc., china national petroleum corporation cnpc , total s.a., linde, air liquide","[70.18140904224607, 109.44924850480345, -9.089343105006478]"
283,283,2019-01-16 08:38:58+00:00,"british dutch oil gas major royal dutch shell pggm, pension fund company, intend jointly purchase electricity company eneco, subsidiary eneco groep. shell eneco","[78.89393326111562, 90.03999277126637, 1.6797970769897148]"
284,284,2019-01-16 08:33:55+00:00,"leaders drive performance ones first foremost understand the people work them. gerard penning, senior executive royal dutch shell meritsummit hr conference hrsummit networking development connect","[55.962964375991, 87.3406971473837, -10.273282157790433]"
285,285,2019-01-16 08:29:20+00:00,"""if overdo it, doesn work"" gerard penning, senior executive royal dutch shell meritsummit hr conference hrsummit networking development connect","[44.70515170217742, 76.47745615286196, -10.37517254884618]"
286,286,2019-01-16 08:26:15+00:00,"live gerard penning, senior executive royal dutch shell meritsummit hr conference","[12.710931603155931, 42.180650960846435, -11.590443140249732]"
287,287,2019-01-16 07:13:58+00:00,"royal dutch shell rdsb pt lowered gbx , investingnews","[11.058672152500552, 21.381991629935264, -11.444879314183261]"
288,288,2019-01-16 06:21:02+00:00,somewhat critical media coverage likely affect royal dutch shell rdsa share price investingnews,"[67.9495788730991, 66.82316021052306, 1.379535788598389]"
289,289,2019-01-16 01:04:33+00:00,"fruitbatoo realchaim rubin rashidgill into jilaans benboos sibrad againstdenial danlivni yoni yonder hudsakeenah methuengena tile loverffreedom msstrper zorrodazz anastasiaklynch malkaavram domainawareness nissatal logicandsanity jdwstangs daviel raviv peppi viewreader dezi oobilly telavivyonatan erezneumark rogsonl cindy finlayson dmonsel thorsprovoni laielkha elqulime baroniesisters mizrahi b lephophora alanedw bluegreenberg wurzel paulmurff rmorgy carlpendleton ladonna pizzagatelibya ricknl judgefudge jackiefields samharrisorg iraq awarded first major post war oil concessions – biggest winners norway, france, china russia. of the eleven contracts signed, one secured a us company, exxon mobil, part a consortium royal dutch shell.","[110.68357071642602, 123.60658451553914, 15.668266635813652]"
290,290,2019-01-17 19:15:32+00:00,"here chairman royal dutch shell, chad halliday. he i spoke a panel energy innovation a theaeic event washington dc morning. also speaking morning energy secretary rick perry congresswoman marcy kaptur","[78.55760529986482, 113.49192015808488, -8.234551473708748]"
291,291,2020-09-28 15:04:50+00:00,"our next rnabenchbedside speaker hardly needs introduction. don miss hearing n lorem founder ceo ionis founder executive chairman the board, drstanleycrooke. register attend natureconf today","[47.89572620600869, 21.31396692234739, -11.81298254471514]"
292,292,2019-01-17 18:54:38+00:00,meijer mark a v liter? good see re filling at royal dutch shell. netherlandsfirst,"[21.035183528735477, 29.174576477594925, -12.149074411578383]"
293,293,2019-01-17 18:35:43+00:00,"weekly royal dutch shell plc rdsa ratings jan ,","[21.552249271779225, 31.87556874921394, -11.05003781243618]"
294,294,2019-01-17 18:02:45+00:00,seems royal dutch shell drilling oil chukchi sea.should i bring the kids?,"[18.912185799186485, 30.879724334624086, -10.47428344620544]"
295,295,2019-01-17 12:45:18+00:00,"royal dutch shell plc appointed wael sawan the new director exploration production, putting in charge the key unit contributes a third the oil major’s net income july shell","[92.27118665267828, 74.08834560952555, -9.35369750297069]"
296,296,2019-01-17 12:32:37+00:00,royal dutch shell plc appointed wael sawan its new upstream director. rt,"[10.90456662562324, 19.678057792916015, -11.16720093191185]"
297,297,2019-01-17 12:29:05+00:00,royal dutch shell plc appointed wael sawan its new upstream director.,"[10.90456662562324, 19.678057792916015, -11.16720093191185]"
298,298,2019-01-17 12:09:21+00:00,"oluchukwuezeonu channelstv you look like smart guy. petrobras, british petroleum bp , royal dutch shell all privately run state based oil companies shares citizens invest in. they also turn profit regularly. nnpc turns loss yearly. yet they fund politics? the idea sound.","[105.46516400592743, 98.02558332913644, 0.9845625721281834]"
299,299,2019-01-17 12:05:37+00:00,wael sawan head upstream unit royal dutch shell royal dutch shell said has appointed…,"[30.977950901395975, 44.81404210714624, -11.287046575440087]"
300,300,2019-01-17 12:02:27+00:00,"transportation fuels looks expand size overseas market | royal dutch shell, saudi arabian oil, sinopec via industrytoday","[54.54016233621656, 34.245861315909615, -11.134599717678228]"
301,301,2019-01-17 12:00:51+00:00,rt com hitler allegedly killed when saw gas bill the us impose sanctions companies like royal dutch shell taking part the nordstream project? royal dutch shell owned royals rothschilds realdonaldtrump any idea he messing with?,"[92.94623216752429, 89.78782908749673, 12.17771867569364]"
302,302,2019-01-17 11:57:43+00:00,"royal dutch shell says it will begin major maintenance work at its , bpd pernis oil refinery in rotterdam from jan for two months","[35.552443136629925, 57.586712791400345, -8.690800329655403]"
303,303,2019-01-17 11:36:04+00:00,wael sawan head upstream unit royal dutch shell,"[20.51479140626444, 22.977625802651456, -11.743905973560885]"
304,304,2019-01-17 11:17:40+00:00,kgaugelosm gwedemantashe this script playing now ken saro wiwa environmental activist executed thug called sani abacha a dictator his crime protesting environmental damage royal dutch shell,"[76.70716778195755, 78.87760555906875, 1.9310117667392177]"
305,305,2019-01-17 07:57:24+00:00,"global naturalgasmarket – oil natural gas corporation ltd, chevron corporation, exxon mobil corporation, petrochina, total sa, eni s.p.a, royal dutch shell more information","[56.048951426246774, 65.79304678712141, -9.78082673375171]"
306,306,2019-01-17 07:40:17+00:00,four international anti graft groups protested plans an of court settlement royal dutch shell rds plc shell nigeria exploration and...,"[63.360138067793976, 64.01297778563547, -9.418023509380333]"
307,307,2019-01-17 07:19:42+00:00,royal dutch shell plc transaction own shares,"[31.716056264511234, 32.328765260143285, -10.683852678496457]"
308,308,2019-01-17 05:59:08+00:00,can royal dutch shell cash flows remain consistent?,"[20.746984793098566, 21.531388405564527, -11.490659177528926]"
309,309,2019-01-17 05:48:03+00:00,i liked youtube video dividend experiment stock the month december royal dutch shell,"[42.427837936649645, 40.6655260949345, -11.248620986140168]"
310,310,2019-01-18 21:16:18+00:00,"chevron, total reliance industries limited join oil blockchain platform vakt global ltd, created by consortium includes oil majors bp royal dutch shell, norway equinor, global energy trading firms mercuria…","[92.21958279666472, 120.62577773970042, 2.586689845632648]"
311,311,2020-09-28 15:04:50+00:00,"our next rnabenchbedside speaker hardly needs introduction. don miss hearing n lorem founder ceo ionis founder executive chairman the board, drstanleycrooke. register attend natureconf today","[47.89572620600869, 21.31396692234739, -11.81298254471514]"
312,312,2019-01-18 20:05:51+00:00,royal dutch shell plc transaction own shares,"[31.716056264511234, 32.328765260143285, -10.683852678496457]"
313,313,2019-01-18 19:26:42+00:00,"tops oil major time charter start royal dutch shell rds.a in january, press release announcing imminent","[73.93608885573514, 64.75613959195447, 2.469194980066476]"
314,314,2019-01-18 17:22:42+00:00,royal dutch shell plc rds.a analysts see . eps,"[22.248672488771163, 31.864678408483584, -11.013746675882615]"
315,315,2019-01-18 16:49:15+00:00,"royal dutch shell heavily investing research development artificial intelligence ai , it hopes provide solutions some its pressing challenges.","[58.05663213840016, 57.53636907828854, 12.791608231127086]"
316,316,2019-01-18 16:01:40+00:00,"global detergent alcohol market outlook | industry top key players – ecogreen oleochemicals, musim mas holdings, royal dutch shell, emery oleochemicals, wilmar international via industrytoday","[98.35869783643427, 99.49404227233202, -9.071992906678318]"
317,317,2019-01-18 15:16:38+00:00,"rds b.n royal dutch shell plc ads cl b evs, avs, ride hailing impact long term u.s. gasoline demand vehicle ownership amara law states we tend overestimate effect a technology the short run underestimate the…","[81.61819497151457, 89.50979979504466, 36.79427187449697]"
318,318,2019-01-18 13:48:33+00:00,"royal dutch shell plc rds.a analysts see . eps; analysts covering dominion energy, inc. d","[22.954678085111045, 30.97879002939601, -10.842048725449743]"
319,319,2019-01-18 12:50:50+00:00,fy earnings estimate royal dutch shell plc adr rds.a issued by piper jaffray companies markets,"[45.775239079359196, 45.71234483143795, 1.4002399440405355]"
320,320,2019-01-18 12:50:50+00:00,fy earnings estimate royal dutch shell plc adr rds.a issued by piper jaffray companies stocks,"[33.89536759896064, 43.89018300942331, -10.47963153635802]"
321,321,2019-01-18 12:29:55+00:00,"market risers schroders/par vtg fpd , royal dutch shell plc, royal dutch shell plc class b, rsa insurance group plc, segro plc &amp; severn trent plc rdsa rdsb sdr sgro svt","[65.08959912953462, 88.0081667261612, 1.2984349034663154]"
322,322,2019-01-18 11:44:25+00:00,"key equity research analysts jp morgan cazenove reconfirmed ‘""overweight""’ rating royal dutch shell rdsb shares today. their target given gbx .","[72.06304212515883, 45.35465393634953, -10.056357852559088]"
323,323,2019-01-18 11:42:11+00:00,"london royal dutch shell rdsa stock has just had its ""overweight"" rating reiterated jp morgan cazenove. shares have gbx . target","[53.22567909864748, 52.433416190013595, -9.781141263596922]"
324,324,2019-01-18 10:55:35+00:00,"propane market intelligence competitive landscape by ; exxonmobil, total s.a, royal dutch shell, sinopec, bp chevron corporation","[36.41884949608846, 65.4831037456708, 1.7562869624598534]"
325,325,2019-01-18 10:50:06+00:00,"royal dutch shell announced plans launch proof concept project will deploy ai enabled drones inspect equipment the shell technology center houston, texas. energy drones uav ai shell kespry","[147.87110584441302, 164.90328913976492, -6.666369763867337]"
326,326,2019-01-18 09:54:08+00:00,h production capital expenditure outlook key planned upstream projects sub/saharan africa / royal dutch shell dominates production an... asdreports energy marketresearch,"[88.71968100781861, 80.19215395348056, 11.505544823692702]"
327,327,2019-01-18 06:58:15+00:00,scpncommissaire emmanuelmacron ephilippepm ccastaner nunezlaurent dgpnericmorvan prefpolice tri lateral commission. banksters world bank royal dutch shell exxon british petroleum. global elites. bilderberg grp. macron one many feathering nests expense masses. global uprising power elites never allow. storm the bastille off their heads,"[54.13734669110071, 75.46631017849288, -9.174070394032114]"
328,328,2019-01-18 06:38:21+00:00,shell investing in artificialintelligence technology harvest clean energy natural resources. energytransition royaldutchshell ai,"[33.44360299667188, 41.54015022624317, -9.872395254049572]"
329,329,2019-01-18 06:31:33+00:00,royal dutch shell plc transaction own shares,"[31.716056264511234, 32.328765260143285, -10.683852678496457]"
330,330,2019-01-18 05:39:32+00:00,the incredible ways shell uses artificial intelligence to help transform the oil and gas giant in post look some innovative ways royal dutch shell using ai accelerate the digital transformation the oil gas giant.…,"[126.9998498490947, 126.82597874952684, 15.672476510419457]"
331,331,2019-01-18 05:39:32+00:00,the incredible ways shell uses artificial intelligence to help transform the oil and gas giant in post look some innovative ways royal dutch shell using ai accelerate the digital transformation the oil gas giant.,"[126.9998498490947, 126.82597874952684, 15.672476510419457]"
332,332,2019-01-18 05:32:59+00:00,the incredible ways shell uses artificial intelligence to help transform the oil and gas giant in post look some innovative ways royal dutch shell using ai accelerate the digital transformation the oil gas giant.,"[126.9998498490947, 126.82597874952684, 15.672476510419457]"
333,333,2019-01-18 05:30:49+00:00,the incredible ways shell uses artificial intelligence to help transform the oil and gas giant in post look some innovative ways royal dutch shell using ai accelerate the digital transformation the oil gas giant.,"[126.9998498490947, 126.82597874952684, 15.672476510419457]"
334,334,2019-01-18 00:36:57+00:00,fatumaabdulahi is qatar all this of generous heart? if where they years ago? qatar royal dutch shell= my guess.,"[29.642499069272123, 30.41912060592354, 1.831571160593029]"
335,335,2019-01-18 00:05:04+00:00,royal dutch shell b eo rc is yet see trading action jan,"[53.67543685973517, 44.01543300277625, -10.202121025742159]"
336,336,2019-01-18 00:03:55+00:00,royal dutch shell a eo rc plunges . jan,"[35.00578803714698, 45.26133168681396, -10.768794927211694]"
337,337,2019-01-18 00:02:50+00:00,royal dutch shell a adr/ rc is yet see trading action jan,"[41.662300376335125, 32.267459728292636, -10.59050621017471]"
338,338,2019-01-19 23:22:12+00:00,"the petroleum handbook third edition royal dutch shell the first edition published , second .","[52.654464600003955, 62.76974568847035, -9.607017861662314]"
339,339,2020-09-03 18:26:48+00:00,"lenovo legion x playapex now your chance rise the rest. unmatched performance, purposeful engineering, modern design. gear with machine savage you are. stylish outside. savage inside.","[75.12134485437876, 53.35074368036726, 1.9353115696088565]"
340,340,2019-01-19 17:54:52+00:00,did know? royal dutch shell plc announced plans sell eight percent interest canadian natural resources limited approximately . billion. energyprocessingmag,"[95.34915974587604, 95.63584670187055, -8.088629513087469]"
