,Time,Text
0,2019-01-01 23:51:55+00:00,"c mon wellsfargo credit card pizza pool float ad, tip the delivery guy ? via youtube"
1,2020-09-28 15:04:50+00:00,"our next rnabenchbedside speaker hardly needs introduction. don miss hearing n lorem founder ceo ionis founder executive chairman the board, drstanleycrooke. register attend natureconf today"
2,2019-01-01 23:51:14+00:00,"roseparade wellsfargo annemarie this sucked bad. i wanted see floats bands, some unknown person lipsyncing."
3,2019-01-01 23:49:49+00:00,"glennthrush gm makes plans close auto plants, harley davidson moving production overseas, carrier still moving mexico, wells fargo bank laying s thousands moving operations offshore, wall street biggest december decline since , whatev say."
4,2019-01-01 23:46:29+00:00,who says elizabeth warren unlikeable? maybe wells fargo executive rightfully skewered a senate hearing?
5,2019-01-01 23:46:22+00:00,malickviews wells fargo agrees million settlement affecting states wake fake accounts via usatoday
6,2019-01-01 23:45:02+00:00,latimes i cannot understand wells fargo still allowed be business. only explanation corruption.
7,2019-01-01 23:44:29+00:00,wells fargo debt collection calls spark class action lawsuit
8,2019-01-01 23:43:09+00:00,it and wells fargo still bank
9,2019-01-01 23:42:36+00:00,wellsfargo third largest us bank systematically scammed own customers to . it opened . million unauthorized bank credit card accounts customers’ names illegally charged clients financial services never signed for. bankrun
10,2019-01-01 23:42:11+00:00,it and wells fargo still bank
11,2019-01-01 23:41:33+00:00,shannonlukens ask wellsfargo so annoying
12,2019-01-01 23:40:04+00:00,"""they destroyed me."" wells fargo mistake forced to sell home"
13,2019-01-01 23:38:30+00:00,yo fuck wellsfargo
14,2019-01-01 23:38:02+00:00,"more customers sharing stories wellsfargo ""computer glitch"" caused lose homes. michaela lost battle to save vegas home. five years later, the bank admits made mistake. ""you t put price what lost."""
15,2019-01-01 23:33:03+00:00,what better way begin year wellsfargo decline transactions due fraud alert. the trans cause alert a autopayment s going thru years. nothing like embarrassed not able spend own
16,2019-01-01 23:32:42+00:00,"java developer apps systems engineer java/jee developer – apps systems engineer description wells fargo skip main content close – careers home – about us – about us overview – who we are overview – vision, values, goals overview –…"
17,2019-01-01 23:30:51+00:00,fuck wellsfargo burn in a fiery hell you fucking assholes
18,2019-01-01 23:29:17+00:00,"donnelly espnjudd on top wells fargo building, inside the ids crystal court, red bull’s crashed ice track..."
19,2019-01-01 23:29:03+00:00,wellsfargo haaaahahaha do business bandits?
20,2019-01-01 23:20:58+00:00,getting rid my wells fargo savings ... that’s done .
21,2019-01-01 23:18:24+00:00,fines settlements since paid wells fargo bank
22,2019-01-01 23:17:49+00:00,wyshynski that less the wells fargo center regular season games
23,2019-01-01 23:17:40+00:00,onemycelium savagejoymarie rtyson if wells fargo given campaign contribution kamalaharris like stevenmnuchin
24,2019-01-01 23:17:05+00:00,be leaving wellsfargo good if believe good financial future will follow lead.
25,2019-01-01 23:16:15+00:00,theyre evil this y need bank regulators notice . mil they’re getting gop tax cut to lay k ‘they destroyed me.’ wells fargo’s mistake forced to sell home. the washington post
26,2019-01-01 23:15:55+00:00,ryanflorence make sure wellsfargo not scammed too
27,2019-01-01 23:14:52+00:00,they destroyed me. wells fargo mistake forced to sell home los angeles times
28,2019-01-01 23:10:50+00:00,georgetakei hillary in bed goldman sachs elizabeth warren telling wells fargo employees should prosecuted. coke great if choice pepsi tab guess i going with.
29,2019-01-01 23:09:59+00:00,"bitcoin price analysis btc bounce back, wells fargo reimburse million"
30,2019-01-01 23:04:55+00:00,shanthusiastic roseparade ktla no wells fargo float went around others it could on tv. band came the way sweden was ignored.
31,2019-01-01 22:58:38+00:00,wells fargo &amp; company mn lifted holding deutsche bank ag db – bharatapress – deutsche bank
32,2019-01-01 22:55:15+00:00,"wells fargo says bitcoin too risky clients, pays million fine for scamming them bitcoin"
33,2019-01-01 22:53:08+00:00,pigs stop trying control financial transactions pigs don’t need deny are use atm used. you’re clever enough this you’re fucking pigs wellsfargo nice / whistles berkeley
34,2019-01-01 22:51:16+00:00,"obviously, wellsfargo not care it’s clients only profits was billion the first quarters . do think fine hurt or change them? not all...its aboutyourfinancialmurder it time endtoobigtojail recoveredbroker"
35,2019-01-01 22:51:15+00:00,wells fargo prime example this million settlement forging millions fake accounts yet is no one the head this company held responsible in wellsfargo reached a . billion settlement shoddy/reckless home loans. financialmurder
36,2019-01-01 22:48:01+00:00,wells fargo | wfc classic head &amp; shoulders complete bearish candles long short wells fargo wcx
37,2019-01-01 22:47:44+00:00,need help an expert. wells fargo mangement commits fraud. the company e.g. million little people wells shares their k gets fined million. can shareholders sue sec state ags wrongful penalty? the exectives culpable party shareholderrights
38,2019-01-01 22:42:15+00:00,i mean s a big deal a year ago today i open account wells fargo lol haha
39,2019-01-01 22:39:08+00:00,"bayer monsanto sues wells fargo, citizens over default threats"
40,2019-01-01 22:36:33+00:00,"ktla rose parade part this presentation the rose parade aired ktla jan. , . the following parade entries included this segment rose parade grand finale presented wells fargo .."
41,2019-01-01 22:32:15+00:00,unless big bank wells fargo. they steal money outright.
42,2019-01-01 22:30:17+00:00,"people watch laurie nordquist, wells fargo minnesota ceo"
43,2019-01-01 22:30:00+00:00,a year market volatility. wells fargo investment institute profiles year an investment standpoint its report. read for insights all major asset classes strategies consider .
44,2019-01-01 22:26:29+00:00,do know emotions influence investment decision making? wells fargo investment institute shares insight how approach emotional bias investing.
45,2019-01-01 22:23:57+00:00,"bitcoin price analysis btc bounce back, wells fargo reimburse million"
46,2019-01-01 22:23:23+00:00,"over last years, wells fargo bank got caught. paid gov’t . billion total fines, penalties ripoffs. yet bank’s profit same years = billion. total fines, penalties = . profits. trivial. no wonder banks keep ripping us off."
47,2019-01-01 22:20:49+00:00,"it getting partly cloudy look ↑ the sky ffel f temp. keep phones dry, call if need samsungrepair hooverhigh wellsfargo pizzahut"
48,2019-01-01 22:19:35+00:00,wells fargo’s mortgage loan mistake results foreclosures homeowners
49,2019-01-01 22:19:10+00:00,roseparade wellsfargo annemarie why... ??? i tuned for traditional rose parade today apparently traveled back time the macy’s thanksgiving parade.
50,2019-01-01 22:17:42+00:00,wellsfargo lmfaooooooo.
51,2019-01-02 23:55:37+00:00,men s basketball augsburg hosts saint john in huge miac battle tonight pm si melby hall live video/stats links dh dhoops auggiepride ... auggiegameday sponsored wellsfargo
52,2020-09-28 15:04:50+00:00,"our next rnabenchbedside speaker hardly needs introduction. don miss hearing n lorem founder ceo ionis founder executive chairman the board, drstanleycrooke. register attend natureconf today"
53,2019-01-02 23:54:36+00:00,elaine chao plows dividends back into wells fargo stock via barronsonline
54,2019-01-02 23:54:31+00:00,latimes wells fargo a perfect example a company the government seize.... now.
55,2019-01-02 23:53:48+00:00,women s basketball augsburg travels face saint benedict tonight pm st. joseph live video/stats links dh dhoops auggiepride ... auggiegameday sponsored wellsfargo
56,2019-01-02 23:51:49+00:00,wells fargo can’t last two full days without admitting doing crime
57,2019-01-02 23:50:17+00:00,wells fargo
58,2019-01-02 23:50:06+00:00,north dakota receive . million wells fargo bank
59,2019-01-02 23:49:11+00:00,"jacobhe retirementright goldmoney it true, goldmoney clearly superior a wells fargo, chase tbtf checking/savings account"
60,2019-01-02 23:47:23+00:00,"broberts ask wellsfargo i moved wells fargo accounts local credit union a few years ago. it felt really good it. i always remember knowing expressions tellers i indicated wasn’t them, was their criminal management decided for me."
61,2019-01-02 23:45:04+00:00,wells fargo to pay million fine for scamming customers shortly after tagging bitcoin as too risky
62,2019-01-02 23:44:59+00:00,saradannerdukic she a brilliant legal mind experience governing effectively. just ask wells fargo good is her job.
63,2019-01-02 23:43:34+00:00,"i know it’s easy dunk wells fargo, averagejoelle stuck calendar the fridge get triggered. stop asking referrals"
64,2019-01-02 23:43:20+00:00,"i at wells fargo sausalito sausalito, ca"
65,2019-01-02 23:42:59+00:00,"ask wellsfargo i happy reply here. my main concern over continuing support institution does your company done people, little penalty having no choice that a different bank sold loan wells. please not contact again."
66,2019-01-02 23:42:48+00:00,repeated errors cost hundreds people homes—now wells fargo wants buy silence
67,2019-01-02 23:40:08+00:00,‘they destroyed me.’ wells fargo’s mistake forced to sell home
68,2019-01-02 23:38:35+00:00,‘they destroyed me.’ wells fargo’s mistake forced to sell home
69,2019-01-02 23:37:40+00:00,attorney general announces million multi state settlement wells fargo
70,2019-01-02 23:36:19+00:00,ask wellsfargo i accidentally overdraft debit card twice i thought card a different bank linked merchant. i quickly made account positive will i still get charged the two fees?
71,2019-01-02 23:36:00+00:00,other numberoftheday million that’s much wells fargo pay california settle allegations it opened insurance policies its customers charged without consent. the bank giving its insurance licenses two years.
72,2019-01-02 23:35:54+00:00,wells fargo pay million settlement u.s. states
73,2019-01-02 23:33:53+00:00,repeated errors cost hundreds people homes—now wells fargo wants buy silence
74,2019-01-02 23:33:22+00:00,"latimes extremely organized crime family, wells fargo..."
75,2019-01-02 23:33:16+00:00,"“in december, mr. kelly hosted credit card awards ceremony new york city, sponsored jpmorgan, wells fargo others.”"
76,2019-01-02 23:33:13+00:00,"bayer monsanto sues wells fargo, citizens default threats, energy &amp; commodities"
77,2019-01-02 23:32:38+00:00,i’ve worked several diff fields &amp; i haven’t met group such since wells fargo w| brett &amp; jess the flower shop w| angie’s family back home. so grateful god brought ladies are genuine full so much positivity across path lordknows
78,2019-01-02 23:32:21+00:00,"anonymousatman wells fargo actions = real everyday violence system society oligarchs, our response be equal kind, sic semper tyrannis, hey state use as a motto ""we people"" employ the tactic, visit local branch"
79,2019-01-02 23:30:46+00:00,you’d think screwing their customers wellsfargo would learned lessons appreciate customers...naw. still screw us our pants on. just smile the supervisior didn’t even that...or sound interested . scam
80,2019-01-02 23:30:41+00:00,"wellsfargo im trying buy home ill take money i buy , box call a house"
81,2019-01-02 23:30:41+00:00,latimes my mortgage sold wells fargo. customer service getting better.
82,2019-01-02 23:30:37+00:00,ask wellsfargo can custodial account turned a normal checking account?
83,2019-01-02 23:30:21+00:00,repeated errors cost hundreds people homes—now wells fargo wants buy silence
84,2019-01-02 23:30:00+00:00,"wells fargo investment institute discusses how, since , stocks historically performed well years leading to recession. read today’s report further insight."
85,2019-01-02 23:29:15+00:00,repeated errors cost hundreds people homes—now wells fargo wants buy silence
86,2019-01-02 23:26:20+00:00,ca slaps multi million dollar fine wells fargo
87,2019-01-02 23:23:20+00:00,"if still wells fargo account, is a great time close it. ‘they destroyed me.’ wells fargo’s mistake forced to sell home. the washington post"
88,2019-01-02 23:19:28+00:00,shadybrady wellsfargo download dosh use code the biowe get u link ur card u de link ur card whenever u like
89,2019-01-02 23:19:09+00:00,‘they destroyed me.’ wells fargo’s mistake forced to sell home. the washington post
90,2019-01-02 23:14:59+00:00,"wells fargo still exists a question asked over over during past years. other company abused exploited customers the unrepentant arrogance wellsfargo does, ve never held accountable what they ve done"
91,2019-01-02 23:14:39+00:00,onebuckswope zachdcarter this about wells fargo unethical criminal activities. nothing else. nothing else. nothing else. again?
92,2019-01-02 23:13:03+00:00,"m penalty wells fargo california case, can do new business until least"
93,2019-01-02 23:12:18+00:00,victoria’s secret parent l brands among retailers wells fargo backing
94,2019-01-02 23:10:55+00:00,anyone still banking wells fargo need get now. in fact all banks exist profit alone/do care their customers. join credit union. be member the institution have trusted look your money/finances.
95,2019-01-02 23:10:32+00:00,"ask wellsfargo i ended on hold call the min mark being told wait would min. i find way doesnt require interacting someone, bound be better experience."
96,2019-01-02 23:09:17+00:00,repeated errors cost hundreds people homes—now wells fargo wants buy silence
97,2019-01-02 23:04:46+00:00,"gooeyross paulkrugman yes. yes can protected. ridiculous expect everyone be own lawyer, insurance agent, financial advisor. e.g. cfpb got complaints wells fargo. saw pattern. found they cheating people. voila protection that s gov for people for."
98,2019-01-02 23:04:01+00:00,wells fargo be paying million to settle fake account claims. will receive of cash? banking wellsfargo personalfinance
99,2019-01-02 23:02:36+00:00,shadybrady boardgirllisa wellsfargo i feel ya. super stupid a bank to a chance machine
100,2019-01-02 23:02:21+00:00,‘they destroyed me.’ wells fargo’s mistake forced to sell home
101,2019-01-02 23:01:44+00:00,wellsfargo roseparade spencerludwig why t government seized and shut down? asking all customers defrauded.
102,2019-01-03 23:59:05+00:00,"please t lose, flyers. wells fargo center"
103,2020-09-28 15:04:50+00:00,"our next rnabenchbedside speaker hardly needs introduction. don miss hearing n lorem founder ceo ionis founder executive chairman the board, drstanleycrooke. register attend natureconf today"
104,2019-01-03 23:58:45+00:00,"wells fargo blames ""calculation error"" hundreds lose homes foreclosure"
105,2019-01-03 23:58:32+00:00,"realdonaldtrump if wins nomination, s got vote. period. i one those wells fargo created fake bank accounts for. seeing rip wells fargo new asshole ten miles wide pure joy me."
106,2019-01-03 23:57:49+00:00,"lavampyra sdccu the app rudimentary. and reason the age instant e transfers, it take week at least wellsfargo almost instant transfers. sdccu awful"
107,2019-01-03 23:56:38+00:00,wells fargo agrees pay million resolve state investigations
108,2019-01-03 23:55:28+00:00,"to put apple market value plunge context, billion double size wells fargo three times size mcdonald more than five times size costco more than times size raytheon"
109,2019-01-03 23:53:11+00:00,wells fargo admits made mistake nearly times several years. it pushed hundreds distressed homeowners foreclosure.
110,2019-01-03 23:52:06+00:00,followthelila i’m for sure. i would check wells fargo job search daily. always opportunities. my tweet entry level role within wells fargo financial crime department
111,2019-01-03 23:51:49+00:00,banking roundup wells fargo m payout… injunction denied bofa erica via nybizjournal
112,2019-01-03 23:50:48+00:00,wells fargo can’t break up advisers’ class arbitration
113,2019-01-03 23:48:45+00:00,tarynhatcher one one rod brindamour coming nbcsphilly wells fargo center
114,2019-01-03 23:48:25+00:00,wellsfargo thanks the worst customer service ever i going bank chase i made deposit an atm the power went out. i no atm card you reversed deposit.
115,2019-01-03 23:46:12+00:00,wells fargo says internal review found bank denied help hundreds homeowners fees charged foreclosure attorneys improperly used the bank determined to offer mortgage help.
116,2019-01-03 23:45:19+00:00,"i at wells fargo center wellsfargoctr philadelphia, pa"
117,2019-01-03 23:45:02+00:00,carpool rutherfordton &gt; charlotte spartanburg wells fargo uptown charlotte splitcosts
118,2019-01-03 23:42:47+00:00,kimbercole which wells fargo you at?
119,2019-01-03 23:42:15+00:00,"repmaloney co chair how wonderful census must be protected &amp; we know how u fight the word is ""relentlessly"" until the job is done. congratulations on being co chair can t wait hear your voice boom &amp; placing it on facebook so our nation can hear u like u did wells fargo. love p &amp; w"
120,2019-01-03 23:38:24+00:00,repeated errors cost hundreds people homes—now wells fargo wants buy silence
121,2019-01-03 23:38:16+00:00,just minutes separate arizona state its pac opener. sun devils tip against utah utes wells fargo arena p.m.
122,2019-01-03 23:38:04+00:00,repeated errors cost hundreds people homes—now wells fargo wants buy silence
123,2019-01-03 23:35:42+00:00,"it’s pm, gritty twerking bar inside the wells fargo center."
124,2019-01-03 23:35:20+00:00,this the best closing show ever good job wells fargo
125,2019-01-03 23:33:57+00:00,"if tim sloan serious wanting fix wellsfargo tattered reputation ""build better bank,"" ve got great idea him divest fossil fuels private prisons, reinvest a clean energy economy."
126,2019-01-03 23:31:06+00:00,wells fargo agreed give its insurance licenses two years pay another million it ever wants to sell insurance california again.
127,2019-01-03 23:30:06+00:00,what five ways investors position “the end easy” ? wells fargo investment institute shares views. market volatility investing
128,2019-01-03 23:30:00+00:00,wells fargo investment institute expects positive performance for major stock indices.
129,2019-01-03 23:28:14+00:00,"wellsfargo settled m exploiting low income people. maybe cityofatlanta keishabottoms reconsider relationship ""the initiative be co chaired tai roberson, senior community development officer wells fargo"""
130,2019-01-03 23:24:58+00:00,"my poor apple stock... to put apple market value plunge context, billion double size wells fargo than three times size mcdonald’s than five times size costco more than times size raytheon"
131,2019-01-03 23:23:28+00:00,proud say my employer years wellsfargo named blackenterpise magazine list the best companies diversity.
132,2019-01-03 23:19:14+00:00,"bankofamerica once favorite financial institutions due poor customer service, non customer friendly policies i’m looking change my business chase wellsfargo..."
133,2019-01-03 23:18:39+00:00,it’s utahmbb game day the runnin’ utes visit asu tempe the k satellite pregame show jp chunga larsen espn live now espnbill jimmysoto take from wells fargo arena utah asu tips at pm mt
134,2019-01-03 23:17:56+00:00,crypto critics wells fargo caught scamming clients
135,2019-01-03 23:17:03+00:00,"game wells fargo center wellsfargoctr carolina hurricanes vs philadelphia flyers philadelphia, pa"
136,2019-01-03 23:17:02+00:00,spookymari wells fargo
137,2019-01-03 23:15:00+00:00,riding shotgun across west john boessenecker’s new book uncovering heroes wells fargo.
138,2019-01-03 23:12:42+00:00,wells fargo could pay california . million settle force placed insurance charges
139,2019-01-03 23:12:11+00:00,the dj bud light zone wells fargo center played deftones i love
140,2019-01-03 23:12:08+00:00,wells fargo could pay california . million settle force placed insurance charges
141,2019-01-03 23:09:32+00:00,"don submit quit. apply jobs like ""strategic planning manager "" wells fargo, look people might know the company. you might able reach hr directly. ready to apply? check the link our bio."
142,2019-01-03 23:07:38+00:00,repeated errors cost hundreds people homes—now wells fargo wants buy silence
143,2019-01-03 23:05:27+00:00,trillataylor wellsfargo remember i told i having problem w wells fargo you said was fault god don’t like ugly
144,2019-01-03 23:04:22+00:00,wells fargo agrees pay california million drop insurance license state – ktla
145,2019-01-03 23:03:34+00:00,musser benson wfb fraud wellsfargo stop fines liquidate bank. distribute funds the people ruined whatever left go the shareholders. badbank wellsfargo
146,2019-01-03 23:00:05+00:00,louisiana receiving almost million wells fargo settlement
147,2019-01-03 23:00:05+00:00,louisiana receiving almost million wells fargo settlement
148,2019-01-03 22:57:21+00:00,"wells fargo, bank america offer help clients amid government shutdown cnbc"
149,2019-01-03 22:56:53+00:00,iron spike wells. wells. wells fargo
150,2019-01-03 22:56:37+00:00,allentown morning call they destroyed woman says wells fargo mistake forced to sell home. via googlenews
151,2019-01-03 22:51:36+00:00,sencortezmasto foreverlogical wellsfargo please because they’re one the banks extending assistance the vulnerable employees effected the shutdown . we don’t want leeches hurting any than currently are.
152,2019-01-03 22:51:12+00:00,the jolly banker wells fargo just admitted robbing us citizens b...
153,2019-01-04 23:58:39+00:00,"ask wellsfargo can not get system work girard ave, philadelphia? this makes weeks a row the teller windows not open of problem. please get problem fixed"
154,2020-09-03 18:26:48+00:00,"lenovo legion x playapex now your chance rise the rest. unmatched performance, purposeful engineering, modern design. gear with machine savage you are. stylish outside. savage inside."
155,2019-01-04 23:58:13+00:00,"wellsfargo really think it’s wise only one bank, just one, a city , people? you use that money buy you some brains"
156,2019-01-04 23:58:10+00:00,"i at wells fargo bank live oak branch arcadia, ca"
157,2019-01-04 23:58:05+00:00,the embarrassment is wellsfargo
158,2019-01-04 23:57:16+00:00,just found atms wells fargo down bc christmas someone took shotgun it steal the money didn’t get onlyinsb
159,2019-01-04 23:55:27+00:00,"tharp i received dm. in order connect with appropriate team, please resend information our ask wellsfargo handle using dm link below. thanks your understanding. janet"
160,2019-01-04 23:55:03+00:00,wow. almost hour now. still nothing. can wait visit branch monday morning close account. bye wellsfargo wellsfargonews wellsfargobb ask wellsfargo wellsfargoworks
161,2019-01-04 23:53:21+00:00,not cuttin’ high top til isee k wells fargo no typa debt except ma car school loan
162,2019-01-04 23:52:24+00:00,"""wells fargo should be more generous with federal workers. we’re waiting."" ron lieber via nyt"
163,2019-01-04 23:52:11+00:00,"jeremyblum wfa wellsfargo systematically defrauded millions ordinary people, knowingly"
164,2019-01-04 23:52:01+00:00,mumfordandsons maggierogers dan grech was good the wells fargo center you guys came philadelphia.
165,2019-01-04 23:50:48+00:00,"damonmartin that a lot cards plan try work around obstacles injuries, weight cut issues, etc hope one makes wellsfargo arena des moines. lots midwest fighters for sure to sell out."
166,2019-01-04 23:48:43+00:00,thebachfather typical wells fargo bizness
167,2019-01-04 23:48:36+00:00,"maybe fsg ""roadmap"" there, that encourages ""diy compliance"" lawyers vw gm wellsfargo cbs getcompliancesme =&gt; it’s culture, stupid"
168,2019-01-04 23:48:19+00:00,your money wells fargo should be more generous with federal workers. we’re waiting.
169,2019-01-04 23:45:42+00:00,do know anyone wells fargo mortgage loan office you would recommend using? if please let know thank you.
170,2019-01-04 23:45:12+00:00,here how much north carolina gets wells fargo recent m settlement
171,2019-01-04 23:43:13+00:00,wells fargo forgot whole damn wallet lost &amp; don’t my id
172,2019-01-04 23:42:36+00:00,advchaser dstroyr ub wellsfargo this makes happy
173,2019-01-04 23:41:57+00:00,"wellsfargo i’ve customer since past november even though debit card says , your customer service local bank been phenomenal. hope have a great weekend."
174,2019-01-04 23:39:39+00:00,bankofamerica wellsfargo chase the lady asked all question. please respond empathy you understand federal workers going through.
175,2019-01-04 23:38:57+00:00,"wellsfargo i been hold minutes counting. you making hard me give money. maybe i just take business elsewhere? it an appealing idea. you know, especially all fraud everything."
176,2019-01-04 23:38:15+00:00,resist hopefully will be soon. i lost million dollars stock wachovia bank went and became wells fargo. killed i fought back no help. just want let know have be tough it hard but we do
177,2019-01-04 23:35:43+00:00,so i’m wells fargo this teller has helped times always messes something me. so taday i saw and i tried go another girl no i got again ‍️
178,2019-01-04 23:34:19+00:00,so im wells fargo.... lol
179,2019-01-04 23:29:00+00:00,"rt profwolff over last years, wells fargo bank got caught. paid gov’t . billion total fines, penalties ripoffs. yet bank’s profit same years = billion. total fines, penalties = . profits. trivial. no wonder banks keep ripp…"
180,2019-01-04 23:28:25+00:00,want know we need senwarren? repeated errors cost hundreds people homes wells fargo wants buy silence.
