,Time,Text
706,2019-01-14 22:54:49+00:00,put your saving money in an online bank if youre not investing with it online banks give interest ally bank discovery savings bank america while regular bank give . interest‍️‍️‍️ chase wells fargo
707,2019-01-14 22:53:27+00:00,chainlinkmarket chainlink tgonser docusign hiromarleyg msftblockchain salesforce chase wellsfargo well are the official channels ;
708,2019-01-14 22:53:11+00:00,"i don’t work wells fargo, i pay back the money loaned me."
709,2019-01-14 22:52:24+00:00,my first ever concert the pretenders the who the wells fargo center... tempted make my first concert tickets .
710,2019-01-14 22:52:12+00:00,alicekeeler chase i would say yes not wells fargo.
711,2019-01-14 22:52:03+00:00,"shawny hill ""permanently removed"" role pa announcer the philadelphia wings has been suspended unknown amount time all arena announcing assignments the wells fargo center following his insensitive comments the wings game saturday."
712,2019-01-14 22:50:47+00:00,and the crowd rises here at the wells fargo center
713,2019-01-14 22:50:15+00:00,jpm wfc a look at banks td ameritrade thanks jj next up in bank earnings jpmorgan and wells fargo take the stage
714,2019-01-15 23:59:13+00:00,"if want get real it, obama reset russia which companies like cisco gave putin billions dollars shows obama more help putin he help ppl lost homes due to wells fargo."
715,2020-09-03 18:26:48+00:00,"lenovo legion x playapex now your chance rise the rest. unmatched performance, purposeful engineering, modern design. gear with machine savage you are. stylish outside. savage inside."
716,2019-01-15 23:58:09+00:00,"tuenwasamistake pastorsealion vanityfair and s happened, poor ppl punished many never came back it, to help banks once held slaves like j.p morgan wells fargo, of obama more than poor ppl."
717,2019-01-15 23:57:21+00:00,dumbass wells fargo thats i switched chase they stupid ass
718,2019-01-15 23:53:29+00:00,"update as loans revenue shrink, wells fargo leans cost cuts"
719,2019-01-15 23:53:05+00:00,saric hugged franklin now i’m crying the wells fargo center
720,2019-01-15 23:52:45+00:00,dbrs wells fargo reports solid q results; plans to operate under asset cap through | dbrs wellsfargo
721,2019-01-15 23:52:28+00:00,"musser benson waywordknight truthsearch foreclosureoz traci jdgarfield deadlyclear adomantholdings ourkidz nadiaskin beyondthebantr jeffmyers leonitis tourbusdriver considerthis magdasedra laserhaas wfb fraud shurtcircuit isabel sherigreatfalls amydontlooksick mastersdrimist usocc realdonaldtrump wellsfargo potus srsofstfrancis sba ussupremecourt courtnewsflash flabaryld cbsnews wsj cfpb stopfraud thejusticedept fbicbs tim canova youtube ask wellsfargo bofa congressdotgov senatedems senategop speakerryan usmc usnavy time , fed workers sadly falling behind mortgages. be forced a loan scam modification. yrs later late banks breach contract. &amp; homeowner wrongfully foreclosure. &amp; is it begin over breakingnews cathype"
722,2019-01-15 23:51:45+00:00,"i liked youtube video rush subdivisions wells fargo center, philadelphia pa"
723,2019-01-15 23:50:47+00:00,patriot athletic conference sandhills athletic conference wells fargo cup standings fall sports. cfcoltssports leads patriot. jackbrittbucs nd sandhills.
724,2019-01-15 23:49:06+00:00,nbcsphilly marczumoff sixers “and rise the wells fargo center ”
725,2019-01-15 23:48:07+00:00,wellsfargo &amp; co. wfc ceo tim sloan q results earnings call transcript
726,2019-01-15 23:45:56+00:00,"wells fargo, consumer banking giant, said fourth quarter profits fell slightly tuesday the bank remains restrained federal regulators, put tight leash it years scandals missteps."
727,2019-01-15 23:45:10+00:00,"wells fargo ceo tim sloan addresses ongoing asset cap, efforts transform"
728,2019-01-15 23:45:00+00:00,chartoftheweek wells fargo investment institute discusses portfolio diversification may help investors a market downturn. here’s
729,2019-01-15 23:45:00+00:00,"the ers host t wolves wells fargo center tonight, what be first clash since trade jimmy butler. spread ers o/u . jimmy butler points o/u . for jimmy tonight?"
730,2019-01-15 23:44:19+00:00,wells fargo &amp; co. wfc ceo tim sloan q results earnings call transcript
731,2019-01-15 23:43:08+00:00,wfc wells fargo &amp; co. wfc ceo tim sloan q results earnings call transcript
732,2019-01-15 23:42:37+00:00,wellsfargo outdated info promo longer available please update tweet future events
733,2019-01-15 23:40:46+00:00,"donniewahlberg any tours dvd online? i especially loved tour degrees boyz men. i saw atlantic city at wells fargo center in philly. by way, love the new song."
734,2019-01-15 23:39:52+00:00,rt judsoncarmicha doktorzoom all’s wells fargo ends wells fargo literaryproductplacement
735,2019-01-15 23:36:49+00:00,it a cultures night wells fargo i t figure which culture i don’t want guess. i’ll wrong.
736,2019-01-15 23:35:22+00:00,"clap hands, everybody ‍️ wells fargo center yelp"
737,2019-01-15 23:33:31+00:00,jamieapody it sitting action news van nearby wells fargo tonight?
738,2019-01-15 23:33:09+00:00,"realdailywire very smart good pr them. if are wells fargo boa, suspending mortgage payments federal employees would good well. when business step it puts libs their heel."
739,2019-01-15 23:32:49+00:00,just got sad watching dario roco walking wells fargo
740,2019-01-15 23:32:06+00:00,doktorzoom all’s wells fargo ends wells fargo literaryproductplacement
741,2019-01-15 23:31:55+00:00,"as loans revenue shrink, wells fargo leans cost cuts"
742,2019-01-15 23:31:22+00:00,take action tell wellsfargo take stand drilling the arctic refuge protectthearctic
743,2019-01-15 23:30:07+00:00,wells fargo splurged stock buybacks since fake accounts scandal
744,2019-01-15 23:30:03+00:00,"ask wellsfargo dillards if i want dillard credit card, i specify card i want? or i submit one application, get considered both?"
745,2019-01-15 23:30:03+00:00,"wells fargo made business insider list top charitable companies, donating million ."
746,2019-01-15 23:30:00+00:00,chartoftheweek wells fargo investment institute discusses portfolio diversification may help investors a market downturn. here’s
747,2019-01-15 23:29:30+00:00,"a special night the wells fargo center we celebrate marczumoff, welcome back two former sixers have ballgame play. here everything need know serenawinters, pregame live starts on nbcsp."
748,2019-01-15 23:29:28+00:00,"it looks like wellsfargo wants open checking account them again. did already forget i closed mine few years ago? hint, had something to do how treated people unethical business practices opening accounts w/o permission ."
749,2019-01-15 23:29:00+00:00,hockey wells fargo center
750,2019-01-15 23:26:35+00:00,wellsfargo customer service currently down. not convenient you guys never dropped my money order
751,2019-01-15 23:21:41+00:00,". wellsfargo advisors loses another brokers quarter, for year bdnewsguy"
752,2019-01-15 23:21:16+00:00,wells fargo settles sec lawsuit curt schilling studios | reuters
753,2019-01-15 23:21:09+00:00,wells fargo settles sec lawsuit curt schilling studios | reuters
754,2019-01-15 23:18:32+00:00,"wells fargo loan book shrank revenue fell across its major businesses last quarter, the fourth largest us lender continued work the consequences wayward sales practices its consumer bank. wells fargo…"
755,2019-01-15 23:17:59+00:00,"wells fargo operate fed growth cap the end this year, ceo says"
756,2019-01-15 23:16:35+00:00,can wells fargo grow under fed thumb?
757,2019-01-15 23:15:56+00:00,need another measure tonight sixers wolves game big? there no available workstation seats the wells fargo center media room.
758,2019-01-15 23:15:55+00:00,"tonight large adult son dario saric returns wells fargo center play the sixers, is v sweet boy come game time he’s somebody i used know. ily, dario roco."
759,2019-01-15 23:13:08+00:00,"wells fargo asset cap last year, says ceo mortgagenews"
760,2019-01-15 23:12:10+00:00,michaelclark wells fargo going go nuts him i’m jealous dude
761,2019-01-15 23:11:54+00:00,women s hockey augsburg hosts uw eau claire nonconference game tonight pm ed saugestad rink live video/stats dhky auggiepride ... auggiegameday sponsored wellsfargo
762,2019-01-15 23:11:16+00:00,team pic. sixers day wells fargo center
763,2019-01-15 23:09:18+00:00,"jp morgan, wells fargo delta airlines reported overnight. investors punished wells fargo’s miss, jp morgan shareholders more forgiving. higher growth stocks featured, the tech healthcare sectors led gains both european us markets. micmccarthy cmc"
764,2019-01-15 23:07:31+00:00,"with refund checks around cornerit’s time make every dollar dime nickel count the famu chapter progressive black men, inc. here talk financial literacy special guests wells fargo. don’t miss"
765,2019-01-16 23:59:55+00:00,kaylynfriday wellsfargo kaylyn. they nothing thieves. this bank’s charter be pulled.
766,2020-09-28 15:04:50+00:00,"our next rnabenchbedside speaker hardly needs introduction. don miss hearing n lorem founder ceo ionis founder executive chairman the board, drstanleycrooke. register attend natureconf today"
767,2019-01-16 23:58:05+00:00,ask wellsfargo by way...a great point made saying banks adopted similar policies. it’s eye opening banks follow other’s stupidity. sure hope one the banks don’t jump a bridge....good job sheeple
768,2019-01-16 23:57:58+00:00,wells fargo reports mixed q results via yahoofinance
769,2019-01-16 23:57:48+00:00,"staff is wonderful, especially denise took photo wells fargo center"
770,2019-01-16 23:57:33+00:00,"why mortgage lending wells fargo, chase citi plunged"
771,2019-01-16 23:57:14+00:00,diztract ctfoodbank wellsfargo feedingamerica the ceos wells fargo be homeless like they’ve made many others.
772,2019-01-16 23:54:21+00:00,"amydontlooksick isabel ask wellsfargo we t ""lose homes."" these banks stole with phony fabricated title documents re created promissory notes. it the biggest heist us history."
773,2019-01-16 23:53:38+00:00,i fell asleep the main lobby waiting talk a banker wells fargo like minutes passed
774,2019-01-16 23:52:57+00:00,is anyone working wellsfargo ? been hold hour min now. ask wellsfargo said d call more hours ago. why t company care customers? you would think d try overcompensate the whole fraud thing.
775,2019-01-16 23:51:17+00:00,"richarddeitsch did hear pa guy wells fargo centre, richard? he yelling ""snip the ponytail"" a native north american lacrosse player, lyle thompson, the philadelphia fans yelling back ""scalp him""...so terrible. he fired."
776,2019-01-16 23:50:45+00:00,ask wellsfargo protection deposits? good heavens a withdrawal to occur. common sense a super power days
777,2019-01-16 23:50:28+00:00,dymondmarie there aren’t physical wells fargo locations ri.
778,2019-01-16 23:50:07+00:00,"now hiring counsel equipment finance wells fargo dallas, tx lawyers legaljobs corporatecounsel"
779,2019-01-16 23:48:38+00:00,"ask wellsfargo i’m kinda seeing double standard wells fargo. you no problem opening accounts without customer permission, taking cash deposits their preprinted deposit slip somehow policy. lmao million penalty later wells fargo hasn’t learned squat"
780,2019-01-16 23:48:12+00:00,"newyorkstateag wow, wells fargo jewelry."
781,2019-01-16 23:45:00+00:00,wells fargo investment institute compares “risk on” “risk off” markets considers stocks a ”risk off” tone september record high the s&amp;p index thru the christmas eve close. economy
782,2019-01-16 23:43:34+00:00,another victory law offices jason w. estavillo against wells fargo foreclosure foreclosurelaw savingtheamericandream
783,2019-01-16 23:42:33+00:00,"hosstweets other banks adopted similar policies. each financial institution reserves right set certain requirements protect customers. while can comment other banks policies, wells fargo takes security our customers accounts seriously. ludwicke"
784,2019-01-16 23:41:33+00:00,"we in home stretch now, ️⃣days hdm pres. wellsfargo."
785,2019-01-16 23:40:07+00:00,today wells fargo student loan department called and only cried being jobless undergraduate minutes
786,2019-01-16 23:39:21+00:00,"why mortgage lending wells fargo, chase citi plunged"
787,2019-01-16 23:39:01+00:00,ask wellsfargo i don’t need policy i’ll never a customer. i honestly feel sorry customers tolerate less less customer service their bank. it’s a deposit...not a withdrawal. where’s common sense that? money appearing an accounts vs disappearing..
788,2019-01-16 23:37:47+00:00,would thieves torch wells fargo atm spring deputies via abchouston
789,2019-01-16 23:37:45+00:00,"truthsearch dianpink younicks musser benson waywordknight foreclosureoz traci jdgarfield deadlyclear adomantholdings ourkidz nadiaskin beyondthebantr jeffmyers leonitis tourbusdriver considerthis magdasedra laserhaas wfb fraud shurtcircuit isabel sherigreatfalls amydontlooksick mastersdrimist usocc realdonaldtrump wellsfargo potus srsofstfrancis sba ussupremecourt courtnewsflash flabaryld cbsnews wsj cfpb stopfraud thejusticedept fbicbs tim canova youtube ask wellsfargo bofa congressdotgov senatedems senategop speakerryan fanniemae sure blame on computer glitch. i not give bleep, s fault just fix it we living unhealthy lives waking angry, bed frustrated. stressed they need offer us solution makes sense keep us our homes cathype"
790,2019-01-16 23:36:34+00:00,"why mortgage lending wells fargo, chase citi plunged"
791,2019-01-16 23:34:32+00:00,"game wells fargo center wellsfargoctr philadelphia, pa"
792,2019-01-16 23:33:36+00:00,prodbysule wells fargo.
793,2019-01-16 23:30:48+00:00,wells fargo faces scandal illegal foreclosing homes
794,2019-01-16 23:30:47+00:00,mpalominowf wellsfargo miamichamber fantastic picture you two
795,2019-01-16 23:29:50+00:00,"a huge shout to bhmarc team sharing awesome new space us today ""executives getting coffee"" meet hosted wellsfargo croixstoneclt. we be back ️"
796,2019-01-16 23:25:53+00:00,lasairport tsa alaskaair british airways delta jetblue southwestair spiritairlines united wellsfargo nice job
797,2019-01-16 23:23:15+00:00,brotips shit like is exactly she’s banned wells fargo center ‍️
798,2019-01-16 23:20:19+00:00,babyceezyy wellsfargo wellsfargo hire her...already
799,2019-01-16 23:19:06+00:00,musser benson mkaz waywordknight truthsearch foreclosureoz traci jdgarfield deadlyclear adomantholdings ourkidz nadiaskin beyondthebantr jeffmyers leonitis tourbusdriver considerthis magdasedra laserhaas wfb fraud shurtcircuit isabel sherigreatfalls amydontlooksick mastersdrimist usocc realdonaldtrump wellsfargo potus srsofstfrancis sba ussupremecourt courtnewsflash flabaryld cbsnews wsj cfpb stopfraud thejusticedept fbicbs tim canova youtube ask wellsfargo bofa congressdotgov senatedems senategop speakerryan usmc usnavy time it sure feels like corruption deception trying get information these federal local agencies terrible. no one doing job. i ask it they told to assist homeowner?
800,2019-01-16 23:18:39+00:00,"rumor sixers expressed interest knicks forward noah vonleh, according knicks news reporter, stefon bondy. what’ll take get vonleh? wells fargo center"
801,2019-01-16 23:15:50+00:00,"musser benson mkaz waywordknight truthsearch foreclosureoz traci jdgarfield deadlyclear adomantholdings ourkidz nadiaskin beyondthebantr jeffmyers leonitis tourbusdriver considerthis magdasedra laserhaas wfb fraud shurtcircuit isabel sherigreatfalls amydontlooksick mastersdrimist usocc realdonaldtrump wellsfargo potus srsofstfrancis sba ussupremecourt courtnewsflash flabaryld cbsnews wsj cfpb stopfraud thejusticedept fbicbs tim canova youtube ask wellsfargo bofa congressdotgov senatedems senategop speakerryan usmc usnavy time new jersey here a nightmare, the lawyers modification companies corrution judges. i never seen violations no regulations followed. i reach imaginable agency looking answers. my loan subsidized the bank breached loan mod."
802,2019-01-16 23:15:30+00:00,musser benson wellsfargo incredibly crooked...
803,2019-01-16 23:14:54+00:00,"ask wellsfargo i’ve trying wire money day your website app won’t recognize routing number, i keep getting “routing number must digits” the routing digits...very frustrated guys hurting business."
804,2019-01-16 23:12:57+00:00,"why mortgage lending wells fargo, chase citi plunged"
805,2019-01-16 23:12:52+00:00,younicks waywordknight cathype musser benson truthsearch foreclosureoz traci jdgarfield deadlyclear adomantholdings ourkidz nadiaskin beyondthebantr jeffmyers leonitis tourbusdriver considerthis magdasedra laserhaas wfb fraud shurtcircuit isabel sherigreatfalls amydontlooksick mastersdrimist usocc realdonaldtrump wellsfargo potus srsofstfrancis sba ussupremecourt courtnewsflash flabaryld cbsnews wsj cfpb stopfraud thejusticedept fbicbs tim canova youtube ask wellsfargo bofa congressdotgov senatedems senategop speakerryan usmc yes...sad
806,2019-01-16 23:10:08+00:00,"why mortgage lending wells fargo, chase citi plunged"
807,2019-01-16 23:07:47+00:00,women s basketball augsburg hosts hamline tonight pm si melby hall live video/stats dh dhoops auggiepride ... auggiegameday sponsored wellsfargo
808,2019-01-16 23:07:46+00:00,"alicia reyes, wells fargo, punit renjen, deloitte, chuck robbins, cisco, martin schroeter, ibm, kare schultz, teva, guido barilla, barilla, young sohn, samsung"
809,2019-01-16 23:07:31+00:00,spectatorindex based california activision adobe alphabet apple caterpillar chevron cisco disney ebay electronic arts facebook fitbit fox broadcasting hp intel linkedin mckesson netflix paypal pixar qualcomm tesla twitter visa warner brothers wells fargo yelp
810,2019-01-16 23:06:29+00:00,"why mortgage lending wells fargo, chase citi plunged"
811,2019-01-16 23:06:16+00:00,men s basketball augsburg travels face hamline tonight pm hutton arena st. paul live video/stats dh dhoops auggiepride ... auggiegameday sponsored wellsfargo
812,2019-01-16 23:05:26+00:00,"we proud introduce storm chasers dance team the storm chasers debut two brand new routines iowa barnstormers home opener saturday, march wells fargo arena meet the girls"
813,2019-01-16 23:05:15+00:00,younicks waywordknight cathype musser benson truthsearch foreclosureoz traci jdgarfield deadlyclear adomantholdings ourkidz nadiaskin beyondthebantr jeffmyers leonitis tourbusdriver considerthis magdasedra laserhaas wfb fraud shurtcircuit isabel sherigreatfalls amydontlooksick mastersdrimist usocc realdonaldtrump wellsfargo potus srsofstfrancis sba ussupremecourt courtnewsflash flabaryld cbsnews wsj cfpb stopfraud thejusticedept fbicbs tim canova youtube ask wellsfargo bofa congressdotgov senatedems senategop speakerryan usmc he a stubborn one
814,2019-01-16 23:05:15+00:00,replacing home’s heating air conditioning system a huge investment. climatech offers financing approved credit wells fargo equal payments. you apply online .
815,2019-01-16 23:04:01+00:00,wells fargo plans operate growth ban
816,2019-01-17 23:57:47+00:00,"thank you, gop for first time history, six biggest wall street banks — ️made billion profit a year jpmorgan chase bankofamerica wellsfargo citi goldmansachs repmaxinewaters fscdems via business"
817,2020-10-30 21:18:04+00:00,"if know anyone lives new jersey, let know this…"
818,2019-01-17 23:57:22+00:00,wells fargo needs to stop running. and negotiate
819,2019-01-17 23:54:39+00:00,walk &amp; talk presented wellsfargo robert cartwright a force and the court.
820,2019-01-17 23:46:48+00:00,usaa help super disappointed usaa month. y’all making very difficult add spouse. wellsfargo we’ll seeing tomorrow
821,2019-01-17 23:45:10+00:00,"wells fargo bank, their are no lawyers in chicago willing to fight foreclosure corruption in illinois"
822,2019-01-17 23:42:19+00:00,wells fargo bank has corrupted the judicial process of the courts in chicago
823,2019-01-17 23:40:53+00:00,senator elizabeth warren demands wells fargo kicked college campuses via bpolitics
824,2019-01-17 23:40:42+00:00,"angryblacklady this so sad me. shaun king most effective activist my time. getting seattle divest wells fargo, getting new york agree close rikers island still t been done , beginning process citizens identify rotten prosecutors."
825,2019-01-17 23:39:48+00:00,"wells fargo bank refuses to negotiate , they only send jewish lawyers to court in chicago, corruption ,"
826,2019-01-17 23:38:38+00:00,wells fargo actually terrible
827,2019-01-17 23:37:29+00:00,elizabeth warren demands that wells fargo be kicked off college campuses
828,2019-01-17 23:37:11+00:00,wells fargo bank going with pelosi
829,2019-01-17 23:35:44+00:00,elizabeth warren demands wells fargo kicked college campuses i hate wf but what senators need worry about??? fucking problems have our country fucking rat worry banks campuses.
830,2019-01-17 23:35:40+00:00,"kyoag thejusticedept wellsfargo bofaml there wasnt single intelligent thejusticedept fbi agent /district attorney had salt do whats right, bc every single one the cs tucked heads the sand and further own personal gain vs honoring they stand for. no integrity."
831,2019-01-17 23:35:35+00:00,wells fargo be dismantled their transgressions the american people thursdaythoughts
832,2019-01-17 23:35:06+00:00,considering short sale wells fargo? find more
833,2019-01-17 23:33:22+00:00,kyoag thejusticedept to give public heads the outcome this issue be. the thing when corrupt big banks like wellsfargo bofaml screwed millions yet big charge. theyre &amp; ll get put on the spot soon enough.
834,2019-01-17 23:33:10+00:00,elizabeth warren demands wells fargo kicked college campuses
835,2019-01-17 23:32:25+00:00,janicelynn yeah it’s badass lol there’s bank america just pay fee taking money ? i believe it’s better dealing wells fargo ️
836,2019-01-17 23:30:06+00:00,"the american bankers association represents interests big banks, &amp; supported white supremacist stevekingia w/ k campaign donations. does steve king speak you? bankofamerica jpmorgan wellsfargo citi stevekingisthegop wallstreetbankrollsracism"
837,2019-01-17 23:28:50+00:00,sen. warren takes latest criticism wells fargo unc other nc schools
838,2019-01-17 23:28:15+00:00,"the lombardo once stayed the la ronald mcdonald house &amp; now giving back their local rmh spokane. we love our families &amp; so grateful generous partners like wellsfargo, make possible provide our families."
839,2019-01-17 23:27:41+00:00,teetoee i security service i love but i go of town lot they don’t any of san antonio that’s i got wells fargo
840,2019-01-17 23:25:24+00:00,"wellsfargo i pinnacle financial partners, u.s. bank bank america both personal business accounts offices in tn al ga fl nc sc tx &amp; ca i have decided open bank account wells fargo...only of dale robertson the wf reruns"
841,2019-01-17 23:24:49+00:00,wyocullen iamcardib leodicaprio postmalone colesprouse dylansprouse jimmyfallon barackobama wellsfargo anything iamcardib
842,2019-01-17 23:23:45+00:00,senator elizabeth warren demands wells fargo kicked college campuses
843,2019-01-17 23:22:20+00:00,"last night welcomed ian bremmer sacramento a big thank to sponsors wells fargo, smud to moderator kellie demarco kcra news"
844,2019-01-17 23:17:35+00:00,avenattij cathype beyondthebantr whistlblowrnews foreclosureoz truthsearch younicks musser benson waywordknight traci jdgarfield deadlyclear adomantholdings ourkidz nadiaskin jeffmyers leonitis tourbusdriver considerthis magdasedra laserhaas wfb fraud shurtcircuit isabel sherigreatfalls amydontlooksick mastersdrimist usocc realdonaldtrump wellsfargo potus srsofstfrancis sba ussupremecourt courtnewsflash flabaryld cbsnews wsj cfpb stopfraud thejusticedept fbicbs tim canova youtube ask wellsfargo bofa congressdotgov senatedems senategop michaelavenatti im sure many people that ability
845,2019-01-17 23:16:49+00:00,"senwarren today called wellsfargo be kicked college campuses. according the recent disclosures compiled the education department, wells fargo banking agreements at least colleges."
846,2019-01-17 23:14:19+00:00,wells fargo give back the money withdrew college now
847,2019-01-17 23:13:20+00:00,"miga nomorecole with inspections arm complete disarray primestar msi failure pay, wells fargo states as jan, inspections done without abc aspen grove not paid. i guarantee you people would grow…"
848,2019-01-17 23:10:58+00:00,flyers presidents dinner. — wells fargo center
849,2019-01-17 23:09:04+00:00,senator elizabeth warren demands wells fargo kicked college campuses
850,2019-01-17 23:04:10+00:00,"fanniemae trailers, trailers more trailers trailer parks sea shining sea all built clayton homes financed wells fargo. i wonder s behind new ""american dream"" anyone? take guess. iaintnohedgefund fanniegate"
851,2019-01-17 23:00:24+00:00,"the wellsfargo home equity group tempe donated nine boxes full toiletry personal care items including body wash, shampoo, toothpaste, feminine hygiene items, deodorant more thank so much your generosity, items so helpful greatly appreciated."
852,2019-01-17 22:58:27+00:00,business i agree; wells fargo be fined and/or put of business.
853,2019-01-17 22:56:05+00:00,top resources available for coast guard members federal workers during government shutdown. including resources chase wellsfargo navyfederal vathefairway
854,2019-01-17 22:55:44+00:00,"xavier rd big east plays villanova st big east tomorrow night philadelphia tip fs . they play downtown , seat wells fargo center on campus. vu in ap top week a game winning streak. the wildcats won last ncaas."
855,2019-01-17 22:54:34+00:00,"an afternoon well spent my fellow wells fargo, albuquerque decked, small business bankers. we heard a key community partner, albuquerque hispano chamber ahcnm. smallbusiness education"
