,Unnamed: 0,Time,Text,Sentiment
2052,2052,2019-07-05 23:59:46+00:00,chloexhalle sooooo happy for you i remember seeing little mermaid the day i graduated pre school never would thought would a possible live action movie let alone inclusive inspiration disney blessedandgrateful,"[18.620833229140562, 11.588350840201556, -2.390675099202312]"
2053,2053,2019-07-05 23:59:46+00:00,"stephrenee you be mad you want, disney t care...also problem t white people, s racist white people... emphasis the racist","[28.316633198544256, 38.2004827708796, -10.965835899410635]"
2054,2054,2019-07-05 23:59:42+00:00,rdj it sticker set the disney movie club wir came out. i never saw internally got as a promotion.,"[-3.6454096271971492, 13.429955278710935, 1.9624979149818813]"
2055,2055,2019-07-05 23:59:39+00:00,the thought making disney princess header made me cry now i wanna it,"[-4.341230444194234, -0.3530081929627191, -12.231545358345215]"
2056,2056,2019-07-05 23:59:38+00:00,check disney parks popcorn bucket happy holidays christmas party collectible ebay disneypopcornbucket christmasinjuly,"[63.29444875761404, 38.33016636758386, -12.003300084474716]"
2057,2057,2019-07-06 23:59:59+00:00,check disney eeyore blue mother of pearl dial two tone watch fresh battery excellent ebay,"[39.08788220170087, 36.616368847403294, -12.703811041395227]"
2058,2058,2019-07-06 23:59:57+00:00,aiinante i disney guardian con leading the th july i assure it so busy disney one the parks maxed so fast. however seeing fireworks the th disney amazing,"[65.85470433801088, 39.70171603621212, -0.4125993848890488]"
2059,2059,2019-07-06 23:59:57+00:00,i can’t wait anymore disney uk,"[-2.1915085615398224, -1.9648906915801807, -11.687162946456588]"
2060,2060,2019-07-06 23:59:56+00:00,joethedisneyguy joe people be rude a movie theater right buddy did get tweet me saying you me the tim taylor al borland of disney you’d watch home improvement to get i said man,"[38.71640309943927, 11.762671337449135, -8.754196656423474]"
2061,2061,2019-07-06 23:59:52+00:00,caddicarus honestly i not gonna watch it. the disney remakes i seen i haven enjoyed,"[7.51964236309441, 18.421855377782947, -12.518418430064443]"
2062,2062,2019-07-06 23:59:51+00:00,i not saying damn thing it than fact walt disney would literally shit a brick,"[15.908120729443471, 10.2050982878077, -10.637673021711834]"
2063,2063,2019-07-06 23:59:51+00:00,"drwick i’m a big fan pics taken head on, there aren’t many choose from. plus pics anti social me has mostly cat/disney that’s the vibe i’m going for.","[45.5456134988055, 68.44526961667927, -8.186494801967271]"
2064,2064,2019-07-06 23:59:41+00:00,"lrgiles can have black disney princess isn already a established character. ""besides tiana"" not racism, just annoyance. plain simple.","[6.391735945100426, -2.506433606514975, -11.167236531604843]"
2065,2065,2019-07-06 23:59:34+00:00,ranting monkey disney huge doubt. they ridiculous.,"[21.37249323958486, 1.288684653038572, 0.17518376039152628]"
2066,2066,2019-07-06 23:59:30+00:00,ptv mickeysmagic live dizneydan disney fiasco ep. | st time visitors to disney via youtube,"[18.140271327163607, 17.81155809454357, 1.9932667889501516]"
2067,2067,2019-07-06 23:59:27+00:00,there’s many white bitches disney can’t wait some color,"[8.536611243032471, 5.1438435574811905, -10.696539982740546]"
2068,2068,2019-07-07 23:59:59+00:00,disney announces additional release dates for more in the designer ears collection designerears disneyblog disneyears disneylife disneymerchandise disneyparks disneystyle minnieears themainstreetmouse waltdisneyworld disneyland tmsm,"[62.56837397616449, 51.148302560160744, -8.984278845986964]"
2069,2069,2019-07-07 23:59:59+00:00,"i agree s best ""disney prince"" i like fact my live action mulan a strong independent woman don need man","[31.773379261738544, 37.343132019584615, -11.72570499238276]"
2070,2070,2019-07-07 23:59:56+00:00,the disney budget clearly bottomless,"[19.866619883820892, -0.7424765969606288, -11.444959843105458]"
2071,2071,2019-07-07 23:59:54+00:00,adelebbbi aneutrallife minysoda turtle pi disneystudios chinese people hated the animated movie it a mock their culture. i understand you’re saying disney movies about people color they want satisfy people americans.,"[64.81599728881704, 21.745486374553266, 24.668968854312666]"
2072,2072,2019-07-07 23:59:53+00:00,i also kinda...just these disney live action movies that to with and attention span. live action movies always hard me.,"[22.567895724691784, -5.2774323114638975, -10.241765144672755]"
2073,2073,2019-07-07 23:59:49+00:00,i don’t know you ever watched disney channel you younger but.. cameron boyce died the age very recently ripcameronboyce why did he have to go???,"[58.98690927656043, 40.7835062497321, -9.837043344956939]"
2074,2074,2019-07-07 23:59:47+00:00,ok like new mulan trailer seems disney cheesy still im hoping it’ll good it looks rlly good,"[33.726901975924655, 15.638473195410953, -13.109820015217608]"
2075,2075,2019-07-07 23:59:45+00:00,rip cameron boyce were part my childhood sad see go i hope in better place will never forgotten will always part the disney family in hearts. cameronboycerip,"[35.81875387033994, 28.184854160001848, -11.809188385124727]"
2076,2076,2019-07-07 23:59:45+00:00,disney star cameron boyce dead disney descendants,"[20.452962484140162, 17.54541129229611, -11.337044430298747]"
2077,2077,2019-07-07 23:59:45+00:00,chloexhalle you t my ariel disney stupid,"[15.41383677153878, -2.0912763189497388, -12.494294441733842]"
2078,2078,2019-07-07 23:59:44+00:00,disney coming for all of your nostalgia money you fucking dorks,"[9.141749151282763, -3.9305134769807784, 1.0245702087512711]"
2079,2079,2019-07-08 23:59:58+00:00,disney oh okay yay,"[0.9665475534686976, -4.526149386813088, -12.094638792404009]"
2080,2080,2019-07-08 23:59:58+00:00,yeah i not will never understand adults are obsessed disney world,"[-0.48260056638681736, 7.538698596727173, 0.04350991254040082]"
2081,2081,2019-07-08 23:59:56+00:00,"marwabalkar there’s probably code this, body quickly removed via underground system tunnels disney police notified dna matches facial scans performed snipers move position find the culprit wait, someone’s knocking my door, brb.","[115.75230651872756, 87.70310075533642, -8.343815659319276]"
2082,2082,2019-07-08 23:59:56+00:00,"excuse me. the hell. was disneyland security? were employees? it’s sad other disney goers to jump and save women. fuck dude, better serve time.","[24.509872540885983, 31.632235188825305, -12.36856621071199]"
2083,2083,2019-07-08 23:59:54+00:00,outinprague bold y’all assume disney gives shit a measly people. i to laugh.,"[23.380928630122416, 41.57913224451188, -11.79313979512149]"
2084,2084,2019-07-08 23:59:52+00:00,"growing is understanding underlying message disney movies, crying you realize fucked characters situation is.","[29.717604584373237, 41.46974515071359, -11.202262297603468]"
2085,2085,2019-07-08 23:59:51+00:00,"been waiting since i little brown girl see a live action littlemermaid, most all see disney magic happen the screen menken pièce de résistance. bonus lin manuel buddying with menken. come so grateful s happening my lifetime","[46.24107177260529, 51.08337238861954, -9.055994256531093]"
2086,2086,2019-07-08 23:59:49+00:00,"jhansen soontobedrd muffinfanatic so? doesn alter fact aerial danish, story set copenhagen. but i said got interest disney changing those aspects stories. just the colour the actresses skin.","[71.10483652312368, 60.57831687586648, 4.615547195569846]"
2087,2087,2019-07-08 23:59:45+00:00,i no idea he got a disney movie,"[-2.511480826824534, -2.952901296656059, -11.27469114568322]"
2088,2088,2019-07-08 23:59:44+00:00,"pawgchamp this, talks feels alla and cites thread the end people better understand how china felt the first disney adaptation. hope helps","[31.03659530018722, 15.749436331522432, -12.529831362782303]"
2089,2089,2019-07-08 23:59:43+00:00,forasiah i say project more a waterdown biopic disney film.,"[10.466907191457683, 18.327569337265253, -10.644685412495477]"
2090,2090,2019-07-09 23:59:54+00:00,soy jay o it’s gonna disney &amp; hbo top.,"[6.692017830114314, 16.914293007237745, -10.335583274361312]"
2091,2091,2019-07-09 23:59:54+00:00,traderneal i know legends. it’s curse. but there’s tape it’s over. that’s doorbusters aren’t thing anymore. gotta good squashing violence and covering up. love anaheim pd investigating bc saw the video online. disney polices disney.,"[73.65941730772349, 30.60255062119738, 12.210693972018262]"
2092,2092,2019-07-09 23:59:48+00:00,"stoptrump haha this so awesomely pathetic even took time make this. if think anyone actually cares plays ariel a stupid disney remake, you may a liberal. arielisblack ariel whocares democraticsocialist intersectionality ariel disney","[23.20882635499571, 18.333513253534008, -13.333538678193506]"
2093,2093,2019-07-09 23:59:48+00:00,y’all hear out. disney thelittlemermaidliveaction vanessa,"[11.031747248589447, 9.928606643527004, -11.092324262345343]"
2094,2094,2019-07-09 23:59:48+00:00,"this bad boy by inches, i never seen another one like it. two sided. unfortunate rip the bottom though. liloandstitch disney stitchhasaglitch","[23.746117482304076, -0.8547917189300311, -11.9812496489251]"
2095,2095,2019-07-09 23:59:46+00:00,did watercolor painting the monorail going the disneycontemporaryresort so exciting see experience . . hope enjoy . . art fanart disney artofdisneyworld disneyworld paint…,"[20.86145446464082, 11.972572345078191, -13.909735439515046]"
2096,2096,2019-07-09 23:59:44+00:00,tsum tsum set log the disney vehicles set,"[8.664790421021909, -5.317244430162127, -10.72161427438634]"
2097,2097,2019-07-09 23:59:44+00:00,"munchclubtv see only would simple, i a feeling that disney wanted directors stretch role out.","[21.553181155453576, 29.12132334580386, -10.84242794705429]"
2098,2098,2019-07-09 23:59:43+00:00,mothulu kennethskates reltble bbybris officialnakeke disney blue bell ice cream “challenge” wear person licks ice cream the store puts back... got years lmao,"[35.15564584458624, 10.931386454542263, 1.986324423623529]"
2099,2099,2019-07-09 23:59:41+00:00,disney por favooooor,"[11.054324426388522, 9.875273952792524, -11.061101904566364]"
2100,2100,2019-07-09 23:59:24+00:00,since got disney the brain,"[-5.137020201493956, -2.947793054428175, -10.841800722816288]"
2101,2101,2019-07-10 23:59:58+00:00,"disney animation amazing delivering incredible story artwork perfectly depicts emotion characters suppose feel. that be lost live action. it happened beauty beast, hopefully can capture the same magic thelionking","[13.375541173896, 58.661268710980025, 20.6661168372206]"
2102,2102,2019-07-10 23:59:50+00:00,bill vacation disney springs,"[19.15000627286882, 8.606393321448849, -10.866931098281434]"
2103,2103,2019-07-10 23:59:47+00:00,"watching show this kid goes record show a vhs tape ya know made remember disney channel a lizzie mcguire marathon start finish my grandma recorded every single episode. the whole day. every episode yup, still it somewhere too.","[34.086700154117345, 58.89391412948838, 4.599281316559214]"
2104,2104,2019-07-10 23:59:43+00:00,john wick writer joins falcon winter soldier disney series,"[31.695061355087002, 19.089550798993848, -11.244853254942328]"
2105,2105,2019-07-10 23:59:42+00:00,"nowthisnews personally, i t view as ""disney made ariel black"". i view as ""the actress was announced play ariel happens be black."". y are thinking hard this.","[49.22229831782635, 7.5530622844948, 0.23034615287450322]"
2106,2106,2019-07-10 23:59:41+00:00,fairy tales early times bloody harsh. disney tales not tradition...,"[32.8368047076308, 34.283674522309916, -10.751654358855532]"
2107,2107,2019-07-10 23:59:40+00:00,prince philip sleeping beauty s tier boyfriend material one the best disney males hands,"[41.323647056825315, 47.52243106225906, -10.486156501797367]"
2108,2108,2019-07-10 23:59:28+00:00,"softlillarrie disney like ""we gotta profit the gays somehow. not put gay content our streaming service youre forced pay rather netflix????""","[47.4125176533207, 43.832095228666574, -10.021490776422311]"
2109,2109,2019-07-10 23:59:27+00:00,parents disney star cameron boyce reveal cause death,"[9.445063920409549, 18.799363961332226, -12.070027869465598]"
2110,2110,2019-07-10 23:59:26+00:00,goodkingjon disney too much money the quality be low,"[-2.1393622378990953, -1.1660305490273122, -11.697715589798214]"
2111,2111,2019-07-10 23:59:23+00:00,"senwarren icegov thejusticedept st de criminalize immtn &amp; undoc ed entries. then catch release customs entry check like tourists. that /day would put up star hotel, daily disney passes, etc. to so bad fraud.","[45.528322319753194, 71.02388594668842, -8.96354287049688]"
2112,2112,2019-07-11 23:59:57+00:00,walt disney,"[-0.8255470540100387, -2.004597527606038, -11.455943406313452]"
2113,2113,2019-07-11 23:59:51+00:00,"disney, please stop it with the live action remakes","[6.772257522860397, -3.078468718930019, -10.845298936572014]"
2114,2114,2019-07-11 23:59:50+00:00,disney channel dedicate descendants telecast the late cameron boyce,"[8.275755854309825, 9.608926033537486, -10.732760500760492]"
2115,2115,2019-07-11 23:59:46+00:00,i still shocked died. i really on disney channel. i feel sad inside this happen him. i wish he would lived longer. i know family his disney channel family sad this crying his death. ripcameronboyce,"[15.658501674179082, 13.819910759585113, -17.17757725632181]"
2116,2116,2019-07-11 23:59:45+00:00,"we thought ""live"" remakes disney movies better the vhs sequels, are they?","[9.840282575688644, 5.133837824851909, -10.758949565504246]"
2117,2117,2019-07-11 23:59:40+00:00,and we visit one another to trade… not today the disney family museum,"[6.68302207529688, 5.812922462743188, -10.143851834716543]"
2118,2118,2019-07-11 23:59:40+00:00,"jazz spavlisak wbgames wbhomeent wbpictures for di come back, disney would admit made huge mistake, get avalanche back, why would wb sell back studio to competitor? , admit messed go find a bunch team members, rehire, and hope the old code still intact somewhere. that","[113.33165013844335, 94.95732081554745, -6.852510784445698]"
2119,2119,2019-07-11 23:59:37+00:00,"instead hosting premiere, disney be donating money a charity was near dear cameron boyce heart.","[62.082251471630485, 53.59487624238551, -9.274297422184787]"
2120,2120,2019-07-11 23:59:37+00:00,follow new blog instagram disney updates,"[-2.698746743535483, 3.49324782400739, -10.525418256905645]"
2121,2121,2019-07-11 23:59:36+00:00,just posted photo disney springs,"[7.076027971425597, 15.395718752311097, -10.62477394630126]"
2122,2122,2019-07-11 23:59:29+00:00,disney channel dedicate descendants telecast the late cameron boyce,"[8.275755854309825, 9.608926033537486, -10.732760500760492]"
2123,2123,2019-07-12 23:59:53+00:00,living the whites coming soon...enjoying magic kingdom disney orlando,"[40.725340274110856, 20.62133529658837, -9.865593836117128]"
2124,2124,2019-07-12 23:59:51+00:00,"disney, why?","[8.076986280558696, -2.0787054997597587, -11.162326598341856]"
2125,2125,2019-07-12 23:59:36+00:00,"democratic primary contender andrew yang goes war disney over remake scandal... ""with yang coming against disney recent slew remakes, s setting up be most loved candidate because these live actions suck,"" says correspondent.","[53.017183439247724, 75.3396268924115, 3.0286918479033744]"
2126,2126,2019-07-12 23:59:30+00:00,junesharmony i think china sing don’t get wrong...but i prefer sierra voice. i think reason because china sounds younger has disney sound. this girl gives me r&amp;b,"[29.123803453224884, 50.05476876751308, 0.03640648292524418]"
2127,2127,2019-07-12 23:59:25+00:00,dozens disney world workers arrested child sex stings,"[45.77804715928565, 53.91860432985338, -9.690810442662936]"
2128,2128,2019-07-12 23:59:22+00:00,"loving film every single scene we haven’t seen anything like scenes we have seen, it’s going suck. and would hidden scenes any different? it’s disney remake.","[31.36585102385907, 47.41577409124322, -0.3733274286490058]"
2129,2129,2019-07-12 23:59:22+00:00,dolbycinema amchelps i went see spider man dolby cinema disney springs when recline seats screen cut i choose dolby cinema specifically the well designed theatres since i going have choose theatre of hometown. let,"[68.08676041027483, 30.470078498412008, 3.0876449249524427]"
2130,2130,2019-07-12 23:59:18+00:00,check disney little mermaid lamp night light under the sea sand castle rare euc ebay,"[38.86036776403904, 26.910630277156073, -10.019814206318316]"
2131,2131,2019-07-12 23:59:18+00:00,ellle em disney guy ok you know this project really needs? the guy amadeus.,"[-2.0963760445841286, 5.184516220551927, -10.988070746786406]"
2132,2132,2019-07-12 23:59:14+00:00,tfurstman i absolutely agree i such enormous fan pretty much everything walt disney worked and would so wonderful all projects worked on the service not mention would fantastic new generations get to see wonderful work,"[32.25082066708065, 36.36182051258852, -17.64744657554847]"
2133,2133,2019-07-12 23:58:56+00:00,it a terrific week camp...celebrating disney style matergardensstingraypride leadershipinnovationandservice ourmgafamilyrocks,"[0.31594581947380784, 18.29454551887327, -11.596435421514833]"
2134,2134,2019-07-13 23:59:59+00:00,hi disney make live action hercules starring chris evans rebecca ferguson meg please,"[41.507282162396926, 18.655531702122914, -9.829709155431999]"
2135,2135,2019-07-13 23:59:56+00:00,countdankulatv jamie pull that episode the timon und pumba series made disney they had gfs,"[19.508573650750254, 37.75533204924087, -10.098749083451878]"
2136,2136,2019-07-13 23:59:54+00:00,"m r g nah, looks fake be disney cgi.","[20.14083268482278, 9.578700168099552, -12.279612515917577]"
2137,2137,2019-07-13 23:59:53+00:00,amazon offering disney channel original movies . prime day long story short i’m going get tipsy watch zenon trilogy. primeday,"[47.62194444839775, 28.761052507103102, -9.403492836761998]"
2138,2138,2019-07-13 23:59:40+00:00,"i walking right the middle main street, usa disneyland disney disneyhorses mainstreetusa horses disneylife disneylifestyle disneygram instadisney disneyinsta happiestplaceonearth","[38.788902676977294, 30.49711585034484, -9.992804554098313]"
2139,2139,2019-07-13 23:59:25+00:00,marcusjohns i’m disney kid,"[-1.5058358187900425, -1.2810479942595028, -11.600098405299054]"
2140,2140,2019-07-13 23:59:16+00:00,"a whole new world, disney aladdin year old claire crosby dad","[10.165130979416194, 18.02527018007102, 0.9878892603705083]"
2141,2141,2019-07-13 23:59:04+00:00,disney dumbo digital download giveaway winners,"[43.10492920623984, 52.0011323280344, 2.0032940810734488]"
2142,2142,2019-07-13 23:59:00+00:00,mitchelwade oh wow disney crew could this,"[10.152488528246469, 8.320766150940742, -11.42298001270624]"
2143,2143,2019-07-13 23:59:00+00:00,can you name just one character from every disney movie? – buzzfeed,"[6.728464739956313, 13.29933642986073, -9.565596692374584]"
2144,2144,2019-07-13 23:58:53+00:00,"yuriaidoneus add even she wasnt real it just bs story disney made up, race matters the story should maintained.","[12.576547285194483, 23.476247935410086, -9.207077869236954]"
2145,2145,2019-07-14 23:59:45+00:00,disneylandtoday i t think s eve disney t confirmed that lol disneylandtoday,"[27.099779828089293, 15.616695581806098, -10.112995514863101]"
2146,2146,2019-07-14 23:59:39+00:00,disney pulls plug fx networks standalone streaming service,"[13.135973571237312, 23.165876855713282, 12.063863140796688]"
2147,2147,2019-07-14 23:59:37+00:00,disney adults drama kids the energy,"[11.330729967782627, 19.28916619656927, 0.5275429660254929]"
2148,2148,2019-07-14 23:59:36+00:00,the lion king disney remakes the power nostalgia,"[21.681245306683582, 20.927200073253765, 1.4040620822404293]"
2149,2149,2019-07-14 23:59:32+00:00,i looked disney channel announcer looked like he somehow simultaneously exactly not all what i expected,"[-3.100441514637164, 6.272387496701427, -11.060375089964694]"
2150,2150,2019-07-14 23:59:29+00:00,four dude bros decide get married eachother become mormon where’s disney movie?,"[49.2209574425481, 29.516489153955284, -9.710906137991728]"
2151,2151,2019-07-14 23:59:29+00:00,it’s kind fun do impossible. waltdisney quotes disneyfan disneyworld snowwhite disney wilderness lodge,"[13.122448208423027, 10.76597086491757, -0.9436480283111095]"
2152,2152,2019-07-14 23:59:27+00:00,"themouseandmore oh my, i thought i the overpacker going disney.","[-3.3687340480556633, -1.6263227698276315, -11.042713806788552]"
2153,2153,2019-07-14 23:59:25+00:00,"dear disney, want new concepts, not live action remakes","[4.525685348994554, -3.9665487523023946, -10.59719823513877]"
2154,2154,2019-07-14 23:59:25+00:00,our complete detailed tour &amp; stay at disney coronado springs resort gr... via youtube,"[1.7649034950619906, 2.9348612364770115, -9.860136141360883]"
2155,2155,2019-07-14 23:59:22+00:00,poppoiis disney rolling the cash,"[19.684298327026934, -0.5193330456464271, -11.627281399899417]"
2156,2156,2019-07-15 23:59:48+00:00,"usatoday time the gubmint sell area disney universal. think it space world, aliens , flying saucer roller coaster rides, black holes can fall into. they make billions billions dollars.","[69.91811611438409, 60.14243942139822, -7.982710663878876]"
2157,2157,2019-07-15 23:59:47+00:00,glamz disney owns marvel wanted sever property it could start original programming its streaming platform.,"[44.001248082878575, 22.919753171866716, 1.618594932905367]"
2158,2158,2019-07-15 23:59:39+00:00,check leapster leapfrog disney tangled reading learning game pre k st ages leapfrog via ebay,"[36.63076851229393, 34.699056860390584, -9.52726649983299]"
2159,2159,2019-07-15 23:59:37+00:00,lashanalynch robots such this lovely my inherent hatred disney capitalism general knowing number black people behind camera these projects still likely low makes less excited principle,"[61.55025722511643, 62.736482287418895, -0.8723948795884979]"
2160,2160,2019-07-15 23:59:22+00:00,"top disney executive arrested for operating pedophile ring. the senior executive’s arrest comes days police announced have uncovered huge pedophile ring disney world, florida. over employees arrested alleged child rape offences.","[103.62668169574277, 129.27926936265357, 4.443686132318575]"
2161,2161,2019-07-15 23:59:18+00:00,walt disney,"[-0.8255470540100387, -2.004597527606038, -11.455943406313452]"
2162,2162,2019-07-15 23:59:13+00:00,disney’s adventures the gummi bears.,"[8.97022342719009, 8.86446743427791, -10.950627334600156]"
2163,2163,2019-07-15 23:59:13+00:00,royal palace the disney dream my go spot glutenfree breakfast options a low key setting. here my review my st two breakfasts on recent day cruise disneycruise disneycruiseline click link full review &gt;,"[55.2749566741011, 43.90142742591503, -8.011966849057089]"
2164,2164,2019-07-15 23:59:13+00:00,"hillarymonahan america currently struggling w/burgeoning exploitive monopolies general our digital infrastructure a little gross, civic infrastructure going same direction, and, hi, disney ooh, randomly found the day hanes the major bra brands.","[93.81350038015044, 83.47683301697047, 2.051154497682816]"
2165,2165,2019-07-15 23:59:12+00:00,exciting announcement i finally share you something i’ve working a dream come true. sneak peek new the kidinme disney parks figurines that are releasing my disneyland disneyanna signing july th th disneylandtoday,"[53.55675863570564, 57.497412549232095, -9.948877563390923]"
2166,2166,2019-07-15 23:59:11+00:00,"""sony gives literary film division, axed disney, second life"" brooks barnes via nyt","[22.76094873927374, 31.486640120774048, -0.2144596316132592]"
2167,2167,2019-07-16 23:59:57+00:00,"seriously debating i rent old disney channel movies prime cents, that where i at my life.","[39.806098397489926, 43.0271687334355, -9.725173688532706]"
2168,2168,2019-07-16 23:59:55+00:00,disney take page other theme parks make souvenir cups refillable. at price course.,"[26.23666013858057, 18.0756720129706, -9.955638807797442]"
2169,2169,2019-07-16 23:59:44+00:00,harry styles talks play prince eric disney’s ‘the little mermaid’ –,"[52.29361923903395, 52.98841069281023, -9.23688979357216]"
2170,2170,2019-07-16 23:59:38+00:00,"awwwwwwww. a couple years ago disney laid all american workers were costumed non speaking, replaced with indian labor. cheap labor. less half cost. i guess can live the pay the stolen american jobs. but did it.","[69.41718679707414, 28.642883089465144, -6.637366067336714]"
2171,2171,2019-07-16 23:59:36+00:00,movie questions . le daim . pulp fiction . taxi driver .vol au dessus d’un nid de coucou .the greatest showman . rrrrrr . un disney . oss . philadelphia/la ligne verte . fight club reply an emoji i send u questions,"[55.159941873189176, 92.65930861778656, -11.444687498051636]"
2172,2172,2019-07-16 23:59:34+00:00,you doing good disney.. please don’t fuck up sorry sorry,"[-3.8255838952550034, -1.2710429081115255, -13.973118094189068]"
2173,2173,2019-07-16 23:59:17+00:00,shaayyllaa my favorite disney movie.,"[0.03083350723304501, 7.537535402392216, -11.894170418662448]"
2174,2174,2019-07-16 23:59:14+00:00,everybody leaving fox foxa nws nwsa combo fox chief joins sony being jettisoned disney sne sne movies mergersandacquisitions ownershipchanges,"[33.839713671183624, 42.351032067065645, 0.7592202558325596]"
2175,2175,2019-07-16 23:59:13+00:00,disney snubbed casey frey. that’s i’m gonna say,"[-2.6357627086026474, -2.109251505164878, -11.177592096857218]"
