,Unnamed: 0,Time,Text,Sentiment
2913,2913,2019-09-21 23:58:59+00:00,lorenzomazikeen i love hercules meg’s song one my favorite disney songs,"[13.527161332795576, 6.317443607766499, -12.81980929871203]"
2914,2914,2019-09-21 23:58:47+00:00,"goodolprice right? like, s comic. but disney gunshy doing another ride movie reasonable , educational series figment abs dreamfinder? go talk various professionals how use imagination make new things? that would great","[38.79736477049723, 19.828440893700687, -10.34507147581165]"
2915,2915,2019-09-22 23:59:58+00:00,this brutal me finish i got done. . . . aladdin cake aladdincake lamp jasmin disney arabiannights awholenewworld losangeles northhollywood hollywood sanfernandovalley sfv …,"[31.734227361180817, 21.101520817184053, 12.628273797955515]"
2916,2916,2019-09-22 23:59:47+00:00,"i entered win copy the ""i am walt disney"" book attractions magazine","[18.437009361536173, 26.74326271572, -10.128078007724618]"
2917,2917,2019-09-22 23:59:45+00:00,the ceo fucking disney all companies tells your company site sucks shit ve really fucked,"[27.679228451970513, 8.873661294899279, -12.492710664869108]"
2918,2918,2019-09-22 23:59:42+00:00,enter win live action disneyaladdin &amp; walt disney signature collection version the animated classic,"[18.59345507679514, 27.164138904537168, -10.569010472190143]"
2919,2919,2019-09-22 23:59:33+00:00,the slow burning success disney’s bob iger disney media movies streaming,"[18.58810093975416, 29.669228165087304, -11.836821793156716]"
2920,2920,2019-09-22 23:59:31+00:00,whoever in charge the disney remakes needs be fired.,"[16.974678652236168, 7.030419373327334, -10.669907593002293]"
2921,2921,2019-09-22 23:59:27+00:00,rt originalfunko want makeup routine be little wicked? the funko pop disney cosmetics collection available ulta beauty store and select products available online. funkofabulous,"[58.098009818365206, 59.29226530930238, -8.914764897643849]"
2922,2922,2019-09-22 23:59:26+00:00,deb nice hope get win ya i’m watching my hotel room disney haha,"[11.219061587353625, -0.4546697065948, -12.432479208589612]"
2923,2923,2019-09-22 23:59:22+00:00,or it another disney princess?lol,"[-3.393089794124964, -2.678082150478382, -11.020083725675782]"
2924,2924,2019-09-22 23:59:21+00:00,it also enough pockets store birbs in. a concept disney princess the good thing the accuracy tho.,"[26.30198825372158, 17.238113800830163, -11.317658271785746]"
2925,2925,2019-09-22 23:59:05+00:00,check disney vintage pocahontas sunflower shower curtain vinyl the water works co disney via ebay,"[27.67120773468928, 26.424869392368237, -10.47693589905603]"
2926,2926,2019-09-23 23:59:58+00:00,today disney day part spiritweek clearthelists shrinkthelists id love get cricut please rt,"[0.08087637473352483, -6.709228099694187, -12.412897539638436]"
2927,2927,2019-09-23 23:59:55+00:00,godzillawonkru nowayneophobic mrmatthewmanboy coreybroom deathofstarwars nor me. i excited disney bought sw marvel movies doing well had good writing teams. i figured made sense teams would focus sw too. i wrong. very wrong.,"[37.567566117283796, 47.506953529659214, -14.115046196237316]"
2928,2928,2019-09-23 23:59:54+00:00,brocasbrain williamshatner disney it would where microwave oven at,"[7.851368705149317, 7.061430619843584, -10.929453584630274]"
2929,2929,2019-09-23 23:59:53+00:00,"you my mini my mickey. what would i with you my side. wife wifey love sydney lgbt lesbian disney kirribilli, new south wales","[41.82441847154828, 43.44333152758101, -9.623030418557462]"
2930,2930,2019-09-23 23:59:48+00:00,"“well first off, bob i’m gonna need working playstation copy the phantom menace game, a printed cheat code sheet a hours myself then i pitch my dash rendar disney plus series”","[81.91578618161019, 74.91955197060743, 15.581528638341936]"
2931,2931,2019-09-23 23:59:46+00:00,hamillhimself don’t dumb mark stick getting character assassinated disney star wars that’s you’re good,"[1.7112476901087674, 35.204824089973705, -14.313445040550292]"
2932,2932,2019-09-23 23:59:46+00:00,resist disney shakiahjohnson but way portrayed the first instance is about character his abilities.,"[-5.926278601288085, 16.002714548105004, -9.937714063043202]"
2933,2933,2019-09-23 23:59:39+00:00,steven papyrus kenjohnson disney can’t wait watch peter pan live kenjohnson. it’s glorious,"[20.887930017209943, 27.55287199004257, -10.627326928569573]"
2934,2934,2019-09-23 23:59:38+00:00,"if disney owned twitter, account suspensions would triple.","[7.629246934344171, 5.1463868737979155, -10.69833093154346]"
2935,2935,2019-09-23 23:59:37+00:00,win copies aladdin signature collection &amp;amp; disney aladdin live action via geeky girl,"[54.76301587682514, 12.14156347059648, 24.28628700383574]"
2936,2936,2019-09-23 23:59:36+00:00,oldlacestarlet pay car. pay my sisters debts. take my family disney world.,"[6.876778683999523, 7.553958579925393, -11.328327561205228]"
2937,2937,2019-09-24 23:59:58+00:00,"reposted dadventurewdw get regrann favorite places eat walt disney world our disney parent panel back toptuesday. we spots the parks, resorts, more what made our…","[30.270560775254783, 26.241343844879196, -9.749206869051832]"
2938,2938,2019-09-24 23:59:56+00:00,"mymusictaste a.c.e come florida have universal studios, disney world wynwood art walls acethechallenge","[33.78639409769759, 30.451939642582126, -10.212565736382999]"
2939,2939,2019-09-24 23:59:41+00:00,nogifqueen i one i paid enough from disney world the sucker cut trees with poke.,"[15.921477664611405, -2.3278386550374397, -11.227509049448216]"
2940,2940,2019-09-24 23:59:41+00:00,slythrvn me watching anything made disney ever,"[-2.2584646177926713, -3.4181941686459116, -11.211621157546432]"
2941,2941,2019-09-24 23:59:37+00:00,elienyc chuck todd arguing the sheriff nottingham disney robin hood gain fruit chuckles &amp; laughter the audience.,"[67.5755449588756, 66.41603461733762, 2.259028365164724]"
2942,2942,2019-09-24 23:59:30+00:00,disney makes wish,"[0.06109497735844793, -1.5510667397021298, -12.206547228435038]"
2943,2943,2019-09-24 23:59:24+00:00,"walkingdeadsuck offendedpod disneyaladdin willsmith film critics hate remakes. there’s like two disney remakes critics actually enjoy. while fans actually enjoy the movies. it’s like dave meltzer reviewing wwe show, it’s rarely ever gonna get positive feedback that’s stupid.","[51.07049430929032, 60.51585261158657, -2.7575697937727597]"
2944,2944,2019-09-24 23:59:15+00:00,"chicagocharlie benhartwithnoe skittishprey nowayneophobic club star wars starwarsexplain alejosesw navvai alostgamer dairylives alfonzogee although as unpaid disney schill, i believe all disney released movies perfection, i believe rian johnson’s the last jedi the best the four. and don’t even get started how great chuck wendigs books been can’t wait see input mandalorian","[28.113296073272114, 46.43161218257829, -12.518782471834342]"
2945,2945,2019-09-24 23:59:11+00:00,"jonpaula that would explain ""white slavers"" crack. btw, i like disney doing sw well.","[20.23263065578084, 28.13431045632168, -10.977544022664475]"
2946,2946,2019-09-24 23:59:08+00:00,ad enter win disney pixar toy story blu ray dvd combo pack twoclassychics blog ends giveaway movies pixars toy story dvd movie trailer/,"[71.09776574058485, 106.77656220614818, -6.753021927084276]"
2947,2947,2019-09-24 23:58:58+00:00,"i blame parents getting so cartoons. i remember mother showing lots old cartoons disney, lots betty boop, some windsor mckay shorts like gertie one mosquito one jesus that one freaky .","[70.31764023976584, 45.55700556074153, 12.343091486432215]"
2948,2948,2019-09-25 23:59:59+00:00,"alexpowers geeksourceent orangegrove v jvee wolf before tfa came out, kathleen kennedy said lucas loved it. a puff piece article saying rian johnson says lucas loved tfa t reliable, especially since disney lied lucas in regard. only lucas says would i believe it.","[144.90502578104775, 112.9518262518291, -8.62247252904028]"
2949,2949,2019-09-25 23:59:57+00:00,merry mayhem goes live p est wed night mayhem this weeks topic disney sucks universal rocks. join merryb discusses much better time she is at universal studios she at disney. universalstudios livestream,"[70.74562786150257, 80.75275078332002, 2.4965261389255176]"
2950,2950,2019-09-25 23:59:50+00:00,the walt disney company we want monkey island back ron gilbert sign petition via change,"[48.50152219954881, 16.98193045774336, -9.85492609832879]"
2951,2951,2019-09-25 23:59:47+00:00,"disney disneyplus hulu andi mack such unique piece media be coming disney. showing kids all things lgbtq folks, mental health issues normal okay key making accepting generations. a show helps people accept themself,","[78.89886824213933, 54.13422080740479, 10.59964419585934]"
2952,2952,2019-09-25 23:59:45+00:00,"megalegoluigiex yeah, pretty much. for most part characters a disney song represents or i imagine singing. that not intentional. it sort happens.","[6.572281726141246, 16.31278298697167, -11.861118121485973]"
2953,2953,2019-09-25 23:59:41+00:00,"the memorandum released today pretty much equivalent a walt disney version reservoir dogs. if s you choose believe was all was, i t help you.","[52.29559858977672, 46.36344010341084, -10.219865035833848]"
2954,2954,2019-09-25 23:59:41+00:00,day something tells there danger ahead. disney disneyland disneylandtoday ■ location bigthundermountainrailroad frontierland disneyland ■ disney disneyland disney disneyland disney disneytime disneysid…,"[70.29904866557455, 64.97241700714605, 1.1158845867615383]"
2955,2955,2019-09-25 23:59:35+00:00,have drink me wdwjedimaster destwithchar orlparknews dparkradio disneymarvels lotmpodcast disney discuss donkortajr distwitter disney dwcdon wdw disneyparks disneyresort magickingdom epcot hollywoodstudios animalkingdom starwars disneylove disneylife,"[32.75989609965182, 31.441825050249058, -9.902545550905586]"
2956,2956,2019-09-25 23:59:35+00:00,diedrecoletti anmalbible youfeckingidiot do ever go of house all crazy animals people around you. muchhh much safer go disney world just hide it closes a night. just live the place surely nothing harm there,"[49.9224213276544, 50.0021543722179, 2.190613767488472]"
2957,2957,2019-09-25 23:59:33+00:00,the fans are winning george lucas hates disney star wars geeks gamers,"[55.407848402663625, 48.48757199649068, -0.9352775982803792]"
2958,2958,2019-09-25 23:59:33+00:00,zoeyorkwrites i definitely go disney the organic whole foods.,"[9.271568689204368, 8.968442137043624, -10.577871558751099]"
2959,2959,2019-09-26 23:59:59+00:00,"update still wish i in disneyland, now second guessing i feel doing hour flight again. so maybe disney world?","[25.49510472690297, 27.521465356787544, -10.606916803328616]"
2960,2960,2019-09-26 23:59:59+00:00,jewbaccadefense i still think will put deal together cause both saw unbelievable success working together. until i see sony started filming no disney involvement im choosing be stupid optimist lol,"[30.592221160342053, 49.38084651245687, 12.73494412402458]"
2961,2961,2019-09-26 23:59:57+00:00,check peter pan &amp; return to neverland disney club. exclusive disney blu ray new ebay,"[87.22361327545724, 73.89239123549869, -8.305103869866926]"
2962,2962,2019-09-26 23:59:43+00:00,today professor asked many disney shirts i,"[20.195980404045546, 19.401572549758566, -10.522733753391257]"
2963,2963,2019-09-26 23:59:42+00:00,i a damn good check week &amp; i gonna order bike parts decide get ahead bills. plus i’ll checks october for bike parts... disney also...,"[49.53256057791585, 15.26989936765527, -10.984469599807753]"
2964,2964,2019-09-26 23:59:40+00:00,"itscass depending the company, yes high status companies usually since employees a reflection them who employ aka disney","[50.583784848423214, 49.52316138603793, 3.2922345552943]"
2965,2965,2019-09-26 23:59:35+00:00,disney wears tf mang,"[10.361177245828575, 9.182126772232577, -11.061101904566367]"
2966,2966,2019-09-26 23:59:29+00:00,check what i added my closet poshmark disney mickey and minnie mouse womens t shirt. via poshmarkapp shopmycloset,"[71.43185969874727, 70.63522589143804, 3.7695285841446946]"
2967,2967,2019-09-26 23:59:28+00:00,she’s pos. fox news bought disney last fall. another pro liberal foolish company.,"[40.42308111035551, 21.282269019235116, 1.8803024265710775]"
2968,2968,2019-09-26 23:59:19+00:00,anguseyetea mim podcast disney ruined me... it’s fine,"[20.311581771946365, 18.92249671433068, -13.754983793954274]"
2969,2969,2019-09-26 23:59:14+00:00,"matthewkadish all i get that article is, disney made lucasfilm talk feige, feige likes star wars everything else conjecture","[10.949847924934364, 30.931452122095124, -11.838125890778755]"
2970,2970,2019-09-27 23:59:58+00:00,hey planning next tour canada? click here.. vaping vacation zioc canadamanhunt canada huelgaporelclima peakyblinders pfw spiderman senbenimsin slsthwig duboistetteh disney fridaysforfuture fcusge yorkshire rouen rtoday,"[24.738165660300762, 34.31068033369224, -9.890509100769336]"
2971,2971,2019-09-27 23:59:55+00:00,wdwnt that a good picture earlier the skyliner toy skyliner background. you a great job photo video. i love disney. keep the hard work stay positive,"[13.348074403230658, 43.502158913765754, -3.0389311647557946]"
2972,2972,2019-09-27 23:59:48+00:00,wait disney gonna daredevil are yall fuckin around,"[8.283355449201725, -3.4949295829553155, -11.298924517782574]"
2973,2973,2019-09-27 23:59:41+00:00,randirider it’s we’re disney i’m sad,"[-4.14786491879446, -0.39304684075879637, -12.754050449873638]"
2974,2974,2019-09-27 23:59:38+00:00,"kylie be epcot nov , performing the disney du jour dance party tasteepcot","[43.61181375594399, 32.46367869611214, -10.28872850257973]"
2975,2975,2019-09-27 23:59:37+00:00,ah back the days. memories. going a spin luigi disney disneyland disneyside luigi rollickin roadsters,"[20.006207297350702, 19.822182293697416, -9.843468186218487]"
2976,2976,2019-09-27 23:59:27+00:00,xcudigee wow yesterday with disney princess bandaids,"[-1.3730545903063345, -3.502580063074135, -11.808220009408302]"
2977,2977,2019-09-27 23:59:22+00:00,question quora did walt disney will require company movies be remade every years?,"[28.231356427507098, 16.353892724765785, -9.289859406210326]"
2978,2978,2019-09-27 23:59:16+00:00,"we sold , last night our one night sales event sale. the best numbers our history. that’s huge. we killed so proud. we’re going disney lol jk","[83.42731042207286, 68.71363589440871, 1.955127759999172]"
2979,2979,2019-09-27 23:59:11+00:00,topped by dinner france a great friend epcot walt disney world,"[11.03520375283549, 5.355545370327661, -12.260302345712702]"
2980,2980,2019-09-27 23:59:02+00:00,"daredevil may gone now, if marvel smart, can wait the netflix deal expires then bring charlie cox back daredevil a supporting character the she hulk disney series. heck, could even take fisk together what you think vincentdonofrio ?","[24.368370081027894, 45.53267473711931, 4.124772929091833]"
2981,2981,2019-09-28 23:59:43+00:00,days disney as always cuteness continues moana princess the month belle’s first favorite princess this brings back many good memories me. which character princess other your child’s your first favorite? daystodisney,"[10.478743425784973, 44.781164303694325, -11.939912839344217]"
2982,2982,2019-09-28 23:59:42+00:00,disney tasthic me,"[-1.4157895381052612, -1.935442188522217, -11.368221929175053]"
2983,2983,2019-09-28 23:59:41+00:00,"mgrant you get free disney trip and get free disney trip and you, you, you get free disney trip","[-2.768720303402584, -10.914702656493589, -10.13836977287319]"
2984,2984,2019-09-28 23:59:28+00:00,today the perfect disney day ️,"[0.8560451561253692, -3.791044372667287, -12.570671710165335]"
2985,2985,2019-09-28 23:59:25+00:00,the squad disney world,"[10.970021284771978, 9.027550988971505, -10.909441606749098]"
2986,2986,2019-09-28 23:59:24+00:00,disney night &gt;&gt;&gt;&gt;&gt;&gt;&gt;&gt;&gt;&gt;&gt;&gt;&gt;&gt;&gt;&gt;&gt;&gt;&gt;&gt;&gt;&gt;&gt;&gt;&gt;&gt;&gt;&gt;,"[-0.39380050978979786, -3.0395818158592403, -11.433341365046212]"
2987,2987,2019-09-28 23:59:17+00:00,fantasmic disney’s hollywood studios. has mountain changed shape????? hollywoodstudios,"[28.19707584719269, 9.705966437735395, -10.568091888220842]"
2988,2988,2019-09-28 23:59:17+00:00,now i saying d so weird see alitas sequel disney however i forgotten ghost the shell originally going be disney film touchstone.,"[66.98508326899217, 49.41319532758402, -9.30884303950667]"
2989,2989,2019-09-28 23:59:16+00:00,walt disney. quote image via,"[19.053425444863038, 17.874374971267038, -10.915309824469336]"
2990,2990,2019-09-28 23:59:12+00:00,seriously t wait my nephew be old enough a years i take to disney world,"[14.446477134099926, 4.5608618371558975, -10.46545351223024]"
2991,2991,2019-09-28 23:59:03+00:00,they release disney october way can see of halloween movies choice,"[28.06162129603185, 17.68455760828202, -10.371515808922382]"
2992,2992,2019-09-29 23:59:55+00:00,custom holographic disney magic band using prism holo pigment solarcolordust disney magicband holographic,"[32.55186612112478, 41.09523594583113, -9.578571467624329]"
2993,2993,2019-09-29 23:59:43+00:00,me i need be adult. also acts the entirety disney’s i just can’t wait be king waiting the oven temp,"[16.188741953996843, 36.623791977516404, -8.969721906026095]"
2994,2994,2019-09-29 23:59:43+00:00,disneyland get bent disney star wars.,"[23.13221661288176, 28.911829075269868, -10.62321326483604]"
2995,2995,2019-09-29 23:59:36+00:00,sitting looking a tv looks like minutes adam schiff brains and. i can’t help think there disney channel. they’re much better fiction,"[19.99529925883886, 25.990530382370324, -10.81056248952855]"
2996,2996,2019-09-29 23:59:32+00:00,disney marais oh bahaha im slow.,"[10.84291653735703, 12.019082967775027, -0.8793018396522356]"
2997,2997,2019-09-29 23:59:30+00:00,"robertshivery disneyplus will partaking the disney , hulu, espn bundle? or the one?","[7.857256339647333, 18.130648509157083, 1.4413521303562788]"
2998,2998,2019-09-29 23:59:22+00:00,totally planning trip disney either spring fall.,"[27.29371172705061, 28.47574327692101, -10.36122483306356]"
2999,2999,2019-09-29 23:59:20+00:00,"realdonaldtrump it a tragedy regardless why, amazon/ wsj, nytimes, disney, att &amp; comcast remembered showing fans &amp; critics alike press take sides &amp; cannot be trusted simply report the news completely &amp; truthfully. how un american that?","[104.36386905438097, 74.80519296000087, 2.3921073015344945]"
3000,3000,2019-09-29 23:59:19+00:00,check what i added my closet poshmark mickey mouse disney funny tee grey. via poshmarkapp shopmycloset,"[52.715242832983506, 59.82455648079871, 1.8228255439396008]"
3001,3001,2019-09-29 23:59:00+00:00,"designationsix omerdennissnyd duracell geico progressive amazon zappos ring wholefoods pillpack disney starwars universalpics proctergamble tampax always officemax redlobster arbys applebees ihop tampax gop against tampons, waste money supporting foxnews","[45.74635644819447, 57.75418240554296, 0.2809000896010474]"
3002,3002,2019-09-29 23:58:42+00:00,"still duck mood working new art at least i show some old art , guess fits good my twitter timeline.^^ morgana macawber her lovely family. i this duckvember tumblr, prompt monster duck. disney darkwingduck monstersrus","[7.934982813358535, 33.98978987690096, 10.95556538966666]"
3003,3003,2019-09-30 23:59:52+00:00,neunhofferart katomatoes disney owns punk too,"[22.17101948220131, 11.567989426651863, -11.539930226535702]"
3004,3004,2019-09-30 23:59:48+00:00,koji vu so actually wondered it’s first disney film mixes live action animation. not sure the correct genre. but theory zootopia is there reconciliation.,"[27.32827347434962, 27.300808636351505, -9.57671535982584]"
3005,3005,2019-09-30 23:59:41+00:00,"my year travel started great. disney world, italy, new orleans x, home x, &amp; colorado. my last trip july, currently i’m in a drought i anticipating christmas vacay sure.","[73.93216603872118, 61.47584509736326, 2.8686337571711107]"
3006,3006,2019-09-30 23:59:33+00:00,jamesdeanander disney marvel disney currently fire sale overcome fact galaxy edge such a colossal failure.,"[50.96421917342331, 11.2447171571918, -0.503358217958791]"
3007,3007,2019-09-30 23:59:31+00:00,sony disney spiderman luke marvel,"[1.1742508035718486, 19.45256034019704, -0.09752115604196376]"
3008,3008,2019-09-30 23:59:30+00:00,ttorrieee ashley amoure disney make happen,"[8.529620001049768, 8.214936756351598, -10.900705296881071]"
3009,3009,2019-09-30 23:59:19+00:00,pasan lights por radio disney? ???,"[20.031364756686568, 9.910760850381415, -10.635062514327018]"
3010,3010,2019-09-30 23:59:07+00:00,follow money here usa look the cash given hillaryclinton this doesn t include clintonfdn rapist billclinton tjis called pay play disney paid clinton millions of dollars obviously were going get something return,"[58.62648292401757, 37.234059119160676, -7.577745525355354]"
3011,3011,2019-09-30 23:59:07+00:00,"contritethe ruinthemanbaby disney disney really seems lack respect legacy characters. this also talked for quite while. admiral ackbar, han luke especially have gotten the worst far my opinion, it varies depending you ask. /","[57.99457883246722, 63.67973859562717, -12.967400454879837]"
3012,3012,2019-09-30 23:59:06+00:00,i achievements disney pixar toy story mania points trueachievements,"[21.068782300423084, 40.31598792132235, -9.839134200464038]"
3013,3013,2019-09-30 23:59:05+00:00,i achievements disney bolt points trueachievements,"[10.721338606511193, 19.87574669501325, -10.794650034938684]"
3014,3014,2019-10-01 23:59:59+00:00,xosanaabrooks freeformtv disney pixar ayeeee gotta get kids hocus pocus tonight,"[9.237365922201601, 7.861913680349097, -10.413144167689609]"
3015,3015,2019-10-01 23:59:58+00:00,getwellshells yeah know lol idk i’m gonna go disney anymore maybe i’ll go the miami show idk,"[21.77266042682776, 2.7810695939313343, -9.403598630395834]"
3016,3016,2019-10-01 23:59:55+00:00,enter chance win a walt disney world vacation gogo squeez,"[19.677482733943084, 7.260934325943346, -11.180805174389619]"
3017,3017,2019-10-01 23:59:54+00:00,incredibleculk disney i would like request work tuesday th i go mr toads wild ride you. for reason is my ultimate bucket list challenge.,"[38.50060499567248, 54.07678754952333, -9.88173522789917]"
3018,3018,2019-10-01 23:59:52+00:00,echelon love disney stuff,"[0.8671650966419164, -4.8559170117289305, -12.56678368083687]"
3019,3019,2019-10-01 23:59:41+00:00,someone get sis arilennox singing ghetto disney hymnals her hotel room her ig live. i’m wheezing.,"[18.47245062824371, 18.51814583933195, -10.182886604083265]"
3020,3020,2019-10-01 23:59:40+00:00,this only time i care cable i watch disney movies,"[-5.281433813754201, -3.9447974456592623, -11.100458419565413]"
3021,3021,2019-10-01 23:59:40+00:00,joe rohde should government break the walt disney company?,"[9.15389412697105, 8.579317381352787, -10.60853323537848]"
3022,3022,2019-10-01 23:59:36+00:00,okay is disney bringing back old disney movies october or?,"[6.393733516614479, 5.018847888615781, -10.285604063724364]"
3023,3023,2019-10-01 23:59:35+00:00,geeksgamerscom disney live action remake = box office bomb. i don’t think i’ll seeing,"[17.85748809884897, -2.035309941894909, 1.304768127572686]"
3024,3024,2019-10-01 23:59:31+00:00,i cannot wait that disney plus xmas movie bill it cuz looks so soft i cannot wait.,"[22.899650020735496, 41.15105898042462, -12.277470347933203]"
3025,3025,2019-10-02 23:59:51+00:00,"named disney ice queen, the koala joey being hand raised australia keeper hayley the australian reptile park.","[89.45567988229233, 88.70595086420909, -8.988025026358699]"
3026,3026,2019-10-02 23:59:50+00:00,mcu direct tomholland disney robertiger sonypictures it shows much cares spider man it’s honestly heart warming,"[21.144958856856892, 1.4517734327042144, -14.036726809923522]"
3027,3027,2019-10-02 23:59:46+00:00,like you agree an in n out a regal cinemas be added downtown disney anaheim california. i also hope the rainforest cafe comes back. i hope see least thumbs ups.,"[56.85605215959233, 46.474681197375574, 12.07136049758175]"
3028,3028,2019-10-02 23:59:45+00:00,i achievements disney bolt points trueachievements,"[10.721338606511193, 19.87574669501325, -10.794650034938684]"
3029,3029,2019-10-02 23:59:40+00:00,lmao rey kills chewbacca eat dick disney have idea to use star wars,"[10.501358107927746, 22.945672262365292, 0.49117031316687587]"
3030,3030,2019-10-02 23:59:28+00:00,"disney dominated box office years, experts say will face challengers","[19.908194282851913, 21.17873294483077, -10.259745337897897]"
3031,3031,2019-10-02 23:59:27+00:00,i t ever want last day disney end ️️️,"[7.7278590122895325, -4.276195016248018, -11.15552948212816]"
3032,3032,2019-10-02 23:59:25+00:00,"come to disneyland, eh? disney holiday discount for canadians| car smashes through nail salon | brazen robbery caught on tape | patch pm","[57.77466727742887, 40.46722869564658, 2.371371679067252]"
3033,3033,2019-10-02 23:59:16+00:00,so disney freeformtv really never plays underwraps all october anymore? daysofhalloween,"[21.48513478181778, 20.753983585466102, -11.892097647324164]"
3034,3034,2019-10-02 23:59:15+00:00,a lot misses this era. but i respect this maybe last time disney willing be...strange. in terms a theatrical animated motion picture,"[39.83617003298132, 53.30103540576984, -11.462292937956633]"
