,Unnamed: 0,Time,Text,Sentiment
1023,1023,2019-04-03 23:59:59+00:00,"pretty rough start the box office, things looking up. both captain marvel us been tearing up of late, disney dumbo may underperformed a bit its opening...","[37.9365671158507, 19.20009688714528, -11.23330903420053]"
1024,1024,2019-04-03 23:59:53+00:00,my hubby surprised with flowers today and i’m really loving colourpopco disney villains misunderstood palette the colors so vibrant myhubbylovesme colourpop disneyvillains misunderstood,"[45.010801265003174, 39.76680004907574, -11.623038688436324]"
1025,1025,2019-04-03 23:59:50+00:00,reminder disney owns scene now.,"[22.73676918703275, 31.650516245833963, -10.879879508188893]"
1026,1026,2019-04-03 23:59:48+00:00,"i thoroughly enjoy disney movies, specifically beauty the beast. i the beast looking my beauty these streets.","[48.28149528779843, 40.91335583630364, -0.7510307292794494]"
1027,1027,2019-04-03 23:59:47+00:00,the lord testing cousin messaging about disney baby shoes how priced are,"[6.410091537057572, 15.570943871582912, -10.168996337539568]"
1028,1028,2019-04-03 23:59:47+00:00,so the celebs do like disney the circle life song obviously different song in tribute the man. js,"[53.24538439137179, 39.9773694514835, -10.974614380968049]"
1029,1029,2019-04-03 23:59:46+00:00,"when writing happily ever after, best playlist a disney playlist authorconfession writing","[2.270061930615033, 29.34597618844758, -0.7002103594447107]"
1030,1030,2019-04-03 23:59:41+00:00,johncampea disney like,"[-0.5443469485389134, -1.7428947568086106, -11.619727430001326]"
1031,1031,2019-04-03 23:59:29+00:00,"in disney hercules, one point phil song starts, makes statement ""oh god,"" agreeing train hercules. before this, makes several condescending statements zeus, in greek mythology, essentially god. so t phrasing ""oh zeus?"" disney","[84.8525453344487, 66.56113898133434, 14.473327048779865]"
1032,1032,2019-04-03 23:59:29+00:00,divineinsanity a deadline article said disney want keep collab sir ridley company scott free ...,"[39.0853050121596, 17.721127229029634, -9.984994844728021]"
1033,1033,2019-04-03 23:59:28+00:00,putting together disney surprise box christopher. i know he’s young i’m first time mom we extra like ‍️‍️,"[-1.5132795704540982, 4.195310900907245, -11.669831205867922]"
1034,1034,2019-04-04 23:59:59+00:00,had work social today i beat everyone disney trivia won gift card prize,"[7.2668613325705325, 15.669712550419675, -11.158106779814489]"
1035,1035,2019-04-04 23:59:53+00:00,comicstitan disney no delivery australia either,"[8.679966523565422, 20.50162927726946, -10.983516130769779]"
1036,1036,2019-04-04 23:59:38+00:00,harambe market disney’s animal kingdom • harambe market a quick service option animal kingdom that’s open lunch dinner. located the…,"[80.13993419364556, 43.293259998303554, -8.888293710661884]"
1037,1037,2019-04-04 23:59:36+00:00,lion king one disney’s best productions.,"[11.8151256808009, 19.2499855916544, -11.742878787504722]"
1038,1038,2019-04-04 23:59:23+00:00,apparently i know every word the lion king thelionking disney disneystudios,"[7.1835211272918515, 26.684512092633668, -9.752598177329133]"
1039,1039,2019-04-04 23:59:18+00:00,check philosophy the gingerbread house shower gel lip gloss box set easter gift via ebay christmas winniethepooh disney thanksgiving rare fashion style sale vintage shopping forsale etsy fashionista toys easter plush ootd,"[100.50940138726772, 107.01071586993106, -7.770490642931392]"
1040,1040,2019-04-04 23:59:16+00:00,"well, was fast, kingcael thank very much art prints i ordered, plus the little extra goodies messages p.s. you’re welcome i won’t making animethon year of disney trip my destiny islands trio september. &gt;.&lt;","[68.7948562323371, 100.82734460888476, -10.789228198871243]"
1041,1041,2019-04-04 23:58:53+00:00,"cubfan a ""hall progress"" like old school disney pavilion epcot. it show cases technical progress products con corp","[29.932884447304335, 39.648857616981736, -10.208168690952704]"
1042,1042,2019-04-04 23:58:48+00:00,might good disney remakes the classic shows,"[-0.20092802441594704, 6.056720140704108, -11.92395611230863]"
1043,1043,2019-04-04 23:58:45+00:00,can someone disneyland paris me please i want go bad i’ve never to disney park it’s one my biggest dreams ️,"[15.227340455271804, 7.430113903200038, -10.9598930110309]"
1044,1044,2019-04-04 23:58:40+00:00,"lunamiranda i mainly referring memories high school college i saw people, strangers, would talk my friends mock for wearing anime superhero disney clothes, superficial stuff like that, thinking i couldn’t express for fear judgment","[61.70054852751965, 58.05541381812505, -8.220534779413143]"
1045,1045,2019-04-05 23:59:33+00:00,lego disney princess little mermaid ariel the magical spell new sealed lego game christmas,"[21.469864204091355, 9.44759538527434, -0.357004067681018]"
1046,1046,2019-04-05 23:59:31+00:00,disney luxe thank i’m lucky have her.,"[3.307887359880209, 11.878081288537864, -13.911142064622759]"
1047,1047,2019-04-05 23:59:28+00:00,imjustdeo gotta something justify price tag. shits going get interesting we start seeing prices the various disney packages include hulu espn,"[56.9017566067749, 61.90732094663885, 1.4831144738277686]"
1048,1048,2019-04-05 23:59:23+00:00,disney portorleansriverside disneyland disneyworld waltdisneyworld magickingdom epcot disneylife waltdisneyworldresort animalkingdom disney port orleans resort french quarter,"[32.667441553612214, 20.349613069970836, -10.331313556440051]"
1049,1049,2019-04-05 23:59:09+00:00,i celebrating years my honey disney world. it wonderful be florida though are starting do wave at fantasmic show. always az rockkstarr,"[10.902919579891307, 41.03543235806329, -13.643641017697732]"
1050,1050,2019-04-05 23:59:02+00:00,"drshayphd i probably only one shocked a class trip disney lol, in upstate ny got go to virginia beach once.","[33.259563960138614, 19.236239805713623, 12.28030347135308]"
1051,1051,2019-04-05 23:59:00+00:00,this be interesting cardsagainst disney beeroclock,"[0.141402743725078, 6.352197592370683, -12.517917338226923]"
1052,1052,2019-04-05 23:58:56+00:00,"disney just house falling cards, billion no all topples eventually","[17.615677199634437, 11.875073097412056, -11.992783575914075]"
1053,1053,2019-04-05 23:58:55+00:00,"on marvel related terms, costs male leads huge it interfering the cut production so of course now a chance right out captain marvel be good, super priced actors just the lower pages actresses, lol disney","[71.27206903581616, 53.675221984174684, 1.733382713069986]"
1054,1054,2019-04-05 23:58:55+00:00,"about gap met halfway boost salary not similar male job lol sjws always project, say inclusion doing the opposite, as disney doing","[64.06715844965312, 63.33500806841964, -8.446983118065717]"
1055,1055,2019-04-05 23:58:54+00:00,"disney t women side sjws, apparent pay gap disney seems","[18.211132711978426, 9.172305465378358, -10.520815441187693]"
1056,1056,2019-04-06 23:59:58+00:00,"namjoonsbabies i actually a short demo read the order the phoenix , could retweet if like it sounded? pottermore i a great speaking voice i still wanna sure disney","[47.038567340523905, 25.278653971512043, -9.965937204467494]"
1057,1057,2019-04-06 23:59:57+00:00,leaving disney world hours so. ‍️,"[5.695394650629557, 5.875227641499862, -10.483982497961776]"
1058,1058,2019-04-06 23:59:56+00:00,looks like disney already board my marvel landing idea,"[-1.1650658696155063, -1.5954680392270508, -11.799681829167305]"
1059,1059,2019-04-06 23:59:50+00:00,need go back disney world time soon,"[-2.8346049126113924, -5.56600787098904, -10.62699292019574]"
1060,1060,2019-04-06 23:59:46+00:00,yourmandaniel jrprahst cedarpoint you probably t go any e ticket attractions. it probably works like multiple experience pass disney world you t go flight passage slinky dog dash,"[33.23009589000673, 4.259635292856913, 0.9359559961375084]"
1061,1061,2019-04-06 23:59:36+00:00,sonicmega disney squareenix squareenixusa politicized.. those company stay away you? you anti jewish? i t understand comment.. wont the first still.. disney brought back pedo party guy.. i think re ok woods.. square t give shits..,"[29.264798990664435, 7.749814676923464, -7.538886786209858]"
1062,1062,2019-04-06 23:59:34+00:00,disney california adventure park,"[18.60758730231193, 8.774665468458554, -10.63432439476157]"
1063,1063,2019-04-06 23:59:26+00:00,thehill disney waltdisneyworld how you feel this?,"[8.69428691856961, 7.939312605661776, -11.307115884137659]"
1064,1064,2019-04-06 23:59:23+00:00,"queenofrabites did see guest spot the sprouse twins disney sitcom suite life deck? my nieces nephews watching one day i like, ""wait, that fabio?"" and course younger niece replied, ""who?""","[71.10589428217727, 49.27380604036614, -8.753389501607828]"
1065,1065,2019-04-06 23:59:22+00:00,i entered chance win a disney gift card walt disney world annual passes coca cola mix . contest,"[32.21668805075422, 28.72650781355351, -10.845059226985256]"
1066,1066,2019-04-06 23:59:17+00:00,"wdwtoday rundisney if cec entertainment teamed with disney again. i wanna see mickey m,ouse chuck e. cheese meet and know other disney world.","[7.197665424306796, 35.20171427147922, 2.112887130302923]"
1067,1067,2019-04-07 23:59:58+00:00,hands one the best disney movies,"[8.834516045768371, -4.934885582785057, -11.684903973764769]"
1068,1068,2019-04-07 23:59:55+00:00,check what i added my closet poshmark disney parks haunted mansion hitchhiking ghosts. via poshmarkapp shopmycloset,"[37.23840567516078, 25.98897160142291, -9.789913779963456]"
1069,1069,2019-04-07 23:59:54+00:00,we need gamer disney princess we need gamer disney princess we need gamer disney princess we need gamer disney princess we need gamer disney princess we need gamer disney princess we need gamer disney princess we need gamer disney princess,"[-1.4010952266110437, -11.59425381995878, -11.401485176811704]"
1070,1070,2019-04-07 23:59:27+00:00,nsync got disney concert the backstreet boys turned down? wooowww i no idea boybandcon,"[10.697315794854521, 19.883858453374728, 1.2955430899195761]"
1071,1071,2019-04-07 23:59:24+00:00,hamillhimself and disney charge . it,"[8.848220324974985, -0.6562336500291157, -11.737939291645638]"
1072,1072,2019-04-07 23:59:22+00:00,hercules the best disney movie period,"[13.196967300050819, 17.736187641672622, -11.832961164033136]"
1073,1073,2019-04-07 23:59:14+00:00,"aladdin, toy story , lion king within like months. what disney doing?? space em a little?","[40.042964174940415, 49.74150531265414, -9.297119794410648]"
1074,1074,2019-04-07 23:59:05+00:00,i need go disney world one time,"[-2.797343339630511, -4.016430853131418, -10.80008816273373]"
1075,1075,2019-04-07 23:58:57+00:00,"jakeclanderman fawfulfan more like talk, protest, disney raises wages, talk, protest, amazon raises wages","[54.44549093903638, 22.823094106026907, -11.6234677711861]"
1076,1076,2019-04-07 23:58:51+00:00,disney are still supporting lies fox?,"[20.50086870723501, -0.2457287208641934, -12.30069915804399]"
1077,1077,2019-04-07 23:58:48+00:00,"lol people comparing expensive pyramid scheme crap “lv, disney lexus” nope.","[17.789223320136344, 7.9906525416060035, -11.33369475083142]"
1078,1078,2019-04-08 23:59:59+00:00,idgi cant imagine growing with disney movies ive watched since was little watch until i die,"[8.743324072055504, 5.212908799991766, -10.477670235116605]"
1079,1079,2019-04-08 23:59:53+00:00,"collider hey colliderfrosty, feige renewed disney?","[8.736471861263686, 8.250568568227633, -10.814005112229665]"
1080,1080,2019-04-08 23:59:50+00:00,"avonshavon bts twt my mom ""well, babies really coming right us i guess should try see i wonder your cousins are ages would interested...?"" i tempted make the surrounding days work home days &amp; take laptop disney case go","[9.765765011770004, -0.21494811091785992, -8.427602749888436]"
1081,1081,2019-04-08 23:59:48+00:00,if uva wins tonight disney gonna make cheesiest movie all time their comeback story. and i’ll eat up.,"[18.068931904982012, 17.63963708039448, 1.9431546446778185]"
1082,1082,2019-04-08 23:59:46+00:00,"i never to disney land before. is true if mock people dressed as mickey mouse company, ll take back beat shit out of you?","[50.203229591667245, 52.419507234308085, 14.4965582762906]"
1083,1083,2019-04-08 23:59:44+00:00,can talk how traumatized i elevators being forced ride the tower of terror a child disney world,"[30.12544317015419, 20.422365924253356, -0.14824759375781582]"
1084,1084,2019-04-08 23:59:43+00:00,"jxckiv let’s go i’m done dying, still needa give your disney shit","[9.078832965718359, 7.291295514320751, -10.397752455699333]"
1085,1085,2019-04-08 23:59:37+00:00,"a fucking crime s figures seemingly, merch the primary antagonist kingdom hearts . s xemnas, disney. is boy.","[30.642608901539734, 29.162534235124014, -11.436277407236375]"
1086,1086,2019-04-08 23:59:36+00:00,the way get started to quit talking begin doing. walt disney quote,"[6.827159659701356, 27.137120203955035, -10.095459738100828]"
1087,1087,2019-04-08 23:59:33+00:00,reopening my disney experience app whenever crashes,"[20.309951952736693, 19.516802107064315, -11.088983228632316]"
1088,1088,2019-04-08 23:59:31+00:00,just might the right time sell that disney stock...really love add mack jersey my collection ️,"[16.939221132490278, 23.65054018631851, -10.800548841024295]"
1089,1089,2019-04-09 23:59:56+00:00,“my ex boyfriend sat down a serious conversation he told he a severe porn addiction i replied him saying i really like disney movies”,"[56.92288720218085, 44.9505560609947, -10.987667540780834]"
1090,1090,2019-04-09 23:59:56+00:00,"marykkeown just saying, don’t hope something outta disney movie the photos.","[11.5720691060767, 16.76759724399532, -11.521318466843937]"
1091,1091,2019-04-09 23:59:50+00:00,meltyartz dshicade yeah artist amazing i wish disney store would make supporting characters toys. rapunzel tangled adventure diverse comes it characters it would nice see of characters made real so to speak.,"[67.72840594452343, 75.57290207586736, -12.04108052029828]"
1092,1092,2019-04-09 23:59:49+00:00,socloverit i havent seen im while like funny see disney go that endgame lol,"[5.710917363388295, -6.0397525730411985, -11.433273067907521]"
1093,1093,2019-04-09 23:59:45+00:00,"damn. saw lgacy trending for brief moment, got hopes that tron sequel been given greenlight. apparently not. disney disney disneystudios","[49.14435388920463, 39.35071028775825, -9.976002991250866]"
1094,1094,2019-04-09 23:59:43+00:00,craboverlord finalpaige unless is the worker telling where disney all go bang,"[6.673256964121497, -4.694830742196274, -10.590462940992907]"
1095,1095,2019-04-09 23:59:36+00:00,disney shoulda shelved trash &amp; rebooted later,"[20.81882261671775, 28.10558782607822, -10.35411061691731]"
1096,1096,2019-04-09 23:59:29+00:00,if your planning on a disney family vacation this fall get your deposits in now per person deposit down,"[21.858845854445466, 1.8871849549953619, -9.383856852747101]"
1097,1097,2019-04-09 23:59:24+00:00,why i apply other theme parks knowing damn well disney my fave,"[28.900932834839143, 20.56705004950446, -11.848762999600112]"
1098,1098,2019-04-09 23:59:16+00:00,lost the world disney tsum tsum game,"[-3.6773413735092246, -1.8119628572017565, -11.780846423834674]"
1099,1099,2019-04-09 23:59:16+00:00,losing many followers my disney ig account also jonas brothers back that’s only thing can focus lmao,"[22.89041269035666, 12.85232954009976, -10.147275007141843]"
1100,1100,2019-04-10 23:59:59+00:00,"new post entradas anastasia boletos, ., dr. phillips center – walt disney theater, fl, orlando","[31.089243770276266, 29.62189852072963, -9.940394606165853]"
1101,1101,2019-04-10 23:59:53+00:00,"well, i at disney right... loud annoying foreigners screaming.","[21.575598166920177, 42.718644002547755, -12.196991535769243]"
1102,1102,2019-04-10 23:59:50+00:00,disney owns scene disneyfoxdeal,"[21.83558361811897, 20.656533144522975, -10.66626040281928]"
1103,1103,2019-04-10 23:59:49+00:00,davi m kkkkkk meeew disney,"[-1.6599864986173032, -1.4351986740867635, -11.502934656845408]"
1104,1104,2019-04-10 23:59:47+00:00,who’s ready a day magical place earth? disney gift card paypal cash the choice up you it takes seconds enter to…,"[51.87905083825252, 39.59288873399686, 1.0322482846273004]"
1105,1105,2019-04-10 23:59:45+00:00,in opinion “the lion king” the greatest film disney ever released. the new live action version looks absolutely incredible. the trailer alone gave chills. i can’t wait see thelionking,"[53.20789507627352, 57.53426351138408, 1.7033714681167709]"
1106,1106,2019-04-10 23:59:37+00:00,marykayfabe promise that i ever go missing question thedaltoncastle letting back disney world,"[14.455847437210625, 7.567079431691454, -12.026807274517836]"
1107,1107,2019-04-10 23:59:32+00:00,how classic disney characters stack against live action remakes? photos,"[8.35194021352584, 27.594243374199714, -10.573377729112863]"
1108,1108,2019-04-10 23:59:25+00:00,amazon disney doc mcstuffins doctor’s bag only . reg. .,"[18.91715073007835, 18.907266293559566, -11.242238506794294]"
1109,1109,2019-04-10 23:59:20+00:00,"lightscamerapod yeah no, something new disney, im so stupid easily entertained can make cgi/live adaptation expect to like it. money me","[14.566402853095074, 20.334991017539878, -0.04870287745961832]"
1110,1110,2019-04-10 23:59:15+00:00,mazzimonicaxxx disney world or disneyland,"[9.470603345514302, 9.16288877013222, -10.819245481253162]"
1111,1111,2019-04-11 23:59:59+00:00,"disney launching november th . month, . the year disneyplus","[-0.9490872942440121, 8.810556254560893, -11.64854701826171]"
1112,1112,2019-04-11 23:59:59+00:00,kwanzer hulu disney owns hulu don’t they?,"[24.463990135123243, 43.435446852308374, -11.262871760444995]"
1113,1113,2019-04-11 23:59:59+00:00,disney starwars disney on roll,"[20.06254541459224, 17.877128940181382, -10.360133994975563]"
1114,1114,2019-04-11 23:59:59+00:00,disney &gt;&gt;&gt;&gt;&gt;&gt;&gt;&gt;&gt; netflix,"[-0.8255470540100387, -2.004597527606038, -11.455943406313452]"
1115,1115,2019-04-11 23:59:59+00:00,i’m salty disney they never outlined launch canada throughout entire presentation. guess i’ll using vpn ‍️,"[17.661695810772766, 30.082955045878606, -10.102687222139437]"
1116,1116,2019-04-11 23:59:59+00:00,disney going be year. nice,"[-0.41447303832408555, -4.441961097614588, -12.341933024090352]"
1117,1117,2019-04-11 23:59:59+00:00,"if disney t a k hdr version swiss family robinson, i say riot.","[6.769130019359754, 6.119423964576015, -10.7088609430306]"
1118,1118,2019-04-11 23:59:59+00:00,disney marvel i would like see,"[-0.7378455693893848, -3.5097179971057, -11.335210181886378]"
1119,1119,2019-04-11 23:59:58+00:00,disney gonna end netflix tbh,"[8.800876439162447, -1.2921331942825565, -11.464393951188597]"
1120,1120,2019-04-11 23:59:58+00:00,definitely looking forward this disney,"[0.11067287413016369, -2.4896550949871075, -11.969339272078379]"
1121,1121,2019-04-11 23:59:58+00:00,lukeartoo incredible honestly. homer my favorite disney princess,"[13.83310590829598, 10.20102979340978, -1.5165774214026797]"
1122,1122,2019-04-12 23:59:57+00:00,autismatthepark disney,"[-0.8255470540100387, -2.004597527606038, -11.455943406313452]"
1123,1123,2019-04-12 23:59:53+00:00,"as in conciears &amp; friends run disney group continue recover amazing fun, yet hard work the star wars rivals half marathon weekend, is fun look back what personally accomplished, the amazing time...","[30.261594699404515, 63.434107929725954, -15.300363613962034]"
1124,1124,2019-04-12 23:59:51+00:00,hiddenmickeyjb happy i found on youtube. i started getting vlogging the past year and it great see disney vloggers keep the great work,"[-3.4259672668847356, -1.767429570365508, -14.45242732854281]"
1125,1125,2019-04-12 23:59:49+00:00,i want orville equivalent version show spoofing star wars it becomes popular disney decides sell star wars franchise someone else back satire show.,"[45.04682860436393, 79.55233414169521, 1.157942968701164]"
1126,1126,2019-04-12 23:59:42+00:00,". a live action spider man mcu series starring tom tomholland. sony owns movie rights spidey, disney owns tv rights, meaning can whatever want them tv. the last spidey cartoon t great, it would fresh have new live","[107.87044839592424, 99.07280353761332, 3.1152450656785646]"
1127,1127,2019-04-12 23:59:40+00:00,"cindymccain dismissive president trump suggestion a borderwall would help, saying . potus is living in disney land.","[40.102802570963995, 31.774621795788704, -10.72267285327878]"
1128,1128,2019-04-12 23:59:39+00:00,breaking episode ix will not be released in theaters. it will be instantly available on disney plus after the superbowl.,"[33.35695703456832, 25.50409928439504, -8.866859625553516]"
1129,1129,2019-04-12 23:59:37+00:00,know else forgot last night should on disney ? buzz lightyer star command. was good cartoon.,"[-4.837988786052459, 2.264336029628637, -12.137789546447706]"
1130,1130,2019-04-12 23:59:37+00:00,ryanverniere hamillhimself jjabrams disney i certainly hope so...,"[10.298784002305528, 6.944926837958704, -12.190002648591019]"
1131,1131,2019-04-12 23:59:33+00:00,stupid fucking disney recast childish gambino this old dude one ever heard idiots disneyiscancelled,"[14.871577125293872, 0.17185110268088932, -13.6534109303051]"
1132,1132,2019-04-12 23:59:29+00:00,disney so cute,"[1.019575192709749, -4.188272761610339, -12.937917924024777]"
1133,1133,2019-04-13 23:59:55+00:00,na disney kkkjk,"[8.751739333394472, -1.7918736180254986, -11.28424545588058]"
1134,1134,2019-04-13 23:59:55+00:00,"the points guy jetblue london plane, virgin atlantic swanky new suite, tickets a disney christmas more. via googlenews","[37.678455809763626, 23.23657805627444, -9.124046595877985]"
1135,1135,2019-04-13 23:59:54+00:00,"i’m officially local, i’m getting disney pass","[-3.684736437305406, -1.6778371633749036, -11.143230674978533]"
1136,1136,2019-04-13 23:59:50+00:00,new vs old donald duck drawing draw paint donaldduck thelooneytunesshow disney waltdisney followfollowback followme followforfollowback follow likelikes likeforlikes…,"[29.55069218397068, 27.574323207037878, 2.0865156766998467]"
1137,1137,2019-04-13 23:59:49+00:00,"sarah thyre wikipedia article edited anonymously [us] disney worldwide services, inc","[43.5287434530162, 42.36723691642685, -10.462565150589754]"
1138,1138,2019-04-13 23:59:46+00:00,cobra bubbles was part of shield change my mind. disney marvel marvel disney,"[8.568333569089308, 6.031659674999418, -11.307719487523045]"
1139,1139,2019-04-13 23:59:43+00:00,"sovanjedi me let go. oh hold up, disney land . haven been yet","[26.125637006918485, 17.285891095811053, -9.971968077405634]"
1140,1140,2019-04-13 23:59:43+00:00,"disney’s new starwars land galaxysedge a cool interactive app can use you’re and, get be resistance, first order scoundrel. who would you be?????","[29.448238248663774, 43.63625588195295, -9.21191085386208]"
1141,1141,2019-04-13 23:59:28+00:00,... why there low fi hip hop playing the speakers downtown disney,"[40.55588432990428, 31.359512047571954, -10.934217981393545]"
1142,1142,2019-04-13 23:59:24+00:00,josieleepuff george lucas films &gt; disney ruinseverythingtheybuy,"[32.61684280984942, 31.437792336253423, -10.271418901072195]"
1143,1143,2019-04-13 23:59:19+00:00,"""the walt disney company spotlights comprehensive direct consumer strategy investor day"" via from disney post","[24.09900415261971, -6.912861412656298, -10.045497033428063]"
1144,1144,2019-04-14 23:59:57+00:00,mtlsaiyan disney needs stop making live action remakes,"[5.170743873656559, -3.7033057531562155, -10.818986921246129]"
1145,1145,2019-04-14 23:59:52+00:00,no better way start our disney trip. savana rosson breaks ghs career strikeout record. indians,"[43.33532670225819, 11.514047230980367, -0.3025055764131963]"
1146,1146,2019-04-14 23:59:48+00:00,aaron his family going disney fall i j e a l o u s. how i secure invite??,"[9.377663497110976, 40.3038333883738, -1.3277296910437713]"
1147,1147,2019-04-14 23:59:46+00:00,cant wait the new season clonewars star wars content people care instead disney shills gaaaaah i need it now,"[6.34531981431346, 29.671126532432993, -11.098234199465466]"
1148,1148,2019-04-14 23:59:45+00:00,okay disney too much is actually terrifying,"[-0.6621632760136607, -2.1813320235362856, -11.792890467586297]"
1149,1149,2019-04-14 23:59:45+00:00,disney game appreciation post,"[17.87188050733319, -2.9995802379158296, -10.95523475420326]"
1150,1150,2019-04-14 23:59:36+00:00,i mechazawa advancedsuit gargoyles a third season. it basically losing rating disney gave a mercy killing.,"[28.16767643559405, 20.085311331022645, -11.59285192060176]"
1151,1151,2019-04-14 23:59:33+00:00,"went thru old stuff in laws storing me. found old drawings, circa gargoyles liloandstitch disney","[3.3503000782266428, -4.595737775061139, -10.082698246340769]"
1152,1152,2019-04-14 23:59:33+00:00,roppotucha disney robin hood oo de la lee,"[32.50923554701116, 49.01332955141494, -10.081747450208198]"
1153,1153,2019-04-14 23:59:31+00:00,"starwars i think stinks disney going charge us see these new shows. why just put disney channel? my cable bill already outrageous. it not like disney, greediest company on earth, needs money. sorry say, i won t be watching.","[61.17038741951472, 39.79128270114917, -10.626675702937902]"
1154,1154,2019-04-14 23:59:31+00:00,star wars fans get st look the mandalorian series coming disney via abcchicago,"[19.239133552388072, 9.879208246994352, -11.092547769696793]"
1155,1155,2019-04-15 23:59:59+00:00,animiaofficial it a sign. run back to disney,"[8.471422664648369, 7.644432201191115, -10.322972168189644]"
