,Unnamed: 0,Time,Text,Sentiment
3032,3032,2019-10-02 23:59:10+00:00,"in great debate ipadpro v surfacepro professionals rely microsoft office suite multi tasking, surface wins a country mile. from apple fan, credit it’s due don’t regret switching surface uk surfacepro windows","[64.63693294041799, 52.54481208752186, 9.908956166304804]"
3033,3033,2019-10-02 23:58:58+00:00,"ima real, i’m excited microsoft’s new form factor lineup next year. i might buy of them, that nintendo ds style phone exactly i’ve waiting since smartphones took off. it looks like great concept. i hope takes off.","[47.22431101176351, 53.38216865309427, -11.473222109077355]"
3034,3034,2019-10-02 23:58:53+00:00,"we knew trash s we ever needed know, sony was their well microsoft did a poor job microsoft decided start gamepass ps wasn relevant enough compete, should seen coming sony to beg azure","[24.780326862285097, 65.62862237720385, 13.433311519389505]"
3035,3035,2019-10-02 23:58:51+00:00,did see the new microsoft devices announced? here a great rundown mkbhd microsoft surface family impressions,"[41.685132085973265, 36.29940943984031, -10.080360637537225]"
3036,3036,2019-10-03 23:59:58+00:00,"top story microsoft shows surface duo, android phone, two screen neo pc , see","[37.41664793971621, 14.728137653368663, -9.734720823201641]"
3037,3037,2020-11-25 17:06:25+00:00,learn the new cloud like way manage premise databases this depth article rds on vmware cloud solution architect blogger satyashr,"[63.96525067459205, 83.39114379494283, 3.5377354685069946]"
3038,3038,2019-10-03 23:59:57+00:00,"natwest bank uses artificialintelligence predict future. working microsoft &amp; dreamquark simulate future behavior mortgages &amp; sme loans, natwest be able better identify potential risks/opportunities fintech ai industry","[66.64919638490623, 72.93886966573238, -10.199091513733606]"
3039,3039,2019-10-03 23:59:22+00:00,"top story the key a data driven culture timely insights | blog | microsoft azure , see","[40.0399012719536, 51.55239664245873, -9.801215301343063]"
3040,3040,2019-10-03 23:59:19+00:00,yesterday microsoft announced surface duo mi drop offa mi chair work,"[64.31608385590654, 56.05479377641076, 14.4335305245407]"
3041,3041,2019-10-03 23:59:10+00:00,microsoft unveils new smartphone surface duo technology,"[32.55337323590076, 21.38115162505841, 1.4032832508302135]"
3042,3042,2019-10-03 23:58:51+00:00,djmnts iamwill microsoft soft years you rep with microsoft xbox gamertag... genius,"[30.126562874169775, 47.061046030986, -9.791169305768662]"
3043,3043,2019-10-03 23:58:42+00:00,drop ur favorite video games all time. videogame xbox gamecube nintendo microsoft,"[42.23377045070494, 36.56664076444595, -10.30564990758829]"
3044,3044,2019-10-03 23:58:35+00:00,"day , using microsoft teams communicate students provide links the websites use often sf edtechguy thejaydubs educwhiting","[60.682654636901546, 69.98885736153268, -8.380599971134615]"
3045,3045,2019-10-03 23:58:16+00:00,"novartis, microsoft partner use artificial intelligence drug research","[21.355294112348805, 30.386824206806402, 0.5882713944374416]"
3046,3046,2019-10-03 23:57:32+00:00,gokustomps microsoft yeah go the ghost reacon trailer they’re holding ps controllers,"[37.5987289759027, 35.6870478438589, -9.269063616604825]"
3047,3047,2019-10-04 23:59:37+00:00,"microsoft ""the accounts one the us election headquarters, us government officials, american media employees, prominent iranians living other countries been subjected the cyber attack involving hackers subordinate iranian authorities.""","[103.59775256726557, 88.36752190510518, 3.624101431741579]"
3048,3048,2020-11-23 15:22:11+00:00,"do self manage databases premises today? read vexpert blog azizaqeelvm understand rds vmware help set up, operate, scale databases improve productivity lower costs.","[102.37215857537821, 64.7854888084819, 2.9593255706540305]"
3049,3049,2019-10-04 23:59:35+00:00,"all "" microsoft surface laptops models intel processors? i really getting amd flavoured surface laptop, i don like "" form factor rip","[63.25719021884861, 36.52934467080671, -12.113391731537902]"
3050,3050,2019-10-04 23:59:31+00:00,puzzled the many pieces microsoft outlook? curious new hidden features? let create customized training plan your team dawn thesoftwarepro.com certifiedoutlookexpert outlooktips,"[70.83073173225556, 57.32630863996326, -9.221064131064736]"
3051,3051,2019-10-04 23:59:25+00:00,microsoft iran linked hacking group tried compromise us presidential candidate. breakingnewsnow breaking news breakingnews breakingnewz breakingnow breaking uspresidentialcandidate uspresidentialcandidate compromised compromise compromised compromise,"[49.85026669944015, 43.441795663615224, -9.734976274251409]"
3052,3052,2019-10-04 23:59:23+00:00,microsoft iran linked hacking group tried compromise us presidential candidate. breakingnewsnow breaking news breakingnews breakingnewz breakingnow breaking uspresidentialcandidate uspresidentialcandidate compromised compromise compromised,"[49.85026669944015, 43.441795663615224, -9.734976274251409]"
3053,3053,2019-10-04 23:59:21+00:00,microsoft iran linked hacking group tried compromise us presidential candidate. breakingnewsnow breaking news breakingnews breakingnewz breakingnow breaking iranhackinggroup hacking hackers hacker hacked hack hackinggroup iranian iranians compromise,"[82.27100531576762, 56.84572725184299, 2.01828747776716]"
3054,3054,2019-10-04 23:59:20+00:00,microsoft iran linked hacking group tried compromise us presidential candidate. breakingnewsnow breaking news breakingnews breakingnewz breakingnow breaking uspresidentialcandidate uspresidentialcandidate presidentialcandidate msft microsoft iran,"[60.12070026740461, 53.712229231579684, -9.340134772504328]"
3055,3055,2019-10-04 23:59:18+00:00,microsoft iran linked hacking group tried compromise us presidential candidate. breakingnewsnow breaking news breakingnews breakingnewz breakingnow breaking uspresidentialcandidate uspresidentialcandidate presidentialcandidate presidentialcandidate ms,"[59.53291360250248, 43.75988008885359, -9.591449200785235]"
3056,3056,2019-10-04 23:59:16+00:00,microsoft iran linked hacking group tried compromise us presidential candidate. breakingnewsnow breaking news breakingnews breakingnewz breakingnow breaking uspresidentialcandidate uspresidentialcandidate presidentialcandidate presidentialcandidate,"[49.85026669944015, 43.441795663615224, -9.734976274251409]"
3057,3057,2019-10-04 23:59:03+00:00,attachment extensions carrying malware banned on microsoft outlook,"[42.22943601108608, 32.14844658161422, 1.860345543926556]"
3058,3058,2019-10-05 23:59:28+00:00,"upgrading new program? planning meeting conference? hire a microsoft certified trainer bring valuable software tips &amp; techniques your next meeting, onsite training workshop webinar. message here at dawn thesoftwarepro.com productivity mct","[87.52499259218796, 89.48854402730265, 4.701932373601593]"
3059,3059,2020-11-23 15:22:11+00:00,"do self manage databases premises today? read vexpert blog azizaqeelvm understand rds vmware help set up, operate, scale databases improve productivity lower costs.","[102.37215857537821, 64.7854888084819, 2.9593255706540305]"
3060,3060,2019-10-05 23:59:11+00:00,"i becoming quite proficient a self taught way e.g. google analytics, skype, viber,some microsoft stuff,but kept changing things &amp; i couldn keep with it. uninstall,reinstall,download new &amp; that,re set passwords,this ap needs ap technologynews","[57.930640365796314, 64.8129732822644, -7.796958303740624]"
3061,3061,2019-10-05 23:58:45+00:00,"in multi part ""tutorial"", build single server sharepoint server farm inside subnet microsoft azure virtual network. the purpose this server be development testing as a basis demonstrating s... ke","[112.1944652340028, 52.193788957820686, 3.614768452096584]"
3062,3062,2019-10-05 23:58:44+00:00,"in multi part ""tutorial"", build single server sharepoint server farm inside subnet microsoft azure virtual network. the purpose this server be development testing as a basis demonstrating s... ke","[112.1944652340028, 52.193788957820686, 3.614768452096584]"
3063,3063,2019-10-05 23:58:44+00:00,"in multi part ""tutorial"", build single server sharepoint server farm inside subnet microsoft azure virtual network. the purpose this server be development testing as a basis demonstrating s... ke","[112.1944652340028, 52.193788957820686, 3.614768452096584]"
3064,3064,2019-10-05 23:57:30+00:00,"python beginners, demo using numbers python, video microsoft developers youtube page. microsoftdeveloper pythonforbeginners learntocode postdays python","[71.72156728916816, 72.77482926692169, -7.956861028997352]"
3065,3065,2019-10-05 23:57:25+00:00,microsoft xbox one white xbox one s controller w/ mm headphone jack ebay ends h last price usd .,"[59.06007348184115, 60.39465708503815, -9.970163491483063]"
3066,3066,2019-10-05 23:57:14+00:00,"microsoft onedrive personal vault rolls worldwide, launches expandable storage","[32.879207074316916, 42.85647854777294, -10.596841301506828]"
3067,3067,2019-10-05 23:56:59+00:00,just earned intro microsoft teams the microsoft educator center preview you check free pd courses too. microsoft microsoft microsoftng via microsoftedu,"[91.146154532317, 108.90018977537306, -6.940726081898745]"
3068,3068,2019-10-05 23:56:33+00:00,"microsoft unveils airpods rival, surface earbuds","[9.106605697739854, 9.008623575805315, -11.088218626188134]"
3069,3069,2019-10-06 23:59:48+00:00,artbaesel is microsoft pod? lol,"[8.537031138743544, 7.461324591957528, -10.802855235044426]"
3070,3070,2020-11-25 17:06:25+00:00,learn the new cloud like way manage premise databases this depth article rds on vmware cloud solution architect blogger satyashr,"[63.96525067459205, 83.39114379494283, 3.5377354685069946]"
3071,3071,2019-10-06 23:59:46+00:00,microsoft chief brad smith says rise killer robots unstoppable do you know him? via telegraphtech,"[73.69615668260614, 84.03500462441365, 4.117456858420013]"
3072,3072,2019-10-06 23:59:32+00:00,puzzled the many pieces microsoft powerpoint? curious new features? let create customized training plan your team deliver better presentations dawn thesoftwarepro.com,"[83.08486674674815, 67.19104248314422, -9.168588297924614]"
3073,3073,2019-10-06 23:59:25+00:00,warnings issued for millions of microsoft windows users,"[29.781589444128908, 28.87384247742777, -9.763813478987181]"
3074,3074,2019-10-06 23:59:21+00:00,"commodoreblog stay strong, despise stinking microsoft.","[-2.5978884373809903, -2.6783266223088806, -11.1698966572024]"
3075,3075,2019-10-06 23:58:52+00:00,dret microsoft microsoftteams i impressed you surprised,"[10.043494830724246, 9.282900340803046, -1.5416080848025082]"
3076,3076,2019-10-06 23:58:33+00:00,microsoft massive risks and radical rewards behind new surface duo,"[19.03256038889472, 11.045562045343509, -0.1987041880584286]"
3077,3077,2019-10-06 23:58:18+00:00,alex pedroza doesn’t know to use microsoft when i asked what writes school papers she said pages,"[35.36038870068533, 38.21335845743663, -8.377862886009012]"
3078,3078,2019-10-06 23:58:03+00:00,"join people right at ""new microsoft patent shows a floor mat your virtual reality experiences | techradar"" cheers technology tech mobile experiences techradar microsoft reality virtual patent floor shows news","[127.77873276324881, 105.9815223559816, -8.811570348730001]"
3079,3079,2019-10-06 23:57:56+00:00,microsoft embrace google android software bigger its new phone via cnet,"[48.38565218031627, 28.320385230600863, -9.162122491372344]"
3080,3080,2019-10-07 23:59:59+00:00,we excited launch azure illuminate new program allows establish meaningful presence your sql server environment microsoft azure without needing to perform full cloud migration. learn migration azure,"[109.65978169342446, 116.40187766276277, 3.683756815249538]"
3081,3081,2020-11-23 15:22:11+00:00,"do self manage databases premises today? read vexpert blog azizaqeelvm understand rds vmware help set up, operate, scale databases improve productivity lower costs.","[102.37215857537821, 64.7854888084819, 2.9593255706540305]"
3082,3082,2019-10-07 23:59:39+00:00,bobevansit jiri kram salesforce oracle amazon microsoft work the best deal the party cutting oxygen wants fill your market niche?not much. benioff,"[63.54167485308866, 40.76574455846094, -10.925826683870042]"
3083,3083,2019-10-07 23:59:29+00:00,planning meeting conference? add valuable software skills education your next meeting a microsoft certified trainer add training is immediately useful your attendees. message here at dawn thesoftwarepro.com conferencespeaker techspeaker,"[87.26120956899555, 108.82817195035743, -6.628537447966508]"
3084,3084,2019-10-07 23:59:08+00:00,"microsoft, amazon, samsung sony take apple airpods quartz airpods apples apple tech","[20.87500737032131, 17.214411008950485, 0.7228699701142745]"
3085,3085,2019-10-07 23:59:00+00:00,"enterprise ethereum alliance’s reward token system backed microsoft, intel thomaspower stevewal jonnyfry ursbolt","[32.409203445071185, 33.02191244070323, -10.59684130150682]"
3086,3086,2019-10-07 23:58:52+00:00,"join insightent microsoft santa clara the iotinactionms event /, learn you build deploy iot solutions. insightsocial insightpartners","[62.38746739501848, 49.40606442414235, -8.856704418809187]"
3087,3087,2019-10-07 23:58:51+00:00,just earned points the microsoft educator center preview you check free pd courses too. via microsoftedu,"[38.225578072807245, 66.05486691125387, -8.674242768714379]"
3088,3088,2019-10-07 23:57:43+00:00,microsoft microsoft errors and i thought windows buggy. oops. that product description in beta.,"[42.082272328643356, 53.95824546033846, 14.225621483439284]"
3089,3089,2019-10-07 23:57:36+00:00,"enterprise ethereum alliances reward token system backed microsoft, intel","[32.409203445071185, 33.02191244070323, -10.59684130150682]"
3090,3090,2019-10-07 23:57:13+00:00,coindesk ianallison intel microsoft use cardano. it better.,"[9.0912218344221, 16.64302356111371, -11.281350835611775]"
3091,3091,2019-10-08 23:59:50+00:00,"i dont understand ps reveal hype. we had very clear idea what microsoft sony planning awhile now. now nintendo came with new hardware specs, i would very much intrigued.","[52.98769421158877, 68.45486462886073, 1.3102059266346515]"
3092,3092,2020-11-25 17:06:25+00:00,learn the new cloud like way manage premise databases this depth article rds on vmware cloud solution architect blogger satyashr,"[63.96525067459205, 83.39114379494283, 3.5377354685069946]"
3093,3093,2019-10-08 23:59:33+00:00,republican senators call huawei ‘real urgent’ threat new letter microsoft exec seattle,"[17.926629864822285, 27.78038418211497, -10.064127121868943]"
3094,3094,2019-10-08 23:59:33+00:00,"john kavanagh it good take. whenever response ""but was a manager microsoft"" know you a point mid level managers microsoft t the ""billionaire"" pay bracket.","[51.95572555582465, 58.121522015425896, -10.87379348716938]"
3095,3095,2019-10-08 23:59:31+00:00,"metaverse &gt; vr virtualreality &gt; rvr &gt; microsoft files ‘virtual reality floor mat’ patent, possibly aimed an xbox vr headset &gt; ... a microsoft patent application ‘virtual reality floor mat’ describes special mat defines a virtual pla…","[129.75560923052925, 103.75517984953379, -8.34765239774758]"
3096,3096,2019-10-08 23:59:00+00:00,vgfgamers no .never buy console year one unless necessary and . wait see microsoft’s console depending your tastes budge power upcoming exclusives,"[38.066518769877284, 29.465582710449965, -10.054876114841306]"
3097,3097,2019-10-08 23:58:49+00:00,you know deal october . pwned a spreadsheet. patch microsoft stuff • the register infosec advisory,"[40.21112584624382, 20.572249909505885, -10.361026486423526]"
3098,3098,2019-10-08 23:58:49+00:00,"so, microsoft embracing open source, apple filling trash heaps earphones literally cannot serviced. things changed mightily since i started the it game.","[69.79227267061215, 65.01839878819746, 13.89531357334262]"
3099,3099,2019-10-08 23:58:45+00:00,"vr virtualreality microsoft files ‘virtual reality floor mat’ patent, possibly aimed an xbox vr headset","[49.97647036001137, 28.27466131268892, -10.255697219067969]"
3100,3100,2019-10-08 23:58:43+00:00,"atom keemstar that’s horribly wrong it’s really mind blowing... microsoft been putting and money xbox years move forward. also the next halo million dollars sunk it, let sink","[33.87470301404178, 39.68994574646001, -10.00995775345892]"
3101,3101,2019-10-08 23:58:22+00:00,"it’s exciting connect microsoft innovative educator experts arizona sylvia quigley, heba muellar &amp; jeff proctor tucsonunified mieexpert iamncce ncce edtech sinmuellertech","[33.971259692907864, 32.17376438959852, -11.668336868553162]"
3102,3102,2019-10-09 23:59:55+00:00,"mike ybarra, corporate vice president microsoft gaming division across xbox pc, announced departure the company almost years, according eurogamer. gaming","[95.75504625605208, 106.1624443866824, 4.102158104295384]"
3103,3103,2020-11-25 17:06:25+00:00,learn the new cloud like way manage premise databases this depth article rds on vmware cloud solution architect blogger satyashr,"[63.96525067459205, 83.39114379494283, 3.5377354685069946]"
3104,3104,2019-10-09 23:59:45+00:00,resume katherine held proficient microsoft excel word communicative team oriented . uber rating,"[43.34991815921241, 42.94345793464696, 1.23941362936975]"
3105,3105,2019-10-09 23:59:43+00:00,microsoft your fucking os shouldn t function like malware you piece of shit,"[40.25764226977352, 29.6805266369053, -10.06547118213686]"
3106,3106,2019-10-09 23:59:42+00:00,guys setlist aint fake looks like of shitty ass setlists written microsoft word sth look heres old ones vs todays,"[48.159126180597276, 60.93829773823916, -9.76915098386668]"
3107,3107,2019-10-09 23:59:27+00:00,computer keeps crashing i sorry i test later see i or cannot figure out. very frustrating. bungie microsoft need figure broccoli is a driver issue.,"[52.71723649935961, 21.825200567029086, -0.38434064438779103]"
3108,3108,2019-10-09 23:59:25+00:00,microsoft unboxed sounds microsoft ep.,"[32.63307400477801, 28.791435704156555, -11.002306409614988]"
3109,3109,2019-10-09 23:59:24+00:00,"upgrading new program? planning meeting conference? hire a microsoft certified trainer bring valuable software tips &amp; techniques your next meeting, onsite training workshop webinar. message here at dawn thesoftwarepro.com productivity mct","[87.52499259218796, 89.48854402730265, 4.701932373601593]"
3110,3110,2019-10-09 23:59:15+00:00,getting started microsoft lync server ==&gt; python javascript angular reactjs vuejs perl ruby csharp java linux programming network security golang coding ionic android ios datascience development artificialintelligence,"[118.19733330684899, 80.66654112780378, -8.952700962842712]"
3111,3111,2019-10-09 23:58:59+00:00,azure sphere . release adds new use cases enterprise customers microsoft azure,"[62.31198119000342, 61.25936836900895, -8.803114663446692]"
3112,3112,2019-10-09 23:58:48+00:00,"swhat shesaid kardonice sh mck williampietri evan greer fightfortheftr github microsoft yeah, see you use it.","[20.251483730940134, 18.38209743502459, 1.23911220310832]"
3113,3113,2019-10-10 23:59:51+00:00,"bqofnh scoutstandup i my pc screenshot using [print scr], paste crop microsoft paint.","[52.12891524560621, 34.33383493375636, 2.0543889662708636]"
3114,3114,2020-11-25 17:06:25+00:00,learn the new cloud like way manage premise databases this depth article rds on vmware cloud solution architect blogger satyashr,"[63.96525067459205, 83.39114379494283, 3.5377354685069946]"
3115,3115,2019-10-10 23:59:48+00:00,gearboxofficial microsoft letting yall know borderlands crashes has either restarting console shutting completely xbox one x figured id let yall know my friends also come across issue. doesnt happen other games.,"[85.81890263781573, 87.14816380206658, -8.038916222374993]"
3116,3116,2019-10-10 23:59:37+00:00,puzzled the many pieces microsoft outlook? curious new hidden features? let create customized training plan your team dawn thesoftwarepro.com certifiedoutlookexpert outlooktips,"[70.83073173225556, 57.32630863996326, -9.221064131064736]"
3117,3117,2019-10-10 23:59:37+00:00,apple starts selling microsoft product because it needs to via bgdftw,"[34.99744419565932, 15.169385880652314, -9.641243121409516]"
3118,3118,2019-10-10 23:59:22+00:00,"would been way fucking better proposal implimentation chrome only. was actual beautiful, easy use, durable polymorphic. then it became microsoft product.","[55.14040938187497, 62.45847203038586, 2.271590422648387]"
3119,3119,2019-10-10 23:58:56+00:00,"xbox slim gb internal hd oem microsoft hard drive, new case been discounted estore","[59.56457136793163, 41.51721716175323, -10.83944823581865]"
3120,3120,2019-10-10 23:58:35+00:00,"shisnoelite rustolla colteastwood ruffian would best choice, they’ve doing lot support work microsoft several games. they founded ex realtime worlds members, a great job crackdown considering the extremely short development time they were given","[74.82062431079329, 40.318212999365514, -12.67467434689722]"
3121,3121,2019-10-10 23:58:26+00:00,"talend cloud now available microsoft azure collect, transform, cleanse move data virtually data source azure a single suite cloud apps dataintegration dataintegrity.","[84.61648593277819, 94.48726361089821, -7.983670622770518]"
3122,3122,2019-10-10 23:58:22+00:00,live blog pytorch ptdc pytorch research pytorch production tesla microsoft caltech stanford nlp,"[41.895238514499454, 21.023777769250437, 1.8206943601608643]"
3123,3123,2019-10-10 23:57:35+00:00,"california week, massachusetts next week taking microsoft powerbi coast coast join us next wednesday","[45.56541930577603, 24.659536848320116, -8.877872798234506]"
3124,3124,2019-10-11 23:59:30+00:00,puzzled the many pieces microsoft powerpoint? curious new features? let create customized training plan your team deliver better presentations dawn thesoftwarepro.com,"[83.08486674674815, 67.19104248314422, -9.168588297924614]"
3125,3125,2020-11-25 17:06:25+00:00,learn the new cloud like way manage premise databases this depth article rds on vmware cloud solution architect blogger satyashr,"[63.96525067459205, 83.39114379494283, 3.5377354685069946]"
3126,3126,2019-10-11 23:59:10+00:00,"from davrospendragon regarding ageofempires remake xbox/microsoft an accessibility cert has be met game be released the importance moving forward “fail progression” you’re developing, an accessibility ui screen prompt","[38.47238042788563, 17.921418497607306, -10.300782767525916]"
3127,3127,2019-10-11 23:59:03+00:00,random friday thoughts there office microsoft uses microsoft office write send an email an office microsoft microsoft office.,"[65.41009652998528, 55.08742792535138, -7.939254618795431]"
3128,3128,2019-10-11 23:58:59+00:00,"browofjustice havochaos wintermute wait, know microsoft account password? in case, should able either disconnect account his microsoft account make new local administrator user","[60.120395085515135, 44.76754903975218, -7.348070194415001]"
3129,3129,2019-10-11 23:58:59+00:00,i achievements microsoft treasure hunt win points trueachievements,"[19.932380598960822, 28.393641506902938, -10.660692412488658]"
3130,3130,2019-10-11 23:58:58+00:00,i the go the silver achievement microsoft solitaire collection uwp points trueachievements,"[20.813116555389566, 42.25524423841979, 1.7484754933378284]"
3131,3131,2019-10-11 23:58:58+00:00,i achievements microsoft treasure hunt win points trueachievements,"[19.932380598960822, 28.393641506902938, -10.660692412488658]"
3132,3132,2019-10-11 23:58:56+00:00,i achievements microsoft treasure hunt win points trueachievements,"[19.932380598960822, 28.393641506902938, -10.660692412488658]"
3133,3133,2019-10-11 23:58:09+00:00,"october , sunday pm est tyson’s corner center microsoft store apex legends lan tournament prizing worth least","[61.433326680972584, 47.2185615886519, -9.564744478524887]"
3134,3134,2019-10-11 23:57:14+00:00,"reneritchie apple microsoft equal market cap today, .t crazy money","[30.78468482747655, 21.574637532538596, -10.992767171826415]"
3135,3135,2019-10-12 23:59:54+00:00,"if i buy game the microsoft store, feel like i be able play on xbox. sometimes i want be lazy play minecraft my couch...","[11.074711739399579, 18.301270397338186, -9.699238098164173]"
3136,3136,2020-11-25 17:06:25+00:00,learn the new cloud like way manage premise databases this depth article rds on vmware cloud solution architect blogger satyashr,"[63.96525067459205, 83.39114379494283, 3.5377354685069946]"
3137,3137,2019-10-12 23:59:54+00:00,. monoscopic microsoft loops &amp;,"[9.238606768692215, 9.472661913666764, -11.281980449249723]"
3138,3138,2019-10-12 23:59:32+00:00,"topherjaims i see point, the problem no one talks with consoles getting networked esports matches staying cipa compliant. microsoft sony make really difficult.","[40.32111134961894, 53.16233155632439, 11.820428120714624]"
3139,3139,2019-10-12 23:59:28+00:00,don forget buy microsoft ...,"[16.810880135781787, 9.580492347280043, -10.76179933075803]"
3140,3140,2019-10-12 23:59:26+00:00,"upgrading office ? planning meeting conference? bring technology speaker &amp; microsoft certified trainer your next meeting, onsite training workshop, webinar add valuable software skills. message here at dawn thesoftwarepro.com","[99.73567276272047, 112.82864333251787, -5.634000322072254]"
3141,3141,2019-10-12 23:58:57+00:00,i achievements microsoft treasure hunt win points trueachievements,"[19.932380598960822, 28.393641506902938, -10.660692412488658]"
