,Unnamed: 0,Time,Text,Sentiment
1985,1985,2019-06-29 23:58:48+00:00,fascinating. change cellular service companies the style telemarketers changes well. from caribbean cruises microsoft license expirations.,"[53.21435497448929, 61.885277900881036, 2.4577510807672667]"
1986,1986,2019-06-29 23:58:37+00:00,another patent teases kind foldable device coming microsoft,"[19.945377598666443, 19.70139634276039, -10.4641723834822]"
1987,1987,2019-06-29 23:58:15+00:00,microsoft excel » insert current date time quickly without looking yo…,"[19.660694428811357, 20.30056178738632, -11.296434327494815]"
1988,1988,2019-06-29 23:58:11+00:00,brlivesupport aewrestling nothing worked. but works microsoft edge browser i hate,"[36.42804321876299, 33.60308897841707, -12.406144015763019]"
1989,1989,2019-06-29 23:57:30+00:00,joe [amazon prime] microsoft surface headphones . delivered amazon us via amazon au,"[62.344394974014776, 22.32207473765053, -10.85251563586985]"
1990,1990,2019-06-29 23:57:21+00:00,"microsoft planner export entire plan excel powerful analysis, sharing, more office microsoftplanner","[39.73380879665553, 29.950271505664467, -10.043124985247132]"
1991,1991,2019-06-30 23:59:38+00:00,join in week “hls show me how” webcast – driving adoption microsoft integrated services,"[21.11480699529685, 30.34888971805875, 1.6918857926385584]"
1992,1992,2020-11-25 17:06:25+00:00,learn the new cloud like way manage premise databases this depth article rds on vmware cloud solution architect blogger satyashr,"[63.96525067459205, 83.39114379494283, 3.5377354685069946]"
1993,1993,2019-06-30 23:59:34+00:00,how anyone trust microsoft windows? i . i t want change,"[23.61931703926064, 6.35779070811941, -10.138546833176832]"
1994,1994,2019-06-30 23:59:27+00:00,puzzled the many pieces microsoft excel? curious new hidden features? let create customized training plan your team dawn thesoftwarepro.com certifiedexcelexpert exceltips,"[70.83073173225556, 57.32630863996326, -9.221064131064736]"
1995,1995,2019-06-30 23:59:07+00:00,let’s go live now some zelda botw giveaway pm est microsoft gc stop for a chance win mixercommun unitemixer mixerretweet teammixersquad watchmixer xchannelzerox mixer streamer,"[50.43797813582794, 39.77852936126206, 2.8405383303541782]"
1996,1996,2019-06-30 23:58:59+00:00,our latest azure training features videos quizzes will help master microsoft. itpro azure cbtntrainer,"[19.661834079962023, 47.287568334876, -10.337488559802452]"
1997,1997,2019-06-30 23:58:44+00:00,need borrow someone laptop have microsoft word,"[16.744386424103798, 27.390372647072873, -10.065346375822358]"
1998,1998,2019-06-30 23:58:43+00:00,automating selective guest access microsoft teams microsoftteams ⁦ microsoftteams⁩,"[52.67484790075267, 43.21230330099415, -9.675906703862957]"
1999,1999,2019-06-30 23:58:12+00:00,second installment microsoft’s simsmsimsm,"[-1.0014377204737024, -1.4873410135097562, -11.477683392949858]"
2000,2000,2019-06-30 23:58:09+00:00,"are kidding microsoft king games... freaking candycrushsaga using nearly gb my hd, i t get rid the remaining files, despite trying delete as nt\system, after performing ""uninstall"", via windowsstore powershell","[94.93445246474465, 57.75131269196321, -9.066776755417678]"
2001,2001,2019-06-30 23:58:06+00:00,microsoft provides guidance configuring optimizing euc / vdi / win virtualization recommended settings vdi desktops optimizing windows vdi,"[58.09241401363484, 39.32101409726839, -9.364701553095458]"
2002,2002,2019-07-01 23:59:44+00:00,"suracitsem you not wrong any stretch, i appreciate it a business it feels like microsoft aggressively risk adverse it comes content.","[17.832833241496747, 29.816601478818185, -1.3924021072296995]"
2003,2003,2020-11-23 15:22:11+00:00,"do self manage databases premises today? read vexpert blog azizaqeelvm understand rds vmware help set up, operate, scale databases improve productivity lower costs.","[102.37215857537821, 64.7854888084819, 2.9593255706540305]"
2004,2004,2019-07-01 23:59:43+00:00,rt rhythmtrader d last time bitcoin btc rose k fidelity t storing it. congress t fighting it. starbucks t accepting it. bakkt t launching it. microsoft t building it. td ameritrade t trading it. fb t competing w/ it.,"[124.7560598303733, 22.771335126354487, -7.74218115533229]"
2005,2005,2019-07-01 23:59:37+00:00,another software upgrade? switching microsoft office ? does team need be productive office office ? stop wasting time get to speed what need message here at dawn thesoftwarepro.com mct officeexpert,"[41.890428502211556, 48.25096875165518, -8.674834651522374]"
2006,2006,2019-07-01 23:59:36+00:00,nickbaratto brandonhandwerk akuefler kraftzacncheese wild since fenton took has basically a microsoft release party.,"[32.26318526576103, 28.210678869683342, -9.65681415048013]"
2007,2007,2019-07-01 23:59:17+00:00,blaqueword challenged me. broke ass trying lol i miss microsoft word public wifi,"[35.3995832862141, 41.51419822989388, -11.136001078955331]"
2008,2008,2019-07-01 23:59:05+00:00,microsoft issues warning for m windows users,"[29.01688333753633, 20.464265140556243, -11.834306255316633]"
2009,2009,2019-07-01 23:58:15+00:00,microsoft intune integration apple volume purchase program vpp macos,"[29.701153243968964, 18.17671103953727, -10.516798593833286]"
2010,2010,2019-07-01 23:57:56+00:00,danypunkz skype microsoft teams,"[20.30618841335841, 30.283459886814434, -10.48085717948792]"
2011,2011,2019-07-01 23:57:53+00:00,finally got notified my e book refunds microsoft. it quite unfortunate they shut down i could buy final book the hisdarkmaterials trilogy.,"[24.926914473321137, 26.436842781995907, -11.271540563744466]"
2012,2012,2019-07-01 23:57:33+00:00,story how internal microsoft hackathon project turned the governance service now know azure resource graph,"[27.8907913645256, 28.010935250906357, -9.75098088661467]"
2013,2013,2019-07-02 23:59:47+00:00,diy free coupon howto power pivot microsoft excel udemy . free startups discount sale freebie learn course gratis onlineclasses onlinecourses udemy udemydiscount udemyfree,"[21.739082832268043, 40.15563983799444, -11.59875784989974]"
2014,2014,2020-11-24 18:59:40+00:00,"""doordash provides much flexibility."" meet d shea. whyidash deliveringgood","[11.480416523336576, 8.283201097836745, -11.144480898395528]"
2015,2015,2019-07-02 23:59:41+00:00,"thisguygetslit hermit thrush can recommend buying ibm compatible pc microsoft windows operating system perhaps linux distribution, one feels the call.","[75.62358573208098, 95.02649837730748, -8.728583902336837]"
2016,2016,2019-07-02 23:59:36+00:00,now i know offices likes use windows instead mac. microsoft excel windows much better easier shortcuts compared mac.,"[41.51588057383584, 34.444216715848185, 12.911276804444086]"
2017,2017,2019-07-02 23:59:33+00:00,we’re a licensed microsoft accessories partner,"[10.485435345975116, 19.715794548173065, -11.770181215752444]"
2018,2018,2019-07-02 23:59:32+00:00,so grateful the support some amazing women microsoft australia &amp; microsoft corp we launch this. i determined it t get missed i away travelling &amp; i a tribe supporters are excited this i am. womenitpros womenintech,"[39.68353260748821, 56.04541313170817, -1.992224734557496]"
2019,2019,2019-07-02 23:59:26+00:00,puzzled the many pieces microsoft powerpoint? curious new features? let create customized training plan your team deliver better presentations dawn thesoftwarepro.com,"[83.08486674674815, 67.19104248314422, -9.168588297924614]"
2020,2020,2019-07-02 23:59:23+00:00,"with excel, chart, even flight simulator, theres telling microsoft the power windows take this summer.","[15.31442960947567, 14.75074033613636, -9.681091269306208]"
2021,2021,2019-07-02 23:59:15+00:00,"with excel, chart, even flight simulator, theres telling microsoft the power windows take this summer.","[15.31442960947567, 14.75074033613636, -9.681091269306208]"
2022,2022,2019-07-02 23:59:09+00:00,create pie chart microsoft access,"[29.62111053629543, 30.233819531927484, -10.358430278061824]"
2023,2023,2019-07-02 23:59:06+00:00,"with excel, chart, even flight simulator, theres telling microsoft the power windows take this summer.","[15.31442960947567, 14.75074033613636, -9.681091269306208]"
2024,2024,2019-07-03 23:59:27+00:00,"amazon, microsoft, google plot pull product manufacturing of china, deepening cold war engulfing tech","[40.505706658103335, 51.960067527908585, -9.45236447792061]"
2025,2025,2020-09-03 18:26:48+00:00,"lenovo legion x playapex now your chance rise the rest. unmatched performance, purposeful engineering, modern design. gear with machine savage you are. stylish outside. savage inside.","[75.12134485437876, 53.35074368036726, 1.9353115696088565]"
2026,2026,2019-07-03 23:59:24+00:00,"this week techrepublic zdnet news stories include brand battle apple microsoft, word documents containing malicious links, the future on premises databases. via infosechotspot","[50.86964005461548, 49.641635344882474, 2.0843666610070812]"
2027,2027,2019-07-03 23:59:15+00:00,microsoft classic intellimouse logicool m,"[8.285024668912527, 19.666134440495092, -10.92268993176696]"
2028,2028,2019-07-03 23:58:47+00:00,"the startup beat google, microsoft &amp; apple combined | russia korea oakland southaustralia avcjsingapore paris miv initialcoinofferings italy mexico alibaba austin netherlands technews iot funding bitcoin icotracker money omaha uae","[109.81755722418988, 92.45669032178292, 27.374015549209915]"
2029,2029,2019-07-03 23:58:24+00:00,elegoo official add dm i your robot working ar microsoft datastreamer,"[25.90835300487397, 36.63559495136731, -9.584083518989885]"
2030,2030,2019-07-03 23:58:24+00:00,"facebook, cloudflare, microsoft, twitter suffer outages suffer outages twitter","[19.993939879177393, 10.300468735170917, -11.197453335437721]"
2031,2031,2019-07-03 23:58:17+00:00,an ongoing iranian government backed hacking campaign now trying exploit microsoft outlook flaw . the us cyber command issued alert hackers been actively going cve . the flaw a sandbox escape bug ...,"[108.18263581649339, 90.11665635608338, 4.409455232446348]"
2032,2032,2019-07-03 23:57:44+00:00,"youngest building first pc on os selection ""what mean have pay windows? that stupid ubuntu free"" microsoft ubuntu so very true son","[68.66770201090021, 55.16265171537694, -0.7513992236887219]"
2033,2033,2019-07-03 23:57:34+00:00,"facebook, cloudflare, microsoft, twitter suffer outages","[9.768058802646337, 9.90995896737111, -11.34556853486701]"
2034,2034,2019-07-03 23:57:15+00:00,"microsoft’s threat &amp; vulnerability management helps thousands customers discover, prioritize, remediate vulnerabilities real time","[34.881239525509876, 32.618461929941546, -11.093173132494051]"
2035,2035,2019-07-04 23:59:33+00:00,i the expert seeker achievement microsoft wordament mobile points trueachievements,"[32.692030333453346, 53.70567761559638, 1.4864026446452456]"
2036,2036,2020-11-25 17:06:25+00:00,learn the new cloud like way manage premise databases this depth article rds on vmware cloud solution architect blogger satyashr,"[63.96525067459205, 83.39114379494283, 3.5377354685069946]"
2037,2037,2019-07-04 23:59:29+00:00,puzzled the many pieces microsoft outlook? curious new hidden features? let create customized training plan your team dawn thesoftwarepro.com certifiedoutlookexpert outlooktips,"[70.83073173225556, 57.32630863996326, -9.221064131064736]"
2038,2038,2019-07-04 23:59:19+00:00,why microsoft feel like needed hire kpmg?,"[18.08830306094128, 11.45177436303657, -11.73319258521986]"
2039,2039,2019-07-04 23:58:12+00:00,clicked translate button translated dutch microsoft could translate tweet would english need translated ??,"[44.50627743099239, 73.55457293613314, 14.627278621281263]"
2040,2040,2019-07-04 23:56:27+00:00,mikesherov this way bet has since the moment microsoft bought github. it probably the only reason investor interested.,"[-0.4012055270250088, 15.461313012724418, -9.15434160792853]"
2041,2041,2019-07-04 23:56:12+00:00,my blog portal options microsoft dynamics formerly crm,"[18.84836597442707, 19.11874054340951, -10.398845812995766]"
2042,2042,2019-07-04 23:55:29+00:00,"makominogue very nice i remember really impressed how solid multitasking felt, i guess utilized hardware pre empting multitasking decade microsoft provided to normal customers windows .","[39.76705863025196, 47.959791212944126, -1.1552018774563209]"
2043,2043,2019-07-04 23:54:57+00:00,cpunrd true would microsoft give a name owned a competitor? just strange. cosmos == dynamo maybe i drinking enough data jungle juuce.,"[40.11131141028559, 38.50936819317285, -9.150892189242356]"
2044,2044,2019-07-04 23:54:07+00:00,"reasther cornell i tend agree your sentiments, especially the ""microsoft publishers"", elsevier... yes, s damning it sounds no, microsoft t slipped well deserved tarnished reputation","[43.331210916539014, 64.4083809322516, -11.6673006604437]"
2045,2045,2019-07-04 23:54:00+00:00,neowin microsoft creates hub all its insider programs,"[33.54326186720318, 32.27137060243889, -10.423854842051817]"
2046,2046,2019-07-05 23:59:41+00:00,"rtenews begrudgery a national pass time ireland. people point fingers artists like bono choose move a country lower tax rates, however, they cheer companies like microsoft move ireland the corp. tax rate lower the usa.","[112.61236414446074, 95.14589179088397, -9.104656602893769]"
2047,2047,2020-11-23 15:22:11+00:00,"do self manage databases premises today? read vexpert blog azizaqeelvm understand rds vmware help set up, operate, scale databases improve productivity lower costs.","[102.37215857537821, 64.7854888084819, 2.9593255706540305]"
2048,2048,2019-07-05 23:59:37+00:00,i achievements microsoft wordament mobile points trueachievements,"[18.255596085462717, 19.126510047802263, -10.627595950275513]"
2049,2049,2019-07-05 23:59:37+00:00,i the good be king achievement microsoft solitaire collection uwp points trueachievements,"[23.12742477529022, 52.33616116994877, 0.66403273666198]"
2050,2050,2019-07-05 23:59:36+00:00,i the snowfall success achievement microsoft solitaire collection uwp points trueachievements,"[23.068761861805836, 53.46451555877949, 1.1274575521719683]"
2051,2051,2019-07-05 23:59:09+00:00,microsoft sony may reduce production china due tariffs | digital trends,"[42.04829641125994, 43.857200894442315, 12.312145291736215]"
2052,2052,2019-07-05 23:57:27+00:00,"techbiznerd benedictevans you missing point. the world moved past whatever ibm microsoft doing they dominant world also move past whatever current big doing. competition t make ibm/microsoft irrelevant, the pace history and was w/ big","[72.66779553521947, 44.793875185883095, 3.7115636735387483]"
2053,2053,2019-07-05 23:56:37+00:00,new repositories created microsoft azure azure sdk native azure functions rabbitmq extension azure functions eventhubs extenstion github opensource azure,"[33.16687673236275, 42.838309492861484, -10.90150163676119]"
2054,2054,2019-07-05 23:56:35+00:00,new repositories created microsoft docs learn certs loc test.cs cz learn certs loc test.de de github opensource microsoftdocs,"[31.72114139446244, 29.24968883439047, -10.602441549715493]"
2055,2055,2019-07-05 23:55:46+00:00,"tommy sergerynazarov said are ""working"" them are partners microsoft bletchley integrate chainlink, that s everyone speculating that they will make announcement soon. fingerscrossed","[30.65476984807042, 46.18446955671406, -9.101829598942572]"
2056,2056,2019-07-05 23:54:40+00:00,microsoft discloses security breach impacted outlook accounts,"[42.26131348914754, 32.105621708829084, -10.309159229055041]"
2057,2057,2019-07-06 23:59:54+00:00,"guide nosql azure cosmos db e book | microsoft azure , see","[42.76352775797999, 52.13079784485951, -10.965537628675875]"
2058,2058,2020-09-03 18:26:48+00:00,"lenovo legion x playapex now your chance rise the rest. unmatched performance, purposeful engineering, modern design. gear with machine savage you are. stylish outside. savage inside.","[75.12134485437876, 53.35074368036726, 1.9353115696088565]"
2059,2059,2019-07-06 23:59:37+00:00,i the force of habit achievement microsoft mahjong win points trueachievements,"[22.026603336209984, 41.660873254279736, 1.461904687687337]"
2060,2060,2019-07-06 23:59:33+00:00,i the peak jumper achievement microsoft solitaire collection uwp points trueachievements,"[21.957291157357798, 42.970938439500834, 1.4257632309848418]"
2061,2061,2019-07-06 23:59:27+00:00,another software upgrade? switching microsoft office ? does team need be productive office office ? stop wasting time get to speed what need message here at dawn thesoftwarepro.com mct officeexpert,"[41.890428502211556, 48.25096875165518, -8.674834651522374]"
2062,2062,2019-07-06 23:59:25+00:00,"chloecondon docsmsft vaness diaz microsoft azure microsoftwomen microsoftsv linuxfoundation omg bashmouth. that single great, too, ""i t get enough you, ruby""","[30.387575113335433, 37.54858633699069, -11.86666719409007]"
2063,2063,2019-07-06 23:58:56+00:00,this to the stupidest decision microsoft made.,"[19.414220841571417, 21.187595903599313, -10.838752806979258]"
2064,2064,2019-07-06 23:58:51+00:00,potholedsea marc irl it a chimera microsoft haters salty pvpers,"[30.50060212210219, 20.62072028955432, -10.523961859280512]"
2065,2065,2019-07-06 23:58:21+00:00,berniesanders they take financial risk get that position.amazon started garage employs k. microsoft the and now employs k. warren buffet businesses employs k. their risk pays a boatload taxes.,"[107.15171669670701, 101.0200377990837, 39.72152813055071]"
2066,2066,2019-07-06 23:57:16+00:00,chloecondon docsmsft vaness diaz microsoft azure microsoftwomen microsoftsv linuxfoundation sounds like win me,"[22.94192521132328, 17.965971866985775, -11.706977615586844]"
2067,2067,2019-07-06 23:56:44+00:00,i love idea one paper bible given all microsoft employees around christmas billgates,"[51.89979549846583, 37.76631033555866, -11.040600057999171]"
2068,2068,2019-07-07 23:59:56+00:00,"amandaksilver code microsoft johnmont fully agree, what and team done code remote development features make best both worlds. browsers limiting still. i curious see how/if webassembly play role bridging gap permissions access filesystem etc.","[93.37162741353134, 59.03211964554727, -11.429355654346622]"
2069,2069,2020-11-23 15:22:11+00:00,"do self manage databases premises today? read vexpert blog azizaqeelvm understand rds vmware help set up, operate, scale databases improve productivity lower costs.","[102.37215857537821, 64.7854888084819, 2.9593255706540305]"
2070,2070,2019-07-07 23:59:54+00:00,"the startup beat google, microsoft &amp; apple combined | top funding fintech stratis portland denver bitcoin btc wavesplatform icos tokenmarket ico saltlakecity ethereum funds spain boise bitcoinrussia startup kualalumpur abraaj","[100.07861355625015, 89.76218010166644, 15.45687497572554]"
2071,2071,2019-07-07 23:58:54+00:00,windows security in question microsoft issues warning for m windows users,"[47.465847259770435, 18.708844971365835, -11.082695256794622]"
2072,2072,2019-07-07 23:58:46+00:00,karenselfkare mcjuggernuggets or actually s tesla gps. is microsoft cortana...i think,"[17.169635104643707, 29.045825013567484, -9.826312190795264]"
2073,2073,2019-07-07 23:58:07+00:00,"it high time. i believe schools learn, fuck devices. as work, everything twisted technology need promote product everywhere, unless course you are not the owner apple microsoft corporation.","[72.65834284294341, 71.31477164043764, -8.640635607232028]"
2074,2074,2019-07-07 23:58:03+00:00,"theap gearsofwar i mean halo still getting pumped , you any better ideas games let us microsoft know","[15.722681340209864, 16.624180292270594, -10.263424271693609]"
2075,2075,2019-07-07 23:56:43+00:00,"eisokant code microsoft johnmont the ergonomics remote development bring ton benefits dev box setup no longer pain, deeper analysis your inner loop, collab be much easier. it be a combination remote local. a browser based editor isn’t preferred all scenarios.","[94.31422788843197, 97.40489144505649, 1.2709883286674284]"
2076,2076,2019-07-07 23:56:19+00:00,"hopefully microsoft introduces “windows fuck off edition” tomorrow. an os doesn’t auto load services startup force spyware, updates, “cloud” bs etc... oh, doesn’t completely fuck everything audio every update...","[42.278627064773, 59.44916566112673, 1.4783868763050663]"
2077,2077,2019-07-07 23:56:07+00:00,"gates gets it right about steve jobs, microsoft premium","[29.580368223772954, 41.86043888778867, -9.944982007549072]"
2078,2078,2019-07-07 23:55:22+00:00,"remembered can get microsoft office free you a student, i guess college t a total waste","[35.97064982004044, 26.84777207256795, -9.089875563393974]"
2079,2079,2019-07-08 23:59:53+00:00,nyxtheshield this reminds of microsoft word back,"[5.649347325539186, 17.98810947304482, -10.483160587239006]"
2080,2080,2019-07-08 23:59:38+00:00,"upgrading new program? planning meeting conference? hire a microsoft certified trainer bring valuable software tips &amp; techniques your next meeting, onsite training workshop webinar. message here at dawn thesoftwarepro.com productivity mct","[87.52499259218796, 89.48854402730265, 4.701932373601593]"
2081,2081,2019-07-08 23:59:35+00:00,"grantwtrent it almost none existent the fps world, microsoft tried in halo the pc interface suprior the console . rts practically non exestant console. it s technically possible, the input interface hardware variations make uncompetitive","[102.48719627859684, 98.24256895889077, -8.627400431308999]"
2082,2082,2019-07-08 23:59:25+00:00,dismantling fileless campaign microsoft defender atp next gen protection exposes astaroth attack microsoft security,"[53.27166447842965, 43.46951430324303, 1.1067453683240984]"
2083,2083,2019-07-08 23:59:20+00:00,"rt microsoft ""we throwing back to celebrate ""neverending"" potential stem stranger things. learn strangerthings""","[52.368272242106826, 50.87242924276937, 2.171424024356355]"
2084,2084,2019-07-08 23:59:13+00:00,microsoft discovers fileless astaroth trojan campaign,"[20.98647717813841, 20.888495056203872, -10.69337712444105]"
2085,2085,2019-07-08 23:59:12+00:00,microsoft windows . app celebrates stranger things season,"[17.100885157972716, 27.22166365254089, -10.00711209132217]"
2086,2086,2020-11-23 15:14:07+00:00,pursuing career the trades? the dewalt trades scholarship could help pay degree a two year college vocational technical school. apply and start building your future.,"[41.35550089314271, 38.480712448995064, -9.750241852394211]"
2087,2087,2019-07-08 23:59:09+00:00,"microsoft stranger things well done, post looks great, checkout instacryptonews work great too.","[31.770318380401296, 24.875422443231223, -13.61407537009228]"
2088,2088,2019-07-08 23:59:07+00:00,angelurena jaketapper is any information who wrote or said before was written microsoft word screen shot?,"[25.12103606341667, 46.572489566677234, -8.370591911856309]"
2089,2089,2019-07-08 23:58:24+00:00,microsoft releases windows . throwback app a stranger things tie – ars technica,"[29.640722274486716, 28.939334902406245, -10.544919681900879]"
2090,2090,2019-07-09 23:59:37+00:00,i achievements microsoft solitaire collection uwp points trueachievements,"[20.512199094213766, 31.458366651943876, -10.591699541001702]"
2091,2091,2020-11-23 15:22:11+00:00,"do self manage databases premises today? read vexpert blog azizaqeelvm understand rds vmware help set up, operate, scale databases improve productivity lower costs.","[102.37215857537821, 64.7854888084819, 2.9593255706540305]"
2092,2092,2019-07-09 23:59:29+00:00,puzzled the many pieces microsoft excel? curious new hidden features? let create customized training plan your team dawn thesoftwarepro.com certifiedexcelexpert exceltips,"[70.83073173225556, 57.32630863996326, -9.221064131064736]"
2093,2093,2019-07-09 23:59:22+00:00,saracarterdc microsoft that would be my first question i would enjoy to have that opportunity to make figures,"[27.82803605533937, 3.801063060692797, -11.485238064684992]"
2094,2094,2019-07-09 23:59:21+00:00,check our azure event boise microsoft august th. info sign here,"[46.93418072103758, 66.92155456524773, -8.635934757813189]"
2095,2095,2019-07-09 23:59:18+00:00,"get your flow community ""user group member"" badge microsoft","[32.027847204085056, 50.86896679146318, -10.152202675261876]"
2096,2096,2019-07-09 23:59:12+00:00,that easy... cayde bungie destinythegame destiny destiny destinyforsaken titan hunter warlock ironlords blackarmory xboxone videogames gaming pvp pve raid clan new nine share microsoft content deej bng cozmo a dmg bungie destinythegame,"[42.45214622743979, 50.2657454018693, -9.635781506805216]"
2097,2097,2019-07-09 23:59:05+00:00,"this call center company relies a workforce incarcerated women help companies like microsoft, sap, dell power sales marketing","[18.480877797431706, 41.134243893667545, -10.324469010459026]"
2098,2098,2019-07-09 23:59:04+00:00,amazon microsoft battle bn war cloud contract pentagon,"[53.93089983401182, 53.850461649083925, -10.212623406120827]"
2099,2099,2019-07-09 23:58:33+00:00,"imagine telling that you say ""man think trust microsoft to build government artificial intelligence secret data cache""","[49.672359520425324, 42.71626228400655, 2.859469685327909]"
2100,2100,2019-07-09 23:58:17+00:00,real elliebrown saracarterdc microsoft happens over. it getting harder harder us natives get tech job.,"[46.922406155503246, 20.328726070411093, -10.964504950423432]"
2101,2101,2019-07-10 23:59:37+00:00,i achievements microsoft wordament mobile points trueachievements,"[18.255596085462717, 19.126510047802263, -10.627595950275513]"
