,Unnamed: 0,Time,Text,Sentiment
949,949,2019-03-27 23:59:28+00:00,"planning meeting conference? bring technology speaker &amp; microsoft certified trainer mct your next meeting, onsite training workshop, webinar add valuable software skills. message here at dawn thesoftwarepro.com conferencespeaker techspeaker","[100.5164317970276, 112.89729669418163, -5.794330341584143]"
950,950,2019-03-27 23:59:23+00:00,"ph business leaders, workers positive ai’s impact jobs per microsoft idc study","[51.58689226974003, 58.826662894969566, -10.483331478474554]"
951,951,2019-03-27 23:59:23+00:00,"ai increase innovation, employee productivity almost two fold, says microsoft idc…","[42.529173462618694, 43.1792467971399, 1.4529634670062705]"
952,952,2019-03-27 23:59:22+00:00,juneise it’s trying be cool edgey it honestly looks like something done microsoft,"[10.798595457693526, 6.5766512800847465, -12.866079258933425]"
953,953,2019-03-27 23:58:51+00:00,"thanks sharing bradsmi insights, we leverage technology, partners, make others cool. redhat azure openshift cloud redhatpartners microsoft openshift openatmicrosoft azure","[35.067420769557984, 46.683489013065554, -12.744096701416368]"
954,954,2019-03-27 23:58:36+00:00,"i like automate things there this great feeling get set things run without manual intervention. it makes you feel ""powerful"". i scripts code pieces to backup stuff like microsoft sql server databases see my... ke","[93.15804069784882, 41.81081092599406, -11.098338973977818]"
955,955,2019-03-27 23:58:36+00:00,"i like automate things there this great feeling get set things run without manual intervention. it makes you feel ""powerful"". i scripts code pieces to backup stuff like microsoft sql server databases see my... ke","[93.15804069784882, 41.81081092599406, -11.098338973977818]"
956,956,2019-03-27 23:58:26+00:00,"free programming courses harvard, mit, microsoft more davidwalshblog","[21.191904598951528, 20.232137705013233, -10.633759582546602]"
957,957,2019-03-28 23:59:47+00:00,"security researcher charged computer misuse uk admitting hacking microsoft nintendo, estimate the cost damages ~ .m tom warren/the verge tech","[69.74905431077133, 64.06775749918093, -8.867442301640764]"
958,958,2020-11-25 17:06:25+00:00,learn the new cloud like way manage premise databases this depth article rds on vmware cloud solution architect blogger satyashr,"[63.96525067459205, 83.39114379494283, 3.5377354685069946]"
959,959,2019-03-28 23:59:39+00:00,"graphoniac excel ""reporting problem microsoft"" outlook pling excel error report","[30.353859454970394, 12.306436366441467, -11.735894559733453]"
960,960,2019-03-28 23:59:33+00:00,"pjiggles fun fact original creators said tweet they plans a new game no idea microsoft plans do banjo. sorry m, cuphead more likely this point. we will get a microsoft rep of microsoft nintendo have been recently","[97.2291917855966, 84.14719522632102, 3.7658160835710675]"
961,961,2019-03-28 23:59:25+00:00,what microsoft azure why i use it? musiccomposer alctraining cloud cloudcomputing microsoft cc avrohomg archonsec topcybernews sbucloud drjdrooghaag bentleyaudrey digitalcloudgal alaricaloor,"[35.980301786064885, 29.036868377556615, -9.77479517913357]"
962,962,2019-03-28 23:59:06+00:00,microsoft removal xbox enforcement sign petition via change,"[36.194238709831886, 15.710699135684386, -9.846851573674805]"
963,963,2019-03-28 23:59:01+00:00,microsoft the cloud provider a research team dedicated advancing genomic understanding protecting patient data. learn,"[41.55560397059729, 51.0131426696315, -9.637753478286015]"
964,964,2019-03-28 23:59:00+00:00,"collect signals your existing security solutions combine with trillions daily signals microsoft non microsoft services, apps, endpoints &amp; infrastructure.","[61.823706391759316, 40.100590459176644, 2.454565230878515]"
965,965,2019-03-28 23:58:26+00:00,microsoft power bi &amp; gravity software better together mspartner dynamicscrm projectmanagement msdynsl dynamicssl contractor insights propertyinvestors cfo controllers accountingsoftware isv powerapps,"[42.5435108191451, 30.72665292208825, -11.205833875596966]"
966,966,2019-03-28 23:57:40+00:00,microsoft tackles iot security new azure updates,"[18.894600702054078, 17.104485506042355, -10.574223212919051]"
967,967,2019-03-28 23:57:38+00:00,"payment methods uk microsoft points, xbox live codes, license transfer &amp; paypal skype volkylobbies","[63.74889276398269, 74.18426115656682, -8.666848437427035]"
968,968,2019-03-29 23:59:43+00:00,kantrowitz maryjofoley fxshaw carmencrincoli sbisson marypcbuk jsnover halberenson i don’t know i ended on thread i also in awe microsoft beat reporters,"[15.1468072547915, 8.348099351512928, -11.067651205658095]"
969,969,2020-11-25 17:06:25+00:00,learn the new cloud like way manage premise databases this depth article rds on vmware cloud solution architect blogger satyashr,"[63.96525067459205, 83.39114379494283, 3.5377354685069946]"
970,970,2019-03-29 23:59:43+00:00,kenradio bill gates he develops microsoft then i would invest the stock.,"[40.982647390693565, 39.74427540054898, -9.305952626097891]"
971,971,2019-03-29 23:59:31+00:00,another software upgrade? switching microsoft office ? does team need be productive office office ? stop wasting time get to speed what need message here at dawn thesoftwarepro.com mct officeexpert,"[41.890428502211556, 48.25096875165518, -8.674834651522374]"
972,972,2019-03-29 23:59:30+00:00,"grrl geek amtwo erinstellato sqlmal ryanjadams hope foley sqldba sqlchicken sqlpedro sqlha microsoft we apologize any confusion. microsoft employees are eligible submit sessions &amp; posting communications this topic, please stay tuned. the passsummit cfs will stay open april pm utc provide time anyone still wishes submit","[93.07200543809692, 90.5708924948528, 4.567800472710488]"
973,973,2019-03-29 23:59:16+00:00,"rt classtechtips ""have tried microsoft forms? so many great features a free course teachers mieexpert ""","[21.05770414377876, 16.90971803276245, -12.44341279629161]"
974,974,2019-03-29 23:59:10+00:00,"generating ideas some the t mobile engineers the “closer the customer” hackathon the georgia institute technology atlanta, ga. march , . enochkumala oncampus georgiatech artificialintelligence hackgt computervision microsoft tmobile","[72.99646817166472, 52.77199721339292, -8.422777305005113]"
975,975,2019-03-29 23:59:06+00:00,how microsoft uses people analytics improve sales,"[40.087087284649336, 50.993264508140754, -9.413157485680372]"
976,976,2019-03-29 23:58:56+00:00,new repositories created microsoft fabrikate production cluster demo axe sarif converter github opensource,"[55.122001808151886, 44.66047131487613, 1.6715170241973212]"
977,977,2019-03-29 23:58:53+00:00,"maryjofoley fxshaw carmencrincoli sbisson marypcbuk jsnover chrissyfarr halberenson wow, microsoft beat sounds fun","[11.848449693484355, 6.45063048684267, -13.347524762243985]"
978,978,2019-03-29 23:58:53+00:00,tbohannon i would need picture the email microsoft the purchase confirmation the points. ^jp,"[29.02449612425497, 29.502113555592153, -9.724261987769182]"
979,979,2019-03-30 23:59:27+00:00,"come check our emojiscale app emojiscale microsoft &gt;&gt;, . agileminder . emojiscale . emojiscales, emojiscale agileminder machinelearning artificialintelligence ai simulations animations &gt;","[17.96295282744666, 37.63440772351066, -10.214680629163027]"
980,980,2020-11-25 17:06:25+00:00,learn the new cloud like way manage premise databases this depth article rds on vmware cloud solution architect blogger satyashr,"[63.96525067459205, 83.39114379494283, 3.5377354685069946]"
981,981,2019-03-30 23:59:11+00:00,anyone start getting scam calls “apple” saying apple id been compromised? guess got tired acting like microsoft?,"[0.9896607791257608, -3.2970820374376903, -11.702127646179221]"
982,982,2019-03-30 23:58:19+00:00,"briinanaa microsoft thinks re speaking danish, can understand lmao","[27.30789908849024, 8.887439995555582, -10.629123558571585]"
983,983,2019-03-30 23:57:58+00:00,microsoft xbox star wars limited edition rd themed console .,"[63.70245144636028, 77.27356918260506, -10.082576461591955]"
984,984,2019-03-30 23:56:14+00:00,say google apple microsoft anyone hiring auditors? i’m best forensic auditor my company i think it’s time move to bigger things bigger numbers. that i don’t like working an oil company right xp,"[35.20638965376039, 37.536941882009, -8.904519077124817]"
985,985,2019-03-30 23:56:10+00:00,rt mscloud discover healthcare organizations using microsoft cloud solutions protect patient data unauthorized disclosure more,"[55.21005763129015, 65.66484410973139, 14.223977391339503]"
986,986,2019-03-30 23:55:15+00:00,come check our emojiscale app emojiscale microsoft &gt;&gt; it really cool. emojiscales agileminder,"[7.268544842424366, 24.442441102099792, -11.394316912228035]"
987,987,2019-03-30 23:54:01+00:00,steezo the god said i could translate not even microsoft could translate ignorance,"[41.39176610252091, 34.21733111158224, 1.5584222034983526]"
988,988,2019-03-30 23:54:00+00:00,human plus ai ? s automation creates real.... newtechnology microsoft,"[21.001543197087297, 40.19755802066341, -10.448345739641887]"
989,989,2019-03-30 23:53:52+00:00,"msftdynamics join us learn updates how optimize business msdyn, power bi, powerapps, microsoft flow. register today","[16.843163024267202, 25.095196367323886, -10.089402123323282]"
990,990,2019-03-31 23:59:58+00:00,the best news marchmadness dukebasketball season ended the hands michiganstate. shared via microsoft edge takeaways duke season ending loss michigan state,"[57.863483800446566, 30.26435147984924, -0.5488184886520315]"
991,991,2020-09-03 18:26:48+00:00,"lenovo legion x playapex now your chance rise the rest. unmatched performance, purposeful engineering, modern design. gear with machine savage you are. stylish outside. savage inside.","[75.12134485437876, 53.35074368036726, 1.9353115696088565]"
992,992,2019-03-31 23:59:36+00:00,"if microsoft could release office software same across operating systems, would fantastic. this apple macbook user is becoming frustrated her excel spreadsheet class the lack commands.","[56.36548519789806, 70.62530430816192, 11.501098006540062]"
993,993,2019-03-31 23:59:32+00:00,puzzled the many pieces microsoft excel? curious new hidden features? let create customized training plan your team dawn thesoftwarepro.com certifiedexcelexpert exceltips,"[70.83073173225556, 57.32630863996326, -9.221064131064736]"
994,994,2019-03-31 23:59:18+00:00,ps vs. new xbox microsoft could win next gen console war with this feature,"[50.48572892914634, 56.489967104100074, -8.750747550927343]"
995,995,2019-03-31 23:58:33+00:00,microsoft unveils new surface book model intel’s latest quad core processor,"[30.268744103043776, 47.93598891725324, -9.728771725999081]"
996,996,2019-03-31 23:58:23+00:00,"check kinect sports season two microsoft xbox , previously played used via ebay","[53.48299822734206, 34.99434865896718, -8.690653515484854]"
997,997,2019-03-31 23:57:28+00:00,"man talking papavey racers topic went diddy kong racing. that game deserves revival. it the ctr n was ctr the dkc ps? either way microsoft ninty on good terms, let make happen.","[41.59800448076543, 73.6376876057992, 13.967280050948588]"
998,998,2019-03-31 23:56:39+00:00,". microsoft made many security enhancements, acquisitions across platforms services the past years becoming leading vendor","[17.62423940367005, 16.487845949546468, -10.518595914998045]"
999,999,2019-03-31 23:56:05+00:00,"ebaydeal dead rising microsoft xbox one,","[26.73788677166455, 19.89557579435707, -10.830078665990257]"
1000,1000,2019-03-31 23:56:02+00:00,microsoft unveils new surface book model intel’s latest quad core processor,"[30.268744103043776, 47.93598891725324, -9.728771725999081]"
1001,1001,2019-04-01 23:59:50+00:00,impactcloud coming together support nonprofits oktane twilio splunk box org docusign salesforceorg tableau microsoft workplacebyfb,"[20.162442103904265, 19.351876390746696, -10.625057183545074]"
1002,1002,2020-11-23 15:22:11+00:00,"do self manage databases premises today? read vexpert blog azizaqeelvm understand rds vmware help set up, operate, scale databases improve productivity lower costs.","[102.37215857537821, 64.7854888084819, 2.9593255706540305]"
1003,1003,2019-04-01 23:59:32+00:00,change can be hard ... let make it easier upgrading microsoft office ? does team need be productive a new program? let create engaging &amp; valuable training experience. message here at dawn thesoftwarepro.com mct change,"[33.33752871119807, 52.6077468214916, 1.0095828518547165]"
1004,1004,2019-04-01 23:58:54+00:00,microsoft slaps apt/charming kitten domains – naked security,"[40.939557649165216, 20.726156210462843, -10.532302780369257]"
1005,1005,2019-04-01 23:58:52+00:00,new repositories created microsoft webauthntest wtime mcco fabrikate production cluster demo github opensource,"[32.05540602791471, 21.593875534638954, 0.8818340207031454]"
1006,1006,2019-04-01 23:58:25+00:00,microsoft’s surface book gets processor boost – techcrunch,"[-0.9176132581065446, 17.632629994002283, -11.162109572395721]"
1007,1007,2019-04-01 23:58:09+00:00,"mrmckinnell kvoge clinty irvspanish misterwashburn not tech integrator, would like be. doing micro courses currently; gfe , adobe spark cert., microsoft design thinking, iste cert, common sense digcit.","[62.89993986298824, 42.722268373886536, -10.523809653455785]"
1008,1008,2019-04-01 23:57:59+00:00,want process ca ppm clarity data microsoft excel? use rego excel data manager. watch demand demo cappm clarity excel regoguide,"[65.14530489652735, 86.28453554392443, 3.4950754405645768]"
1009,1009,2019-04-01 23:57:58+00:00,vitogesualdi tbh things keep going way do microsoft nintendo i t call impossible,"[37.52537075790351, 20.90185258386242, -10.366197169824417]"
1010,1010,2019-04-01 23:57:45+00:00,messages love support spotted the women bathroom a microsoft office downtown bellevue microsoftlife,"[9.508046824418006, 5.864846276873649, -12.694858976814544]"
1011,1011,2019-04-01 23:57:37+00:00,azure model import new tables microsoft account option missing azure,"[35.292685907502694, 29.285502710480454, -11.151103649614832]"
1012,1012,2019-04-02 23:59:46+00:00,boing boing microsoft announces will shut ebook program confiscate customers libraries. via googlenews,"[60.27186348294441, 41.78075407348711, -9.686349148406137]"
1013,1013,2020-10-02 15:59:10+00:00,learn an overhaul nj competitive energy market would force state ratepayers pay higher electric bills.,"[75.90714873141168, 54.40067857506985, -10.12013890209613]"
1014,1014,2019-04-02 23:59:42+00:00,"phantomofmobile tweet alqamar askwoody deskmodder etguenni computerbase microsoft i think he. does windows run business software? as long the answer is yes, i be.","[12.06267525832887, 35.22870851685846, 2.8158033996586056]"
1015,1015,2019-04-02 23:59:39+00:00,"chromium microsoft edge can play k netflix video, unlike chrome","[41.03372713448364, 32.91294495841132, -10.969182866207703]"
1016,1016,2019-04-02 23:59:39+00:00,war zero days lessons recent google &amp; microsoft vulns,"[40.34705814458745, 48.915964717096934, -9.501928954955275]"
1017,1017,2019-04-02 23:59:34+00:00,"microsoft stops selling ebooks, will refund customers for previous purchases","[53.920521614942054, 41.97993375795991, -9.664787261858635]"
1018,1018,2019-04-02 23:59:33+00:00,experiencing alerting failure issue azure portal many data types – / – investigating microsoft,"[72.9651840725788, 36.57389842919255, 1.2566220288719876]"
1019,1019,2019-04-02 23:59:32+00:00,bwm use microsoft iiot cloud open manufacturing,"[17.430412691140727, 17.77298355132765, -10.233809791813258]"
1020,1020,2019-04-02 23:59:28+00:00,"new ebay tom clancy the division standard edition microsoft xbox one,","[62.052705925034196, 62.06412026427954, 2.4736281763254624]"
1021,1021,2019-04-02 23:59:26+00:00,"whenever i type microsoft word, i always stop mid sentence word, thinking it gonna automatically pop for to click enter","[56.26354096350088, 59.848617582130174, 1.9084824010967196]"
1022,1022,2019-04-02 23:59:10+00:00,"new post windows central news, forums, reviews, help windows all things microsoft. ""rage really feature cheat codes ""","[51.53652409145914, 27.933809980973862, 1.9788745356708262]"
1023,1023,2019-04-03 23:59:58+00:00,thank labfour training after hours in class &amp; as many home make brochure. i may drop now &amp; get an hour job upsstore fedexoffice ? to microsoft office spec.,"[29.38233347984549, 30.022478394747225, -9.683345218800397]"
1024,1024,2020-11-25 17:06:25+00:00,learn the new cloud like way manage premise databases this depth article rds on vmware cloud solution architect blogger satyashr,"[63.96525067459205, 83.39114379494283, 3.5377354685069946]"
1025,1025,2019-04-03 23:59:49+00:00,samsykesswears so pleased know i an actual gamer. although i hit level microsoft solitaire. that helps waiting raid pulls.,"[38.592999848216785, 39.5324928919852, -12.527771361106687]"
1026,1026,2019-04-03 23:59:37+00:00,microsoft excel a powerful often ignored tool. entmagazine some ideas improving time management excel spreadsheets. sharpbusinesssystems businesstips officeequipment,"[42.57809363754258, 41.86970909355264, 1.2807353179699277]"
1027,1027,2019-04-03 23:59:27+00:00,microsoft researchers discovered fault the shenzhen based company’s software described as achilles’ heel could abused attackers seize control users’ machines.,"[59.865751396183796, 40.6935350207301, -10.092466894120363]"
1028,1028,2019-04-03 23:59:23+00:00,puzzled the many pieces microsoft word? curious new hidden features? let create customized training plan your team dawn thesoftwarepro.com certifiedwordexpert wordtips,"[70.83073173225556, 57.32630863996326, -9.221064131064736]"
1029,1029,2019-04-03 23:59:12+00:00,"milkdromida multysmoke meinos kaen ghawblin hyperu isaacevans trioxide borderlands microsoft it not bad, ya.","[28.271472472690586, 22.50779595465562, -11.573489093994432]"
1030,1030,2019-04-03 23:58:54+00:00,new repository created microsoft docs mslearn distribute load traffic manager github opensource,"[29.698495058806987, 21.0638119087726, -11.231059859078158]"
1031,1031,2019-04-03 23:58:00+00:00,"why berkeley meng? because the unique combination technical expertise leadership devleopment, told honghao qiu, meng ‘ ieor , product manager, microsoft","[10.942595178656536, 44.262462282347705, 11.963154393211425]"
1032,1032,2019-04-03 23:57:39+00:00,akamai edge delivery integrates w/ microsoft azure media services &amp; blob storage expressroute streaming mspartner ai cloud,"[73.91215118200532, 65.56576280792156, -10.051549062049034]"
1033,1033,2019-04-03 23:57:34+00:00,adobe microsoft team up challenge salesforce themotleyfool stocks msft adbe crm,"[18.54478615524673, 19.05905163226756, -10.235099748186087]"
1034,1034,2019-04-04 23:59:57+00:00,"we argue the editorial the platform surveillance special issue surveillance &amp; society payment the emerging platform battleground after microsoft partnered mastercard, apple partnering goldmansachs","[30.815138596688943, 17.79987810609012, -11.567687202969523]"
1035,1035,2020-11-25 17:06:25+00:00,learn the new cloud like way manage premise databases this depth article rds on vmware cloud solution architect blogger satyashr,"[63.96525067459205, 83.39114379494283, 3.5377354685069946]"
1036,1036,2019-04-04 23:59:56+00:00,visualstudio visual studio come microsoft azure education?,"[8.542638330621418, 18.223796182229055, -10.671937360438012]"
1037,1037,2019-04-04 23:59:52+00:00,microsoft intel. they t even.,"[17.57290374107765, 8.428007670776129, -10.680445037811246]"
1038,1038,2019-04-04 23:59:29+00:00,"billgates microsoft they did, sir, did. and better of the time.","[39.278833564198365, 39.683013174852405, -9.683576983599295]"
1039,1039,2019-04-04 23:59:26+00:00,microsoft turns years old today,"[6.1765982849397405, 5.914719289185406, -10.298329844754377]"
1040,1040,2019-04-04 23:59:23+00:00,"xamarin.ios . release notes xamarin | microsoft docs april , xamarin.ios ... this release based xamarin.ios . and xcode . final release.","[81.2766159282349, 64.53969730010321, -8.960014171705708]"
1041,1041,2019-04-04 23:59:22+00:00,xamarin.ios . release notes xamarin | microsoft docs,"[39.8412236184183, 31.42140740313547, -10.475804330494874]"
1042,1042,2019-04-04 23:59:19+00:00,puzzled the many pieces microsoft excel? curious new hidden features? let create customized training plan your team dawn thesoftwarepro.com certifiedexcelexpert exceltips,"[70.83073173225556, 57.32630863996326, -9.221064131064736]"
1043,1043,2019-04-04 23:59:17+00:00,leaked microsoft email chain reportedly describes hellish workplace women – gizmodo,"[30.73258124074347, 32.86691157015845, -10.058898956119073]"
1044,1044,2019-04-04 23:59:15+00:00,new titan fall xbox one ebay uk titanfall microsoft xbox one games very good condition,"[51.11166395187057, 39.05917266504139, -11.134190155776722]"
1045,1045,2019-04-05 23:59:11+00:00,"right on, microsoft \m/","[19.921763246771484, 30.361264478495606, -10.35578593980874]"
1046,1046,2020-09-03 18:26:48+00:00,"lenovo legion x playapex now your chance rise the rest. unmatched performance, purposeful engineering, modern design. gear with machine savage you are. stylish outside. savage inside.","[75.12134485437876, 53.35074368036726, 1.9353115696088565]"
1047,1047,2019-04-05 23:58:44+00:00,new repository created microsoft tiny calc github opensource,"[8.596203555349302, 8.903073838024067, -11.403502567803578]"
1048,1048,2019-04-05 23:58:36+00:00,"masoodmustang kakar harsha sharad goil we working . solar technology n e completely doped solar technology . digital payment system almost executed india successful . hyper loop system . all it/cs giants there manufacturing firm are still progress like microsoft ,apple. /n","[104.42313549266798, 106.01642213845507, 9.113478718480238]"
1049,1049,2019-04-05 23:58:34+00:00,"well is pretty disgusting. microsoft some serious exorcising their organization do, swiftly.","[28.92783352477404, 19.195406711268376, 0.6858741909030144]"
1050,1050,2019-04-05 23:58:28+00:00,microsoft microsoft updating... not shut down.,"[26.940874842126806, 22.138132898442656, -11.583738344343764]"
1051,1051,2019-04-05 23:57:55+00:00,formation microsoft azure site recovery,"[9.132322529299731, 18.721672831654242, -10.791012107791762]"
1052,1052,2019-04-05 23:57:26+00:00,"soundsmythprod josh snares i think s actually paintbrush, photoshop. otherwise s the bloody eraser tool in microsoft paint my god","[37.537199360076336, 37.33160310133138, 1.1839527122142783]"
1053,1053,2019-04-05 23:57:19+00:00,formation microsoft azure site recovery,"[9.132322529299731, 18.721672831654242, -10.791012107791762]"
1054,1054,2019-04-05 23:57:02+00:00,"dozens female microsoft employees claim deal shocking behavior work requests sit coworker lap, called a b tch","[98.48600214009451, 92.10315482879979, 3.583658502929282]"
1055,1055,2019-04-05 23:56:23+00:00,has anyone microsoft actually used something than hyper v? what shitshow.,"[11.797104603843056, 7.035366372485569, -10.225289389911765]"
1056,1056,2019-04-06 23:59:35+00:00,"get billions trillions later . and s legal. if want do heist, introduce law make legal. top ""donors"" presidential elections goldman sachs, jp morgan chase, citigroup, morgan stanley. microsoft, google, time warner, harvard","[27.06198521139334, 35.862845498440834, 1.4956147875434453]"
1057,1057,2020-11-23 15:22:11+00:00,"do self manage databases premises today? read vexpert blog azizaqeelvm understand rds vmware help set up, operate, scale databases improve productivity lower costs.","[102.37215857537821, 64.7854888084819, 2.9593255706540305]"
1058,1058,2019-04-06 23:59:33+00:00,microsoft shutting its healthvault patient record service,"[21.241758732300152, 41.53004237062219, -10.499569913993646]"
1059,1059,2019-04-06 23:59:33+00:00,"uk investigating microsoft, sony, nintendo over subscription plans","[19.31292422594218, 21.377787115374176, -10.092270498910466]"
1060,1060,2019-04-06 23:59:33+00:00,"uk investigating microsoft, sony, nintendo over subscription plans","[19.31292422594218, 21.377787115374176, -10.092270498910466]"
1061,1061,2019-04-06 23:58:54+00:00,"how preorder microsoft new surface pro , surface.... microsoft gogadgets tablet","[28.165668449285253, 18.25085665545034, -10.309790037994297]"
1062,1062,2019-04-06 23:58:39+00:00,"jaydubcity sonyoflastation given sony’s business practices market reality forced microsoft focus consumer friendly policies services, i’d say xbox good position disrupt market again. will beat sony in sales? probably not. does make xbox a bad platform? nope.","[121.72353592960395, 109.22453477828138, 11.115507679845464]"
1063,1063,2019-04-06 23:57:21+00:00,cnbc how army plans use microsoft high tech hololens goggles the battlefield. via googlenews,"[35.734572025949014, 15.902026195414138, -9.26250265142312]"
1064,1064,2019-04-06 23:57:18+00:00,"markjacobsohn microsoft azure best luck, jake. looking forward working you this new role","[23.143168410642435, 27.17913294656025, -11.95473419023385]"
1065,1065,2019-04-06 23:57:04+00:00,"uk investigates microsoft, nintendo, sony game service practices engadget via googlenews","[19.402155620506694, 20.59074457092325, 0.7387298484237803]"
1066,1066,2019-04-06 23:56:02+00:00,microsoft shutting its healthvault patient record service,"[21.241758732300152, 41.53004237062219, -10.499569913993646]"
1067,1067,2019-04-07 23:59:49+00:00,microsoft drops safe removal usb drives as default in windows,"[51.94624652038422, 27.864925583970525, -10.888326395509438]"
